url,title,text,age,city,status,body,zodiac,diet,facial hair,drinks,eye color,religion
http://providence.craigslist.org/stp/5427872462.html,Lets Share Our Secrets - m4mw,"
I'm a middle aged very open minded guy who will listen and share our deepest darkest secrets...i'm even a late bloomer bisexual, now that is a story...lol...i'm not concerned with your age, race, body, as i think the mind is definately the most sexiest part of the body...we can email..meet for coffee, etc...whatever you feel comfortable with....i am discreet and this will be our little secret...interested? 
",58,providence,,average,,,,,,
http://providence.craigslist.org/stp/5427871054.html,Bisexual Is So Cool.....Even For Us That Are Older - m4w,"
Do You Agree Bisexual is Beautiful?....A late in life turn for me, I've discovered i am turned on bi men...women...ts's.. I Didn't Realize I was Truly Bisexual..Maturity Has Made Me Relaxed About it...I would like to meet someone between 40 and 60 to enjoy the Real Best Of Both Worlds and share our thoughts and views . I'm 58 yo..slim build, 5'9 175, mellow and layed back 
",58,providence,,hwp,,,,,,
http://providence.craigslist.org/stp/5437336137.html,Looking for a college sb - m4w,"
Looking for a college sb in the RI and near by south eastern Mass area to spoil on a regular basis. I have had success in the past recent years and looking to do it again. I have paid for ink new iphones bills and so on. Open to all college females between 18-22 please be attractive and drama free. I am open to all varieties of ethnic groups. Looking to get along both inside and outside the bedroom. So if you can carry yourself well in public thats a plus. Email me if interested and we can see where this goes. Thanks.
",34,providence,single,average,,,,,,
http://providence.craigslist.org/stp/5437316092.html,where are ya long term email buddy!!!!!!! - w4m,"
I just enjoy some nice email conversations only. I'm a single woman in my mid 40's. Would prefer someone over 40. Tell me a little about yourself and what you enjoy doing. All variations of attachment or not are welcome to reply. Since its only email!!! 

One liners or someone who can't read and just sends me their stats, phone number or pic will be deleted. That also means you don't know anything about how to start a regular conversation if your only replying in that way. If your looking to hook up or meet anyone then you are looking in the wrong section. NOT LOOKING TO MEET!!! 

I'm only posting in the ""platonic"" section. If your going to use your phone/ipad an you can't type all that much or don't want to make the effort to really type a decent reply back. Then move along an find someone else to reply to.

I want someone who really can carry on a conversation via email only. Who can talk about whatever comes to mind about what's been going on in their day/lives. Someone with a sense of humor is a plus. Who doesn't get offended easily and can go with the flow of the conversation.
",,providence,,,,,,,,
http://providence.craigslist.org/stp/5437234819.html,Two girls and board games - w4m,"
We're two girls looking for two guys to come play some board games and get to know one another, no sex just hanging out. 
Age 18-27
Please send a message with a picture and we'll send one back
",20,providence,,,,,,,,
http://providence.craigslist.org/stp/5437185199.html,looking to bro out - m4m,"
hey what's up, 
i recently moved back to ri looking for normal friends to chill with
my names tyler I'm 23 looing for laid back, down to earth dudes to hang out with, 
know its weird af but i like chill in in underwear, i feel like it builds camaraderie and builds friendship quicker. 
I'm down to each earth. I like talking and movies 
looking to chill sunday hit back if you looking to chill (nothing sexual plz)
",23,providence,,average,,,,,,
http://providence.craigslist.org/stp/5437112063.html,Looking for a down to earth girl - m4w,"
I'm just a regular, laid back, down to earth guy looking to meet a nice girl. I appreciate the little things in life. I love to make people laugh, and I have a sarcastic, dry sense of humor. I work full time at AAA and a few nights at Stop & Shop. Bonus points if you're a Red Sox fan and/or have a dog.

Don't worry, I won't ask to ""Netflix and chill."" I'm better then that. I don't even have Netflix anyway. 

Please be D&D; free! No pic = no reply. Please put REAL in the subject.
",29,providence,single,average,,,,,,
http://providence.craigslist.org/stp/5399009742.html,Nintendo or Movies anyone? - m4m,"
Whats up, Im playing Super Mario 3d World and was looking for someone to come over and be a second player till the wee hours of the morning or we can watch a movie! I know its kinda sad putting up an ad to play video games and watch movies but hey there's got to be someone else out there who is down, anyways hit me up if interested I'm a nice guy and unlike most ads there is no hidden agenda so give me a chance.
",31,providence,single,average,,,,,,
http://providence.craigslist.org/stp/5435646081.html,QUESTION FOR THE LADIES - m4w,"
I wantd a girls opinion on long hair on a guy. Is it attractive? I have had it both short and now long. Just curous as to what looks better Any advice is muc appreciated
",,providence,,,,,,,,
http://providence.craigslist.org/stp/5436896821.html,Night Owl here - m4w,"
I usually stay up til like 3 AM and just surf the net. I would like to find any other late niters so we can have a conversation. So if you are up late and want to chat about whatever get back to me, thanks.
",59,providence,,,,,,,,
http://providence.craigslist.org/stp/5425609095.html,come spend the night/vice versa?! - m4w,"
any other night owls looking for a cuddle buddy? 
friends only, lets cuddle and get cozy..
come here, or i can come over :)
white male in my 20's, email if ur into this, ill give u my number, and make this happen!
",,providence,,,,,,,,
http://providence.craigslist.org/stp/5436926349.html,Girl friends only totally plantioc - w4w,"
Are there any real normal sane females out there ? I'm 29 have a job license car place to live and hopefully you do as well. I'm not a cab or a bank I'm a friend I want to hang out with you not drive you to see other people. Do you like the gym tanning fitness nails dining out karaoke the beach do u just like having fun then message me totally real legit can voice verify text Facebook and meet in person. Let's make 2016 an adventure. Please no games drama bullshit.
",29,providence,,,,,,,,
http://providence.craigslist.org/stp/5397035299.html,Rent-a-Husband - m4w,"
Please read fully. This is NOT a post for sex, or anything like that.

I am an out of work professional and am available for those chores/tasks (AKA, ""Honey, can you fix this, or put up that, or move that?"") How many times have you wished that you had a resource that could help you with various things around your home?

I am an engineer, have had a thorough background check, do not have any criminal history, do not smoke, and do not do drugs of any kind. I am merely offering my services to those that would appreciate them.

I am in my early 50s and am handy. I am quite adept at installing technology, fixing things around the home, and especially good with computers. I am also available for tutoring any science (except biology) and any math up to and including Calculus I. I have been told that I am a gentleman, easy to talk with, and polite. I have also been told that I have a guy next door (easygoing) personality.

Rates are based on the task and quite reasonable. I live in Jamestown and am serving the surrounding communities and South County.

Again, this is a serious post, and I am in no way looking for anything more than to provide you with a handyman type of service. I am after all very much a gentleman.

Thank you for reading.

PS
No job is too small, and when in doubt, just ask.
",,providence,,,,,,,,
http://providence.craigslist.org/stp/5418196567.html,Married friend - m4w,"
body : athletic height : 6'3"" (190cm)

Hello. �
I'm looking for a married woman for friendship and to share things in common which are many( good and bad)since we're both married. 
I do like to see who I'm talking to so I would like to share pics. If there's a connection after a while and there's mutual attraction, maybe we can meet for a coffee. 
I am looking for a woman who is friendly and attractive. I'm not looking to change anyone's life
I am tall with nice eyes and smile(yes I had braces lol), college educated with a good job.
Put favorite band/musician in subject line so I know you're real.
",,providence,,athletic,,,,,,
http://providence.craigslist.org/stp/5429918883.html,married man looking for email texting friend - m4w,"
Hi,
I'm a married man..,50 y/o...190lbs..5'11
Just looking to exchange email or text on and off when time allows. You can be married..single...divorced..does'nt.matter. We could talk about anything other than politics or religion...lol. I have varied interest and hobbies. Looking for an open minded, fun loving lady who likes to shoot the breeze. If your interested, please feel free to contact me...thanks.
",50,providence,married,,,,,,,
http://providence.craigslist.org/stp/5436767376.html,Texting friend - m4w,"
Hello there. Thank you for taking the time to look at my ad. I love to text sort of a hobby. I also love talking to new people. I want to be up front we are going to email a couple of times before I just hand out my phone number. I want to be sure the person I am talking to is real. I do not like to talk on the phone so please do not call me. I am putting this in the platonic section because I have no problems with us being friends. I will say I do like flirting even if you are my friend. I am not opposed to things developing if it happens but I do not want to lead anyone on and not what I am looking for but no one knows. If there is anything that you want to know about me feel free to ask. Please change the subject line to something original so I can weed out the bots.
",40,providence,,,,,,,,
http://providence.craigslist.org/stp/5432079047.html,Your Psychic Friend - m4w,"
Have you ever wanted confirmation, or clarification about what is happening in your life?

Do your own thoughts at times distort or override your own intuitive instincts?

Are you curious, as to how accurate and meaningful a reading would be to you?

I am blessed to have worked with my gifts extensively over the past few years. I do readings for friends, and other business associates. My accuracy in discerning and reading energy with very little information has been affirmed over and over again.

What I am offering for you today is a simple one card reading. All that I ask is that you reply to this post and provide your ""First Name"" in the subject line.

If you find the one card reading relevant, you can ask for more information about other types of readings I do. I do these readings for ""free"" and will never ask you for money. 

I am a male in my early 40's who doesn't live in your area. I am not looking for a date. I am simple offering to share my gifts with you. Have a blessed and wonderful day.
",,providence,,,,,,,,
http://providence.craigslist.org/stp/5436615673.html,Super Bowl Friend - m4w,"
I'm looking for a woman who is interested in watching the Super Bowl with a fun guy. 

I'm 49, professional, 5' 10"" with a sense of humor and enjoys a good time. 

We can watch the game at a bar or at my apartment. 

No games, just looking to watch the game with someone with the same interest. Non-smoker appreciated. Mature woman - late 30's - early 50's. Body, hair and other details don't matter. What matters is a fun minded, positive attitude and can string a sentence together!
",49,providence,separated,,,,,,,
http://providence.craigslist.org/stp/5436276544.html,Can a girl make just friends seriously,"
So I like to think of myself as a pretty laid back chill person non demanding non judgemental I get along with anyone and can have fun doing just about anything from bowling to karaoke Netflix and smoke I like science art design fashion not afraid to play sports or go hiking just looking to make some cool friends male or female like 21 to 40 tops and again no sex no orgy no three some no sex just in case some how you got the wrong idea or got confused what section you are in
",29,providence,,fit,,,,,,
http://providence.craigslist.org/stp/5436044657.html,Look for some local fun now - m4mw,"
Looking for someone to come over it's local and spend some time in bed with me. From mild to wild older single Dad here that need a release looking for her younger bi F/m
For fun I have some 420 and perc to give yeah for a clean fun bi or strieght time!! I like to please younger female with a wet pussy Could this be you. I can host all day please send back a pic and a little about what you want and need and you can text me if your Real and interested
show contact info
",,providence,single,athletic,,,,,Hazel,
http://providence.craigslist.org/stp/5414075226.html,Talk to me - m4w,"
Looking for a person who needs an ear to unload to. Be it your hub, bf, gf, fwb, who ever doesn't get you, or just pissed you off. I'm not looking to add another body to the mix, so any Ummm fwb from me is strictly by way of KiK conversation. I've tried posting to meet and nothing but fakes. Trying here cause frankly, I'm tired of, hey verify here, send to xyz email. You want to talk hit me here or send me your KiK an. No subject off limits so feel free to let loose. It all stays private, same goes if you send pics. Yea I'm a guy so if you send I'm gonna look. So be honest, be legal (18+), and well under ummm 45. Again I'm not looking to change your status, don't plan on meeting unless you have all 3 of my weaknesses. No I'm not telling you what they are.. And no, I'm not some Joe stud looking for a ""F"", more like avg Joe who lacks chat friends. Come talk and see if im ..... Me
",,providence,,,,,,,,
http://providence.craigslist.org/stp/5428549856.html,I Like A Conservative Woman - m4w,"
I'm a wm in my 50's and old school, I'm looking for a woman with common sense, who can see that all the problems in this country have a source, and not afraid to talk about it...is that you?
I don't care if you are short, tall, thin, bbw, I'm more concerned with your way of thinking, we can email, start with a cup of coffee, or whatever you would be comfortable with.
",58,providence,,average,,,,,,
http://providence.craigslist.org/stp/5416459982.html,Attrac Ez-going Man Seeks Massage Exchange with like-minded Woman - m4w,"
Hello,
I am a 57yr-old div man who loves massage - giving and receiving. I am not licensed but have exchanged massages with 2 licensed massage therapists for several years and they both said I was as good as most LMTs. I am seeking to meet someone who also loves massage and see if we click and can do this on a regular basis. I am easy-going, gentle, a little spiritual, fairly attractive, and also have a good sense of humor. I am about 5'10 and 177 lbs and live in the East Greenwich Area. If this interests you drop me a line? Thanks!

New England Man 

",57,providence,,average,,,,,,
http://providence.craigslist.org/stp/5406792460.html,If you have an interest in cars and automotive things we should chat!,"
I hope everyone is doing well! My name is Tom, I am a straight male who is looking to meet people who have an interest in cars and anything to do with automotive type of things. Whether you enjoy working on vehicles or just like looking at them it would be nice to meet some likeminded people. If you enjoy going to different automotive events like any type of auto racing, truck and tractor pulls, car shows, and honestly anything automotive I would be interested in chatting. I love anything to do with being outdoors! I realize most automotive events are over till spring, but it would be nice to meet people who are into this type of stuff over the winter! I am in the business of selling new and used auto and truck parts. I ship auto parts all over the country. Feel free and visit my website and be sure to like Tom's Auto Parts on facebook!

http://www.tomscarparts.com

http://www.facebook.com/tomsautoparts

",37,providence,,,,,,,,
http://providence.craigslist.org/stp/5435909399.html,Looking for XBox One GamerGirls - m4w,"
Looking for XBox One friends for online g