url,city,subcity,datetime_created,datetime_updated,category,type,title,text,age,body,body art,diet,dislikes,drinks,drugs,education,ethnicity,eye color,facial hair,fears,hair,height,hiv/hsv/hpv,interests,"kids, have","kids, want",likes,native language,occupation,personality,pets,politics,religion,resembles,smokes,status,weight,zodiac
http://oklahomacity.craigslist.org/msr/5458428319.html,oklahomacity,,2016-02-21 16:20,2016-03-05 13:13,msr,m4w,beta,"
The thing that sticks at the forefront of my mind is this inherent ability to ""move when I move."" That the beta would be focused and aware of every subtle signal. The source of this focus would need not be love and care, but the ""ideal"" scenario would include this. Let's define ""move when I move:""
No matter the mission, the trail, the hunt, or the battle, the beta should be right at the shoulder. Having the ability to move ahead, yet the awareness to keep that pace to excellence of respect. If you watch Wolves, when the Alpha does something, there is immediately noticeable reaction throughout the pack. The Alpha moves, the beta moves and in some cases the beta makes sure the rest of the pack is in movement and deference.
In the absence of the Alpha, the beta assumes the role of alpha. This is such a position of trust. That the Alpha can absolutely trust in the fact that the beta will make the same decisions, exercise the same authority and care for all things in the same manner that the primary Alpha would is huge...RARE.
What sort of person makes a beta? This is the person whom can and will submit at the appropriate time. One who has no resentment nor reservation in doing so. This in not mindless submission, but that excellence of respect. Could this person be a little? Yes. Could this person be a submissive? Yes. Could this person be a domestic? Yes. Could this person be a switch? Yes. In fact this person could be from any sort of lifestyle aspect, the key is to have the heart in place. (The trick here is to not be so full of oneself that they rush headlong and reckless into things). Consider this analogy; A bear comes into the territory. (Literal or figurative). It is the Alpha's job to engage the bear, to make the stand. The beta is right there bite for bite, but doesn't engage first or alone.

Let's discuss loyalty for a moment:

Full Definition of loyal
1
: unswerving in allegiance: as
a : faithful in allegiance to one's lawful sovereign or government
b : faithful to a private person to whom fidelity is due
c : faithful to a cause, ideal, custom, institution, or product
2
: showing loyalty
3
obsolete : lawful, legitimate

(Paying particular attention to ""b"")

faithful, loyal, constant, staunch, steadfast, resolute mean firm in adherence to whatever one owes allegiance. faithful implies unswerving adherence to a person or thing or to the oath or promise by which a tie was contracted . loyal implies a firm resistance to any temptation to desert or betray . constant stresses continuing firmness of emotional attachment without necessarily implying strict obedience to promises or vows . staunch suggests fortitude and resolution in adherence and imperviousness to influences that would weaken it . steadfast implies a steady and unwavering course in love, allegiance, or conviction . resolute implies firm determination to adhere to a cause or purpose .

Why would I mention loyalty? Aside from it's obvious merits, there is an implication of an exchange. Without being too wordy, we all have an expectation of this exchange. It's the human nature that we don't give generously without some expectations of receiving. It is also the human nature not to extend generously first.
With that being said, as a reactionary person myself, I can easily see this reservation. However, I know in my heart that I could go all in on a clearly understood agreement. My honorable reality check is the simple fact that I would never ask for more than I could deliver myself! (I'll speak more on this nearer to the end)
Now seriously, why would I bother to write this? Am I seeking sexuality as a priority? Not hardly! I recently closed my sexual bucket list. I have been insanely fortunate in sexual escapades. Having literally experienced everything I ever fantasized about leaves this huge opportunity and focus toward something more substantial. Without boasting, this does merit a bit of elaboration...
I have engaged far and above my own league, as well as having dredged the depths of depravity. Some things that are probably best forgotten. I have had love and I've had quicky squirts. So this becomes no elaborate play in chasing orgasms. Hell I can rub one out myself in five minutes. All things considered, my focus is now able to be shifted.
Okay, if sexuality is somewhat removed as an exchange point, then what would truly impress me? I'll tell you...
I am in pretty fair shape for my age. I've had a lifestyle that has included a relatively healthy diet, a tendency towards working out, an inclination towards mutual combat and I appreciate the same. So physicality is a notable issue. I am far from perfect and ideal goal myself, but the simple inclination to try is impressive. (Note: perhaps there will be a touch more about this).
Can you put 3 rounds inside a dime? Now understand this, I don't necessarily seek a gun lover, but an inclination towards profiency is impressive.
Ride a bike? One of the sexiest things I've ever seen is a female handle her own bike.
Cook? I'm a good cook, I think it's fair to match my skill, or at least an inclination to attempt to match me is impressive.
Creative? That's always cool, shows the active mind.
Cool attitude? The ability to take the things as they come with an ""appropriate"" response is a lovely thing. I think they call that grace.
Pick up a dropped ball and pass it back into the game? Outstanding! Expecting the same in return? Absolutely reasonable.
Seem like a shopping list? Seem unreasonable? Seem like it's etched in stone? Not so much really. Not anymore than some of the ""lists"" as I've seen as subs have presented. Seriously though as I present this as an ideal, there's plenty of room for inclusive negotiation.
Back to physicality for a moment...
As previously mentioned, I have dated over and above, (and in fact been deeply involved with such). I admitted to allowing myself even beneath my own standards. My point being that I do believe in once again an honorable reality check. Do I expect celebrity model looks? Not hardly. In fact for some years, I literally swore off of overly attractive females for several notable reasons. At the same rate, I see no need to habitate and endorse less than my own equal, (no ego involved here). One thing I kinda like is a somewhat less attractive female rocking a porn star or athletic body. Let's face it, as a visual aspected male and equally true to the female aspect is that there must be attraction involved. On a side note: I always seek this unique factor. Be it an alternative look, or a cool personality trait, interesting ink or special talent. Honestly though, at the same rate, I can lose it over an idiosyncrasy or quirk. Race or ethnicity have no bearing in the matter. Age is certainly negotiable, but history has shown that I do better with those younger than myself.
So we come back to the exchange. Simply put, you get what you give. Or you may flip the script and expect me to give first, which in fact I would do!
Now let's bring realistic expectations in. I am on a mission to live small. To be efficient and minimize wasteful ways of being. This does in fact, include all aspects, monetary, time wise, career wise...everything. So there's no offer of highstyle living, no bribery, no gold to have, only golden moments. I'll certainly invest myself equally and whole heartedly. Obviously I'm not and cannot seek the proverbial sugar momma, at the same rate, neither am I a sugar daddy. I don't care if someone comes from a humble background, in fact it might even be a preference. But there's simply no easy meal ticket here.
So what is my part? My bills are paid, I never miss a meal except by choice, I entertain myself and or my s.o. at a nice level. A quiet life with some exaggerated adventures here and there.
This has degenerated to the lowest common denominator, it is in fact a personal ad. All the details, the lifestyle aspects, the D/s and/or bdsm interactions are utterly and completely negotiable under recognized protocols. I'm sure there's tons of deal breakers and limits that might wreck an idealistic supposition or proposal such as this. Without demonstrating a poor or pessimist attitude, I clearly recognize the challenge as presented. However, if I do not speak to the hearts desire, I plainly stand no chance whatsoever.
Please present inquiries on the private message.
I thank you.
",53,,,,,,,,,,,,,,,,,,,,,,,,,,,,,
http://oklahomacity.craigslist.org/msr/5454195731.html,oklahomacity,,2016-02-18 17:01,2016-03-04 18:31,msr,m4w,Fisting Fetish,"
Hi
I had an ex who loved fisting and since then I've always had a fetish for it. there's nothing hotter than seeing a woman cum hard when taking a fist.

Do you like the feel of a fist, a huge dildo, a large vegetable, the bottom of a wine bottle? Well, you get the picture.

If you're a woman who enjoys fisting or extreme penetration or has a fantasy about trying something like this you should reply.
If you're up to taking something large then we should plan to meet up and see what we can fit in there. If you've never tried this before and would like to try feel free to respond too.
I am gentle and work slowly until you can get it all in.
",50,average,,,,,,,,,,,," 5'7"" (170cm)",,,,,,,,,,,,,,divorced,,
http://oklahomacity.craigslist.org/msr/5457890367.html,oklahomacity,,2016-02-21 10:19,2016-03-04 12:18,msr,mw4w,Sister-Wife/Friend/LTR Wanted,"
We are a couple looking for a Sister-wife to share our home and life with. If you are not familiar with that term it is basically just a 2nd wife in the home of a polyamore relationship. We want to find that special lady that wants an easy life filled with love, travel and a great couple to spoil you. We want someone that wants to be part the very loving and caring long term relationship that we already have. 

We share all responsibilities in the home, we all take care of each other and we all love each other. We are financially secure enough to not want for anything. We would like to find someone that wants a secure, safe and loving home that enjoys taking care of others and being taken care of.

Please no children at home & non-smoker a must. We prefer someone that is HWP and enjoys being active and having a lot of fun.

We do have dogs so you cannot be afraid of animals. We are in our 40's, nice looking, in great shape, financially secure and a lot of love to share with you. Come live an easy life, vacation with us, live a spoiled life and let us please you.


Thanks
",,fit,,,,,,,,,,,,,,,,,,,,,,,,,,,,
http://oklahomacity.craigslist.org/msr/5473319720.html,oklahomacity,,2016-03-02 13:05,2016-03-02 13:21,msr,t4m,passing through NORMAN...HOPE WE CAN CHAT,"
Hi...im in Norman for a bit ans wanted to meet a nice guy for lunch or maybe a drink...maybe more. Wont be in Norman long. So hit me up. Im chocolate...if tht helps. If you want a picture of me. I suggest you send one first of you...just not your DICK and i will greatly reply bk with my photo.
",25,curvy,,,,,,,,,,,," 5'8"" (172cm)",,,,,,,,,,,,,,single,,
http://oklahomacity.craigslist.org/msr/5468350624.html,oklahomacity,,2016-02-28 09:03,2016-03-02 00:41,msr,m4w,28 blk male,"
You seek you shall find!!! I'm waiting for you...please send pic as I will the same
",28,average,,,,,,,,,,,," 6'2"" (187cm)",,,,,,,,,,,,,,single,,
http://oklahomacity.craigslist.org/msr/5471861976.html,oklahomacity,,2016-03-01 14:09,2016-03-01 14:48,msr,m4m,"Lonely, soft-spoken gay male seeking friendship/LTR","
I am 46, white, 5'8"" 165lb, with short, thinning brown hair that I keep shaved and hazel eyes. I am seeking friendship/LTR. No one-night stands. I love to cuddle, to be held and feel protected. I am soft, sensitive and passive. I would be the ""wifely"" type in a relationship. I do not smoke, drink, nor do drugs. I am seeking a guy who is : HIV-, disease -free, relationship-oriented, height-weight proportionate (thin and smooth is a plus), a non-smoker, non drug-user, have short hair, and likes to take charge. I do not care how masculine or feminine you are as long as you are not to the extreme either way. You must be between 25 and 40 only. I am open to relocation, down the road, for the right person, or hope to find someone to come to Phoenix.
",46,average,,,,,,,,,,,," 5'8"" (172cm)",,,,,,,,,,,,,,single,,
http://oklahomacity.craigslist.org/msr/5471066202.html,oklahomacity,,2016-03-01 01:40,2016-03-01 01:58,msr,mw4w,Couple searching for a lady,"
My boy friend and I are looking for a lovely lady to spend time with us.

We are both in our 40s , long haired , tall and thin rocker types but I'm not super thin, I still have curves . Very secure with ourselves and each other. 
We are smokers or vaporers. 
We are not magazine models but clean, thin, pretty and sexy all the same.
We are extremely clean and groomed but again we are long hairs.
Blood tests provided from both of us.
We like mirrors and toys a lot!!!
We are hoping to find a girl for fun around the house and of course tender, intimacy and euphoria. 
Don't get the wrong idea this is for me as much as it is for him and of course YOU. We both want this.
We are a very active couple and have limited time is why we've decided to post here. 
We are in the public eye some so must be discreet please. 
We are givers. Very affectionate and intimate. Very sensual.
The kind of girl we desire is thin(ish) and pretty , clean as heck, well groomed and not promiscuous except with us of course. Maybe a married lady looking to get out of her hum drum life style.
Not looking for a pro. Don't care if this is your first time we'll treat you respectfully and discreetly. Looking for someone who has their own life going and wants to be sensual and loving on the side.
No bondage types.
We want to rock some lucky ladies world. Hopefully not just a one night stand but you have to start somewhere right?
No drugs and only moderate drinking please.

Pretty tall order I guess. Any girls out there want to have some fun?
We are here for you. Nothing ventured nothing gained.....
",49,fit,,,,,,,,,,,," 5'8"" (172cm)",,,,,,,,,,,,,,divorced,,
http://oklahomacity.craigslist.org/msr/5450084832.html,oklahomacity,,2016-02-16 04:58,2016-02-29 21:26,msr,m4t,{Bi Black guy looking for fwb or boyfriend},"
*READMY ENTIRE AD*

Hello, I am a 22 year black male that want to find a mtf boyfriend (Not required I just like really feminine. guys). I have been looking for a while and would like to be able to find one that is willing to work with my situation and love me for me.
I am attached but its an open relationship 
I really want someone close to my age and feminine.
cross-dressers
trans gender
or regular males
please email me or kik me
my kik is wolfwood1
and i can text but you ll have to ask for my number thru email or kik
I'm a TOP btw
",22,,,,,,,,,,,,," 5'11"" (180cm)",,,,,,,,,,,,,,,,
http://oklahomacity.craigslist.org/msr/5468129701.html,oklahomacity,,2016-02-28 00:47,2016-02-28 00:47,msr,m4t,Looking for a LTR with someone special,"
Hi, I'm a 43 s/w/m looking for someone to spend time with and looking today for a good hot time, must be 18 and up, ddf, no mind games. If this is truly you and you are looking for the same then get back to me. FWB are ok, as long as it is on a everyday bases that we talk and get together a lot. I do love sex and looking for someone that is not afraid to have sex, I will swallow for the right person, and would like to try anal.
",43,average,,,,,,,,,,,," 5'8"" (172cm)",,,,,,,,,,,,,,single,,
http://oklahomacity.craigslist.org/msr/5458977238.html,oklahomacity,,2016-02-22 04:48,2016-02-27 12:37,msr,mw4w,Wantin a girlfriend,"
We are an interracial couple.. White-female.. Black male.. Were are lookin for a girl to have fun with.. We've never done this before.. I am currently 6 months preg and craving a women's touch.. (Five8zero)..He doesn't have to be involved but let him watch and if thing go well we can do more:)... Were down to earth.. Both 26 yrs old.. Like to go campin, fishin, and dancin. Lookin for someone in the NW area.. We live in a small town so this needs to be discret.. Friends in public and more at home..;) We can host..(4nine7).. Sometimes travel.. Would love a girlfriend type.. Have sleep overs type thing.. Looking for a attractive white female clean around the ages 21-27.. (7onefive8)..Average size.. Active...slim but a thick ass and pretty tits is a plus.. A pretty girl who likes to get a lil dirty!! Send pics.. Phone number in ad.. The sooner the better.. Were ready to see how this goes!! NO MEN or COUPLES!!
",26,athletic,,,,,,,,,,,," 5'3"" (160cm)",,"Campin, family, trying new things",,,,,,"Fun, active, experimental, outgoing",,,,,,partnered,,
http://oklahomacity.craigslist.org/msr/5465826178.html,oklahomacity,,2016-02-26 12:50,2016-02-26 12:50,msr,m4m,you need a new start homeless ltr live in fuck buddy,"
Be real send a pic stats alittle about you not a one time thing. Im a white male verc clean std free looking for a live in fuck buddy ltr im 42 6ft 210.clean no stds verc looking for a white lite skin slim to average verc 20s to 40s that whats a new start go to school and is willing to be monogamous im not looking to sleep around im very sexual kissing cuddling oral top bottom i like it daily but just want it to be with one person so send me a pic and lets talk remember that this is you moving to live with me im not in okc.
",42,average,,,,,,,,,,,," 6'0"" (182cm)",,,,,,,,,,,,,,single,,
http://oklahomacity.craigslist.org/msr/5462764675.html,oklahomacity,,2016-02-24 12:34,2016-02-24 12:34,msr,mw4w,"stable, secure couple looking for sister wife","
we are a secure couple/family and would like to open our doors to the right woman to join us as a member of our family for a all the love and friendship any woman deserves. we want to lift u up when u are down, and back u up when you are struggling. we will care for as a best friends and lovers should. if u want to know more send us a reply. include a pic and tell us about yourself.
",28,average,,,,,,,,,,,,,,,,,,,,,,,,,,married,,
http://oklahomacity.craigslist.org/msr/5462110879.html,oklahomacity,,2016-02-24 00:29,2016-02-24 00:54,msr,m4t,looking for my gurlfriend!!!,"
Hello I'm 31 Hispanic male looking for my lost half, if u want to know more about me let me know
",31,average,,,,,,,,,,,," 5'8"" (172cm)",,,,,,,,,,,,,,single,,
http://oklahomacity.craigslist.org/msr/5461243125.html,oklahomacity,,2016-02-23 12:59,2016-02-23 13:23,msr,mw4w,W4W or W4WM,"
W4W or W4WM
Looking for a woman who is more into women then men.
Would like to get to know you first via KIK doesntmatter_76
Then a meet and greet
W4W is ok he can play with the wife only. If you want more there are ways to achieve that.
You can just watch us also
Not looking for a one time thing.
",36,average,,,,,,,,,,,," 5'4"" (162cm)",,,,,,,,,,,,,,married,,
http://oklahomacity.craigslist.org/msr/5460997069.html,oklahomacity,,2016-02-23 10:51,2016-02-23 10:51,msr,m4w,Looking to hang out,"
Hey looking to hang out an see where it goes I'm in edmond I'm real if you wanna hang send a picture an put in the subject line date Ty for checking out the ad
",,athletic,,,,,,,,,,,," 6'1"" (185cm)",,,,,,,,,,,,,,,,
http://oklahomacity.craigslist.org/msr/5424957121.html,oklahomacity,,2016-01-29 14:48,2016-02-22 09:48,msr,m4t,divorced dad of two,"
I am 29 looking for someone to chat with make a new friend if possible. 
Ive dated TS before, this isn't a fetish thing I am not seeking out sex what so ever
just looking to maybe start something if not make a new friend...
",29,athletic,,,,,,,,,,,," 6'0"" (182cm)",,,,,,,,,,,,,,divorced,,
http://oklahomacity.craigslist.org/msr/5459003804.html,oklahomacity,,2016-02-22 06:03,2016-02-22 06:16,msr,m4m,"seeking twisted farmers, ranch hands and cowboys","
Looking for open minded guys with land to Fuck on. Clean ddf only. Give me a creampie or jerk off and give me a facial. Thicker is better. Multiple cocks is awesome. Heavy multiple cummers and shooters is a huge plus. Age not important. 18+. I'm free after 530pm most days.
",33,,,,,,,,,,,,,,,,,,,,,,,,,,,,,
http://oklahomacity.craigslist.org/msr/5417944593.html,oklahomacity,,2016-01-24 22:36,2016-02-21 23:06,msr,mw4w,Loving fun couple seeking,"
We are a married couple. We enjoy spending time with our 2 kids the youngest is 4 we love hanging out with each other friends and family. We are normal down to earth couple the only thing is I'm bi sexual we want a girlfriend for us both a third person in our relationship to hang with be like a true friend and lover long term we are attractive fit really into working out we enjoy dinner movies outdoors sports grilling concerts and having laid back chill nights as well we don't drink smoke or do pda in front of our kids we are responsible and mature only area we are kinda crazy in is in the bedroom
",34,athletic,,,,,,,,,,,," 5'6"" (167cm)",,,,,,,,,,,,,,married,,
http://oklahomacity.craigslist.org/msr/5418762522.html,oklahomacity,,2016-01-25 13:38,2016-02-21 16:07,msr,m4mw,just want to watch,"
Plain simple just seeking a couple to watch have sex from start to finish will not touch or join only touch myself all races welcome can be discreet also
",,,,,,,,,,,,,,,,,,,,,,,,,,,,,,
http://oklahomacity.craigslist.org/msr/5421611376.html,oklahomacity,,2016-01-27 11:29,2016-02-16 14:42,msr,mw4w,Attractive fun couple seeking girlfriend/playmate,"
I'm a 32 year old attractive female Blonde 5'6 130 .He is 30 year old attractive male 6 feet tall 205. I am wanting to find a girlfriend to have fun with talk too shop with watch movies with at home go out with me and my man once a month and be naughty with.We like to watch ufc go shopping have poker nights watch football go dancing or comedy club or go to concerts we also like staying in to watch sports and movies . We go out once or twice a month. But are always having people over or going to peoples house's for fun when cant go out.We have 2 kids 12 year old girl and a baby boy. Want a full time playmate/ girlfirend for me and my husband. We have found several girls to have fun with but no super cool chic close to my age that is bi and fun . It would be great if live close to us Message me if interested and height weight proportionate and close to our age and we can meet and see if hit it off. We are non smokers dont use drugs but occasional drink
",34,athletic,,,,,,,,,,,," 5'6"" (167cm)",,,,,,,,,,,,,,married,,
http://oklahomacity.craigslist.org/msr/5427682798.html,oklahomacity,,2016-01-31 14:59,2016-02-14 20:16,msr,w4mw,Looking for a Couple,"
I am a 29 year old unattached bi-female. I live in Oklahoma City and can host when needed. I am thick but not a bbw. I am looking for a couple that is open to ""dating"" and more. I want to be able to have a conversation with you as well as go down on you. Lol. Anyways.. I'm real, there is an ice storm moving in tonight. Let's chat and see where it takes us. Send me your kik, hopefully we can group convo.
",29,average,,,,,,,,,,,," 5'7"" (170cm)",,,,,,,,,,,,,,single,,
http://oklahomacity.craigslist.org/msr/5446820332.html,oklahomacity,,2016-02-13 15:47,2016-02-13 15:47,msr,t4m,FtM for possible relationship,"
I'm a mid twenties trans man looking for a casual relationship. I'm a student and I work, so sometimes I don't have a lot of free time but I love chatting with people.
",,,,,,,,,,,,,,,,,,,,,,,,,,,,,,
http://oklahomacity.craigslist.org/msr/5444483280.html,oklahomacity,,2016-02-12 02:39,2016-02-12 02:39,msr,mw4w,"stable, secure couple looking for sister wife","
we are a secure couple/family and would like to open our doors to the right woman to join us as a member of our family for a all the love and friendship any woman deserves. we want to lift u up when u are down, and back u up when you are struggling. we will care for as a best friends and lovers should. if u want to know more send us a reply. include a pic and tell us about yourself.
",28,average,,,,,,,,,,,,,,,,,,,,,,,,,,married,,
http://oklahomacity.craigslist.org/msr/5442993387.html,oklahomacity,,2016-02-11 00:56,2016-02-11 00:56,msr,m4t,trans women ARE women!,"
Hi, ladies! So... I am posting this ad basically to come out and say that YOU are beautiful! I feel more men should be emotionally supportive and open about about attraction to trans women. I am also attracted to cis women, but women are women. This isn't a ""fetish"", I just wanted to put myself out there. Trans woman are courageous and as a man that is trans attracted I figured I should take a leap and be open too. I am really just looking to meet a really cool women. So... Here I am. Open and honest. I am in to goofy, spooky stuff but can have a real meaningful conversation. I want to clarify AGAIN this isn't a ""fetish"" or ""dirty little secret"". I am definitely interested in meeting some cool new people. So... Message me back if you feel like talking and getting to know me. Pic for Pic. Also a little about yourself. Also the pic don't need to be ""naughty"", it's just nice to know who I am talking to. I would would post pics with the ad, but the site is being glitch... ðŸ’©
",33,big,tattoos,,,sometimes,,,mutt,hazel,,,black," 6'0"" (182cm)",,"occult imagery, comedy, post-punk, horror, the color black, goth, metal, synth pop, new wave, shitty rap, general esoteric shit...",,,,,,upbeat with a dark sense of humor.,,left as fuck,searching for enlightenment,,sometimes,divorced,,â™Š gemini
