url,city,subcity,datetime_created,datetime_updated,category,type,title,text,age,body,body art,diet,dislikes,drinks,drugs,education,ethnicity,eye color,facial hair,fears,hair,height,hiv/hsv/hpv,interests,"kids, have","kids, want",likes,native language,occupation,personality,pets,politics,religion,resembles,smokes,status,weight,zodiac
http://oklahomacity.craigslist.org/msr/5399727802.html,oklahomacity,,2016-01-12 13:06,2016-02-09 12:21,msr,m4mw,bull seeking a submissive cuckold couple who wish to be owned,"
im looking for a submissive cuckold couple who preferably are both looking to be made into sex slaves.
405
You both would be fucked and used on a regular basis. I am a easy going guy but rules would be set in place for you both and strictly enforced.432
i expect at least one of you to always be available for use at all times. I do not care if you have children as that can be worked around easily enough.4613
I am also willing to get my cuck couple pregnant if you both wish.

I require that you be in the norman area and at least one of you be ready for you at nearly all times but willing to make accommodations.

I have done this with many couples so far and it has worked well with them all.

I am 6 foot very stocky build and good looking if rough.


Reply back with a description of you both and your limits and kinks and lets see where things lead.

I am willing to teach you both and guide you thru this life style but you both must be dedicated to me to allow me to do such.

You are to put ""Hello Sir"" in the subject line along with your ages and every one from about 16 to 48 are willing to apply as i am looking for that one lucky couple and maybe a second if they every thing i am looking for
You may also text me but include all three info and what your wanting in the first message
",28,,,,,,,,,,,,,,,,,,,,,,,,,,,,,
http://oklahomacity.craigslist.org/msr/5436472222.html,oklahomacity,,2016-02-06 12:50,2016-02-06 12:50,msr,w4mw,Need to relax,"
I'm a Mwf. 40 size 20-22 (big)tall and looking to relax. Not looking for a one night stand but more for someone I can be comfortable with. It can be a single or couple but I do ask for a long hard one. I'm looking to relax a little this evening. Disease free. 420 OK. U host. No pic will get zero response. Let me know what you have to offer.
",40,heavy,,,,,,,,,,,," 5'10"" (177cm)",,,,,,,,,,,,,,separated,,
http://oklahomacity.craigslist.org/msr/5435125205.html,oklahomacity,,2016-02-05 13:58,2016-02-05 14:28,msr,m4mw,Prof WM in Norman 15th through 18th,"
Mature male 53yo Prof brown hair and eyes, 6' muscular build looking for a LTR with a nice couple
",53,,,,,,,,,,,,,,,,,,,,,,,,,,,,,
http://oklahomacity.craigslist.org/msr/5434390244.html,oklahomacity,,2016-02-05 03:06,2016-02-05 03:06,msr,m4w,Jason Aldean night,"
Ladies - simply wanting a nice woman that is attractive and classy and a bit sassy to date and 
Learn about each other to determine if it could develop into a real deal or if we end up friends is still okay. I am serious
About the concert. It's tonite. Put your favorite color in the subject
And a pic and I will send you mine.
",,average,,,,,,,,,,,," 6'1"" (185cm)",,,,,,,,,,,,,,divorced,,
http://oklahomacity.craigslist.org/msr/5433865257.html,oklahomacity,,2016-02-04 16:18,2016-02-04 17:52,msr,m4w,Dom man seeking sub/slave women,"
Well the title states the primary point. 
What I'm looking for is a woman who knows that they are submissive or thinks that they might be. From a fuck pig who enjoys degradation and hard core use to a baby girl sub who wants it more sensual and a firm guiding dom where punishment is merited rather than doled out for fun. I'm open to all ages from young - 80 as long as you have the desire to serve me we can talk and see if it will all work out.
All races as well however I will be honest I'm extremely picky when it comes to black women. 
I'm open to exploring all kinks no matter how odd you may think it is.
",23,average,,,,sometimes,,,,,,,," 6'4"" (193cm)",,,,,,,,,,,,,,single,,
http://oklahomacity.craigslist.org/msr/5386716685.html,oklahomacity,,2016-01-04 00:44,2016-02-01 21:18,msr,mw4w,We want to share you,"
Come be our center of attention! Looking for a regular thing... Someone to come over, hang out, stay the night... We are 420 friendly, tattooed and sexy ðŸ’‹ Your pic gets ours... No single men, couples considered... HWP and Disease free is the way to be ðŸ’‹

Still looking for the right one... Will remove ad when we find her â¤ï¸
",32,average,,,,,,,,,,,," 5'0"" (152cm)",,,,,,,,,,,,,,married,,
http://oklahomacity.craigslist.org/msr/5426122837.html,oklahomacity,,2016-01-30 12:01,2016-01-30 12:02,msr,m4t,Lookin for a country girl,"
Lookinf for a country girl. Im 27 athletic build 185lbs 6ft 1. Gonna be movin to the area for a job. Just tryin to get to know someone before i move. Im a down home country guy. Grew up in a small town have coubtry roots. Know how to treat a lady say yes mam and yall.
",27,athletic,Few tattoos,,,,,,,,Goatee,,," 6'1"" (185cm)",,Anything outside,,,,,,,Beagle,,,,,single,,
http://oklahomacity.craigslist.org/msr/5424489754.html,oklahomacity,,2016-01-29 10:28,2016-01-29 10:37,msr,,"Sane, DDF and not pushy??","
I am a normal, average guy in my 30's. I am looking for someone to get to know and if something more happens, so be it. Man, woman or couples welcome. If it does come to ""more"" I give my guarantee I will not be out doing ""more"" with other people.

I do not use drugs at all, social drinker and am disease free. I do not play the field either.

I am super intelligent and bore easily so please be able to engage me. I love comedy, computers, all music, sex of course, outdoor stuff like fishing, camping and BBQ, and so so much more.

I am not looking for someone who will push ""more"" every time we hang. If we are friends ""more"" will probably happen more frequently anyway, no need to push it/rush it.

So get back to me and lets see where it leads. 

Oh, and one last thing. I am very discreet about anything. So, if we run into each other in public, etc...you can rest assured any conversation will be cordial and not of a sexual nature or about any of our ""more"" activities.
",,thin,,,,,never,,,,,,," 5'9"" (175cm)",Negative,,,,,,,,,,,,,married,,
http://oklahomacity.craigslist.org/msr/5424490914.html,oklahomacity,,2016-01-29 10:29,2016-01-29 10:29,msr,,MWM seeking Role/Race Play,"
I am looking for someone into role and race play. I have this fantasy where I am dominated my a darker skinner fella who is into using racial slang during play, ie ""nigga dick"", etc. Additionally during this fantasy there is some verbal humiliation like calling me a sissy, slut, bitch, etc and telling me to suck this/take this big ""nigga"" dick/cock, making me say I love taking/sucking big nigga dick etc.

Let me be clear though, I am in no way racist. It is just something that has turned me on since I saw Shane Diesel (Black Porn Star and star of mydaughtersfuckinganigga website) saying it and making the girls say it.

So, if this sounds like you, lets talk. So, when you send me a message, put one thing you would like to say to me as the subject or I will delete it without reading.
",,,,,,,,,,,,,,,,,,,,,,,,,,,,,,
http://oklahomacity.craigslist.org/msr/5424488414.html,oklahomacity,,2016-01-29 10:27,2016-01-29 10:27,msr,mw4m,Bi Couple for Hung Gentleman 4 LTR,"
Bi mid 30's couple seeking hung gentleman for LTR in and outside of the bedroom. 

No drugs, diseases, animals, kids, body wastes or anything illegal or that will end us up on the news or in a correctional facility.

Must be hung (thick/diameter or long), bi or bi friendly (husband is a bi bottom), no drugs, not a drunkard either, no ex-cons either.

Us: mid 30's, smokers (trying to quit), ddf (including 420), social drinkers, discreet, she is bbw he is slender. Pics available. She is Latina as well.

Again, this is not a hook up post. We are looking for a long term relationship both in and outside of the bedroom.
",36,,,,,,,,,,,,,,,,,,,,,,,,,,,married,,
http://oklahomacity.craigslist.org/msr/5423634899.html,oklahomacity,,2016-01-28 16:26,2016-01-28 16:26,msr,m4w,Rope Bondage Class Partner,"
I am looking for a woman interested in being a practice partner for rope bondage (see pictures for examples). This would include rope corsets, harness, gauntlets, and assorted tie-downs. This can be done clothed, partially nude, or nude depending on your comfort level.

If interested send me a message about yourself and what you would like to try. Change the subject to tie me up and your height.
",45,hwp,,,,,,,,,,,," 5'6"" (167cm)",,,,,,,,,,,,,,divorced,,
http://oklahomacity.craigslist.org/msr/5423428743.html,oklahomacity,,2016-01-28 14:20,2016-01-28 14:20,msr,,SUB SUCKER ISO HSV HOST/S,"
I'm an attractive, hwp, clean cut mature male bi white male whose HSV has been under suppression with meds with no outbreaks for many years. I would like to find a M, CPL, or female who has H who would like to be serviced regularly. I have had experience with male DOMS and vanilla couples. I am VERY submissive and VERY orally giving and with men I LOVE to swallow. IF YOU HAVE THE ABILITY TO HOST IN THE OKC METRO and would like an ongoing ltr of servitude mild to wild please drop me a line and lets get acquainted.
",58,average,,,,,,,,,,,," 5'7"" (170cm)",,,,,,,,,,,,,,,,
http://oklahomacity.craigslist.org/msr/5376831136.html,oklahomacity,,2015-12-27 17:19,2016-01-25 22:27,msr,m4m,Are you a Black Bottom looking for a real connection?,"
Let me straight honest, in my heart I want nothing more than to find someone to love, commit myself to, and be with until the day I die. I want to finally experience the elusive love that I have watched everyone around me attain; I've been so close, yet, I feel so removed from it. 

For the right person, I am willing to do whatever is necessary in order to meet him. If he lives on pluto, I will build a rocket, spend ten years flying there and ten back just to bring him here with me. I am posting across the country in hopes of finding someone who feels the same and is interested in exploring each other for the purposes of a relationship. I am a Christian, faithful, loving, caring, romantic, sweet, kind, honest, attractive, and giving man. 

If you could imagine how the perfect husband would act and treat you, it would be me. All my life, I have dreamed of finding that one guy who I could share my everything with and love forever. I know how silly this must sound, considering popular gay culture, but there must be at least one more out there like me. I know you're out there, and I'm waiting. 

I'm a graduate student, heading into a great profession. I am educated, financially stable, with my own place and my own vehicle. I don't mind if you aren't as ""set"" as I am, what I care about is our connection. 

I want to meet someone who will give me the time to get to know him to see if he is the one. I thought at one point that love at first sight happens, but I've learned a lot about people and what love really is over the past couple of years. Love means giving up things you need for someone else's wants. Love means doing what's best for both of you. Love means you can't imagine your life without someone. 

Maybe you're just like me, you desire that one person who will cherish you for the rest of your life. Do you fantasize about that one guy who will hold you throughout the night, waking up to make sure you are pressed tightly against him and that you're safe? He would hold your hand all the time, take you on the best dates, and make you wonder where in the hell he has been your entire life. He would grasp you in ways that make you feel alive and show you how much you are wanted and needed. 

He would come to your rescue when you need him and show you everyday he is worthy and deserving of your entire heart and all of your devotion. I am that guy. I dream about doing all of those things for someone. It's the thing I desire most on this planet. I'm tired of only imagining my fairytale, I'm ready to live it. 

I know if you have read this far that you are wondering what I look like and what I like. . . right? Well, I am of average height (5'10""), I am burley, but I carry my weight well, very attractive, of mixed race, although I essentially am (look) white. I am a top and tend to fill the more classic ""guy"" role in a relationship. 

I also have an inclination to gravitate more towards black men who are shorter, thinner, and hairless, but my tendencies are in no way reflective of any ""absolutes"" placed on the guys I want to meet, but I will be as honest as possible and tell you that I find it highly unlikely that I will find someone who isn't black attractive. Furthermore, ideally I would prefer someone who is a virgin or has a minimal number of sexual partners. 


***********************************
IMPORTANT:
All I ask is that you be CHRISTIAN, disease free, do NOT use any drugs (including cigarettes), in your 20s/VERY early 30s, a BOTTOM (not vers, not top, not Vers/bttm, a BOTTOM), and willing to RELOCATE eventually if we decide to pursue something (not right away, obviously).

Include something about yourself, a photo, and your number. Be serious about wanting to get to know me. I don't want to waste anyone's time, nor have my time wasted. I prefer to talk via text or voice instead of email. I want someone who will maintain communication with me. Yes, we all get busy, but I don't want someone I have to chase in order to talk to them. 

And yes, I do have a photo, I just chose not to put it up because of my professional obligations. I am more than happy to share one with you by text. And I promise, I'm very handsome.

PLEASE, DO NOT CONTACT ME WITH HATEFUL THINGS, CRITIQUES OF MY POSTING, OR, OTHERWISE, ANYTHING BESIDES A GENUINE INTEREST IN GETTING TO KNOW ME. LASTLY, IF YOU CONTACT ME AND SAY SIMPLY ""PIC"" OR GIVE ME NO INFORMATION ABOUT YOURSELF, I WILL JUST IGNORE YOUR EMAIL. IF YOU ARE SERIOUSLY INTERESTED IN GETTING TO KNOW ME, THE PERSON, APPROACH ME LIKE YOU ARE, NOT LIKE THIS IS A HOOK UP.
",26,,,,,,,,,,,,,,,,,,,,,,,,,,,,,
http://oklahomacity.craigslist.org/msr/5378129306.html,oklahomacity,,2015-12-28 15:14,2016-01-25 12:08,msr,m4t,divorced dad of two,"
I am 29 looking for someone to chat with make a new friend if possible. 
Ive dated TS before, this isn't a fetish thing I am not seeking out sex what so ever
just looking to maybe start something if not make a new friend...
",29,athletic,,,,,,,,,,,," 6'0"" (182cm)",,,,,,,,,,,,,,divorced,,
http://oklahomacity.craigslist.org/msr/5407274277.html,oklahomacity,,2016-01-17 15:39,2016-01-24 22:40,msr,mw4w,Loving fun couple seeking,"
We are a married couple. We enjoy spending time with our 2 kids the youngest is 4 we love hanging out with each other friends and family. We are normal down to earth couple the only thing is I'm bi sexual we want a girlfriend for us both a third person in our relationship to hang with be like a true friend and lover long term we are attractive fit really into working out we enjoy dinner movies outdoors sports grilling concerts and having laid back chill nights as well we don't drink smoke or do pda in front of our kids we are responsible and mature only area we are kinda crazy in is in the bedroom
",34,athletic,,,,,,,,,,,," 5'6"" (167cm)",,,,,,,,,,,,,,married,,
http://oklahomacity.craigslist.org/msr/5416811674.html,oklahomacity,,2016-01-24 01:41,2016-01-24 03:35,msr,m4t,Seeking beautiful Tranny,"
Hi, this is sort of weird for me because idk or ever met anyone that's transgendered. Well I just want to experience something new, exciting & real. I've been with with a few women & I always get cheated on or hurt. I like the thought about being with a tranny but I love women & I'm looking for a real relationship someone that takes care of me & I take of you. I love boobs & asses but willing to try it out. I'm fun & adventurous. If you're interested send me a pic so I know you're real & a message to let me know you're interested. & I love older women in their 20s to 40. I like bbw, curvy, or thin
",24,athletic,,,,,,,,,,,," 5'5"" (165cm)",,,,,,,,,,,,,,single,,
http://oklahomacity.craigslist.org/msr/5484600389.html,oklahomacity,,2016-03-09 21:04,2016-03-09 22:21,msr,t4m,Fit ts 4 fit man(looking 2 date),"
I'm 5'6 blonde hair green eyes, I workout and take care of myself I run barrels and train barrels horses so horses are a big part of my life, I love anything active and outside, hanging out movies beers always good I'm easy going and easy to please, I'm looking for someone to hangout that wants to date if we hit it off I'm not looking to just hook up I take care of myself so I like the same in my men, I do have a type just like everyone else so send a pic of what you look like or I won't respond I'm not into old guys or black men sorry if I don't reply I'm just not interested and please don't contact me if you don't have the dating intensions
",30,athletic,,,,,,,,,,,," 5'6"" (167cm)",,,,,,,,,,,,,,single,,
http://oklahomacity.craigslist.org/msr/5484265726.html,oklahomacity,,2016-03-09 16:34,2016-03-09 17:08,msr,mw4w,looking for a third,"
My fiance and i are looking for a special woman to date and more. Someone that can be with both of us or even with one of us at a time, but still with both of us. We hope to hear from someone soon, your pic gets ours, please be disease free as are we
",36,,tattoos,,,,,,,,,,,,,,,,,,,,,,,,,,,
http://oklahomacity.craigslist.org/msr/5483917351.html,oklahomacity,,2016-03-09 13:09,2016-03-09 13:50,msr,m4w,Christian Man Wants To Give Oral Sex,"
Hope all you nice ladies are having a good day. Why does it have to be that Christians can't give oral sex? I am a married white professional man, honest, healthy, passionate. But my wife thinks that oral sex is dirty (according to scripture), but I disagree. This is something I have longed to do, I want to satisfy a woman orally. Is that a sin? I can't find it in the bible, so I think it is just my wife's preference. You host. I can travel.

I am kinda average, but not bad for my age. Non-smoker, I don't do drugs and am healthy. I also think that I am an above-average kisser. I enjoy laughing, music, movies and am not too serious.

If you agree with me, let me know. You can be Christian, or not. Married, or not. You must be able to host.. Please be warm, friendly, healthy, sane, kinda normal, but needing or looking for the same. Please be in the OKC area (South side is possible). 
I am not a Sugar Daddy, so pass me by if that is what you are looking for.
Hoping to hear from someone.
",61,average,,,,sometimes,never,,,,,,," 5'10"" (177cm)",,,,,,,,"Funny, comfortable, warm, polite",,,,,never,married,,
