url,city,subcity,datetime_created,datetime_updated,category,type,title,text,age,body,body art,diet,dislikes,drinks,drugs,education,ethnicity,eye color,facial hair,fears,hair,height,hiv/hsv/hpv,interests,"kids, have","kids, want",likes,native language,occupation,personality,pets,politics,religion,resembles,smokes,status,weight,zodiac
http://denver.craigslist.com/msr/5443585198.html,denver,,2016-02-11 11:26,2016-02-11 12:16,msr,mw4w,You should probably put your reading glasses on. . .,"
Why does society frown on Poly? I realize that there is no one simple answer. Obviously theistic and political powers are at least partially responsible. Tragedy associated with polygamy in popular media certainly has not helped, I'm sure the average person does not bother discerning between the various Poly definitions.

What I find a little sad is how accepting society is of cheating. Sure, cheating is frowned upon; but it is never all that surprising when someone cheats, is it? Cheating is popularized in every form of entertainment that society consumes. Whether you have friends that cheat, you have been cheated on, or you yourself have cheated on someone else, we all seem to have a personal connection to cheating in some way. Cheating is ""normal""; it's a part of life. We dismiss ""cheaters"" as whores, dicks, liars ect. . . But in reality, it surprises no one, and society as a whole seems fairly entertained by it.

Why is sleeping with another person, via lying and betrayal socially acceptable; while sleeping with another person through open and honest communication so perverse?

I think I get it, humans desire control, and monogamy provides a structure for the illusion of control. I call it an illusion because we are never actually in control of another person. Even here on CL, almost every supposedly ""open minded"" couple posting a mw4w ad is already making demands, and attempting to control someone whom they have not even met yet!!

I don't ever want to be in control of anyone. I prefer embracing the chaos of human nature, guided by openness and acceptance based on the connection you have with another human being, and NOT that person's ability to conform to whatever fantasy some bored husband and wife have dreamed up..

I am looking for someone, and so is my partner. But not ""all or nothing"" as a couple, rather as individuals who have our own say about how and who we connect with. No long list of criteria, how about we just have a conversation and see where it goes.
",31,average,,,,,,,,,,,," 5'11"" (180cm)",,,,,,,,,,,,,,partnered,,
http://denver.craigslist.com/msr/5431352793.html,denver,,2016-02-02 23:59,2016-02-11 02:30,msr,,Valentine's Day Date m4m,"
Hello Gentleman, 

I am looking for someone in their 40's to mid 50's who would be interested in going out and enjoying a few great dates, leading up to a fun and romantic Valentine's Day Date.

I am a good-looking professional, who is educated and a masculine gay male. I am in good shape and 5'8"" in height. I am looking to share this dating experience with a good-looking, educated, professional, masculine, white or latin gay male who enjoys getting dressing well and having a enjoyable, fun, safe time on the town. I'm looking for someone who is very close to my height.

How about we meet this Friday or Saturday evening for dinner, have a drink, get to know one another, become friends and see where it goes. 

Where would you suggest we have dinner and drinks? Somewhere close to downtown would be preferred. 

Drop me a line if you would like more details. I am excited that you will be joining me on for this series of very special dates. This is a real invitation, I would enjoy a sincere response. Thanks!!
",51,thin,,,,sometimes,,,Black,,,,,,HIV Neg. / DDF - Seeking Same,,,,,,,,,,,,never,single,150,
http://denver.craigslist.com/msr/5443004663.html,denver,,2016-02-11 00:29,2016-02-11 02:10,msr,m4mm,I NEED A SUGAR DADDY,"
handsome 20 year old male.. I'm bi curious.I like to party... I'm new to this........................ ... ....rjdjdjdjffkdoeosossoeododkdkkdjjdjdjdjd
",,,,,,,,,,,,,,,,,,,,,,,,,,,,,,
http://denver.craigslist.com/msr/5443024150.html,denver,,2016-02-11 01:37,2016-02-11 01:37,msr,m4mw,looking for a couple,"
big guy here Looking for a couple for regular fun. im BI. Pic 4 pic DD free. E mail me and lets get to know each other.
",37,average,,,,,,,,,,,," 5'7"" (170cm)",,,,,,,,,,,,,,single,,
http://denver.craigslist.com/msr/5442909426.html,denver,,2016-02-10 21:27,2016-02-10 21:57,msr,mw4w,Seeking a sister wife,"

We are seeking a live in bi-female who will join me as my sister and my Master's lover in his house. We are seeking a female who is a non smoker, disease and drug free.

Must be ready and willing to relocate Denver Colorado.

We are a drama free, fun and loving couple looking for a long term relationship with a sister wife. We are not looking for short term, just for fun or casual dating. We are serious in finding someone special to spend the rest of our lives with. 

In your response please send a current pic of you with a hand written sign saying ""Hi MasterK"". That way I know you are real. If not all responses will be deleted and blocked.
",,,,,,,,,,,,,,,,,,,,,,,,,,,,,,
http://denver.craigslist.com/msr/5429285283.html,denver,,2016-02-01 15:09,2016-02-10 16:53,msr,m4w,Seeking a ltr ANR/ABF,"
If you know what that is then I hope you're looking and into it as much as I am. Let's chat and connect. Newbies are ok but would rather have a woman who has done either before. Hopefully you live toward northern part of Denver, be hwp, somewhat attractive, between C and DD's, fun and kind.

If you're real the only way I'll answer you is if you put the temp in degrees today in subject line. If all you intend to do is email back and forth move on! Pix aren't required at 1st but you will be 1st to send.
",,,,,,,,,,,,,,,,,,,,,,,,,,,,,,
http://denver.craigslist.com/msr/5442597963.html,denver,,2016-02-10 16:29,2016-02-10 16:38,msr,m4w,Lost butterflies,"
If you do something, anything, over and over again, no matter how thrilling, eventually it loses the thrill.

Relationships are no different. Whether you are married or dating or in a LTR, after a while, as the song says, the thrill is gone.
I'm not talking about being miserable, too many people are miserable in this world and I don't want any more of them in my life.

You can be happily married or in a relationship and yet still yearn for that feeling of butterflies, excitement, and thrill of new love.

That is what I'm looking for. I don't want to change our situation, or mine.
This is about that first kiss, that first touch. Maybe that's all we'll ever do, meet, and kiss, and make out. Maybe more, I don't know. I just thought I'd see if there's anyone else who's in some way attached and would like to feel those butterflies with someone similarly inclined.

I'm tall, intelligent, handsome, hwp, and in my 40's.

Tell me about yourself if you would, why are you responding to this and what you might be interested in doing.

I'm sure this will likely only garner spam responses but I figured it's worth a try. 
Please change the subject line so I know you're not spam. Change it to something about yourself that you like and are proud of.

Thank you 

",,average,,,,,,,,,,,," 6'1"" (185cm)",,,,,,,,,,,,,,married,,
http://denver.craigslist.com/msr/5442571975.html,denver,,2016-02-10 16:10,2016-02-10 16:10,msr,m4w,An honest question,"
This question is for women who are either married or attached/in a relationship.

Do women, who are in happy healthy relationships, have needs beyond that relationship? What I mean is, can a women be happily married or in a long term relationship, and yet still have needs that don't get met?

It seems to me that most ads (from males and females) that are from people who are attached in some way almost always come down to someone who is unhappy and looking for sex. Makes sense, and I am not judging anyone here.

I believe, however, that it is possible to be in a good relationship and yet still yearn for something, not to replace the relationship you're in, but to enhance it. Or to provide what that relationship cannot.
And I simply wondered if this was only a man's opinion or if women felt that way as well.

Would love to hear from women either way.

Thank you for taking the time to read my post.

Please no men. I know what that point of view is. Oh, and please put the number of years you've been in a relationship in the subject line just to help me weed out the 99% of spam I'm sure to get.

Thank you.
",,average,,,,,,,,,,,," 6'1"" (185cm)",,,,,,,,,,,,,,married,,
http://denver.craigslist.com/msr/5441744670.html,denver,,2016-02-10 08:05,2016-02-10 09:37,msr,mw4w,I'm having a party! Want to cum?,"
Hi, 

Thanks for stopping by and taking some time to read my post.

I will start off by saying I'm a guy looking to have a party in a couple of weeks and wanted to post this now to give anyone interested some time to plan for it.
On the first Friday of March I am going to have a party and thought why not make this one a little different. It will be held in a nice clean home and I will expect whoever is there to respect it and anyone who shows up. 

This is what I'm looking for and why. 
I'm looking for 4 to 6 woman who should probably be bi or bi curious but also like cock. If you are not bi or even curious but would still like to come that fine as well. 
The party will be me and one other guy plus the girls. I'm not sure who the guy will be yet as most of my friends are married, but I will find one. You should be good looking, clean, ddf, above the age of 28, fun and can hold a conversation. 
I will have some food and snacks but you bring your choice of drink or 420. No need for driving if you have been drinking. Lots of space if you need to stay. 
Let's hang out, have some drinks, good conversation and then some great sex. 
Why? Because it's winter and people need to get out of the house and have some fun. Right?
Please do not ask if you can bring a man. This is not an option.... You can bring a girlfriend if you'd like though. This is for one night only and will start around 6:00.
About me. 41, white, professional career, kids, respectful, like to laugh and have fun, clean, ddf, play safe, can hold a conversation and I have done this before. If your interested change the subject line to ""party and send a pic for a response. If you are married or partnered I can be discreet about it. No hard drugs and No cameras or pics will be taken during unless everyone is ok with it. We can also do so play time before the party if anyone is interested in that. Thanks and let's have some fun.
",41,average,,,,,,,,,,,,,,,,,,,,,,,,,,,,
http://denver.craigslist.com/msr/5433638704.html,denver,,2016-02-04 13:00,2016-02-10 07:28,msr,m4w,A home for a sub/slut,"
Seeking a special friend, a woman with needs and desires that she can't possibly share with her boyfriend, husband or girlfriends. A woman who fantasizes about being in the company of a safe, attractive, compassionate man that she can feel safe with and release her inner slut. Desires should include some bondage and control (we will work up to that) exercises, multiple men, spanking to your comfort level, semi-public fun, dressing provocatively under controlled circumstances, and obedience. You can be any age and race, I have no preferences. You should enjoy bi fun, with women and the occasional mfm 3 some. You must be willing to explore. You must be in good health, no diseases, practice good hygiene, and be in stable mental health. Also, no bbw there must be a mutual attraction. You should be available daytimes. If you are partnered up that is fine. I understand. I am attracted to educated women also. If you have been involved in a relationship like this before you know it can be empowering to you. A relationship like this takes a while to fully develop.

If this is something that intrigues you...a safe secure discreet fun relationship with an attractive lover...feel free to respond. All questions are answered of sincere respondents. ""C""
",54,athletic,,,,,,,,,,,," 6'0"" (182cm)",,,,,,,,,,,,,,,,
http://denver.craigslist.com/msr/5441222870.html,denver,,2016-02-09 18:10,2016-02-09 18:10,msr,m4mw,Does your lady need attention?,"
Hello Couples
I have had a few experiences where the lady half of a relationship was needing attention due to the other half being gone...out of town. In both circumstances, videos and pics were taken...and for one of them a phone call was placed as we were in pleasurable action. Needless to say, I am looking forward to another experience such as this. Or if a couple has another voyeuristic approach to getting their rocks off, then I am all ears. Please respond with your location in the subject and attach a few pics. I have a gym body and am quite handsome. Let's hope something fun and exciting comes from this.
",,athletic,,,,,,,,,,,," 5'10"" (177cm)",,,,,,,,,,,,,,single,,
http://denver.craigslist.com/msr/5403194895.html,denver,,2016-01-14 16:18,2016-02-09 17:23,msr,m4w,SUPER BOWL Fun is more Fun,"
No BS, just straight-up Adult Fun for You and Me!! ONgoing NSA!

Maybe a little Super Bowl Licking, Kissing, Mouthing, Tonguing and Fingering/Fisting too, if You want. 
I love Giving Oral and Full Body-Rubs are my Specialty! & I can find the 'OMG' Spot!
Make you Wet, just thinking about it? Females Only! Duh!

Put 'Kitty' in subject line! It's all about YOU!
",59,thin,,,,,,,,,,,," 5'7"" (170cm)",,,,,,,,,,,,,,,,
http://denver.craigslist.com/msr/5434099448.html,denver,,2016-02-04 18:18,2016-02-09 16:39,msr,m4mw,any couples out there that are looking for me???,"
hey everyone I'm 6'4 tall 265lbs white I love the outdoors but I love to go shopping too would love to find a couple that wants a relationship with me. I would love to find a guy to go to the bar with hang out do guy stuff with. he can be the dominant one. I would also like a girl that I can hang out with go shopping with and do girl stuff with. and be comfortable with who I am. I'm straight looking but I like both. I want to fall for both. theres more to me but I will say more when we talk. hit me up if your interested.
",28,average,,,,,,,,,,,," 6'4"" (193cm)",,,,,,,,,,,,,,single,,
http://denver.craigslist.com/msr/5440844607.html,denver,,2016-02-09 13:50,2016-02-09 13:50,msr,m4w,Are you built to f***?,"
Hello...
Middle aged, white, corporate, IT, fit, single white guy here.
I want to date and potentially wife a girl who is built to fuck.
Crass, i know. 
But hey, we all have desires.
LIfe is short. Life is even shorter when you're 42.
You pamper me with your body, and ill pamper you in every other way.
",42,fit,,,,,,,,,,,," 6'1"" (185cm)",,,,,,,,,,,,,,single,,
http://denver.craigslist.com/msr/5399655416.html,denver,,2016-01-12 11:28,2016-02-09 13:48,msr,m4w,"Older married male for married female, feel alive again.","
So here goes nothing. Looking for a very special lady who is in a lack luster marriage. If you are on Craigslist then you know what I mean. Tired of being ignored? Tired of feeling unwanted? Tired of going through the motions? Tired of trying, just to be shut down? Missing the kiss? Missing the touch? Missing the anticipation? Missing the feeling of being wanted, needed, loved? Hmmmmm me too...... Time for a change, but unable to change my home status. If this sounds like you, please let me know. Always remember that you are a Stunningly Beautiful Lady that deserves to feel alive and wanted again. Until then .
",52,,,,,,,,,,,,,,,,,,,,,,,,,,,,,
http://denver.craigslist.com/msr/5399656061.html,denver,,2016-01-12 11:29,2016-02-09 13:47,msr,m4t,Married older male for younger ts/tg,"
One more try, and no I will not pay you.... No games, no games, no games. I am a married older male looking for a younger ts/tg to spend some time with. I am respectful, passionate, attractive, sensual and real. Hoping to find someone for a long term relationship. Are you attracted to older men, do you want to be loved unconditionally? Please let me know if my ad interests you? Have a fantastic day!
",50,,,,,,,,,,,,,,,,,,,,,,,,,,,,,
http://denver.craigslist.com/msr/5399656736.html,denver,,2016-01-12 11:29,2016-02-09 13:47,msr,m4w,Older married daddy for younger married female,"
Still looking.... Older married daddy looking for younger married female to fulfill all her fantasies. Are you wondering what it's like to be with an older man who knows what he is doing. Who is good looking, has stamina, will treat you like the princess you deserve to be treated like. Experience is everything and your needs always come first. I am very discrete, respectful, sensual, sexual and will make you feel like no one ever has in and out of the bedroom. If I have awakened a desire inside you, then take a chance, what have you got to lose? Only looking for one special younger female..... You know you're curious......
",50,,,,,,,,,,,,,,,,,,,,,,,,,,,,,
http://denver.craigslist.com/msr/5414906778.html,denver,,2016-01-22 14:30,2016-02-09 13:46,msr,m4w,Older mwm looking for a younger mwf who is lactating for dad role play,"
Older daddy for younger lactating daughter role play relationship. Please be married and please be close. I am a complete father figure, fixed and very sexually experienced. Older is better and sexier. I hope to hear back from one very lucky girl. Until then let your imagination run!
",50,,,,,,,,,,,,,,,,,,,,,,,,,,,,,
http://denver.craigslist.com/msr/5432653906.html,denver,,2016-02-03 19:00,2016-02-09 13:46,msr,m4w,Daddy for daughter,"
Hello I am looking for a daddy daughter relationship. If you are attracted to good looking older men, then please get back to me. I love the look, touch, scent, feel, voice, etc...... of a younger female. Please be 21 or over. I will treat you like a princess and make your toes curl.....
",50,,,,,,,,,,,,,,,,,,,,,,,,,,,,,
http://denver.craigslist.com/msr/5397535399.html,denver,,2016-01-11 05:18,2016-02-09 11:52,msr,m4w,Unique Weird Crazy... Seeking Insane...,"
Yes its 5 AM in the morning and I am awake... Lying here naked in my Cozy warm bed... just wishing I had a sexy lil.... Beside me, to ramble on about what I do not exactly know... Maybe the revolution... or Evolution... or Getting Splattered With Cum... or some other kind of Debauturous Fun! Seriously...life is to short, and most people bore the fuck out of me... 

Is there anyone out there, who has a similar issue? If you do... I have space here beside me and a box full of tissues... I am just kind of rambling because sleep is beyond me at this hour...I really wish I had a tempting, tantalizing naughty lil flower...
",44,fit,,,People that Live in the Box,,,,,,,,," 6'0"" (182cm)",,Revolution BDSM Nakedness,,,,,,,,,,,,single,,
http://denver.craigslist.com/msr/5440370119.html,denver,,2016-02-09 09:34,2016-02-09 09:34,msr,m4w,An escape from reality,"
I am told I am a good looking white male. I am wanting to have some fun with the right women. That fun is not just in the bedroom, but lunches and coffees and fun emails that make both of us smile. I am clean cut and smell good. I am a nice guy wanting to have some fun and passion back in my life.! I am easy going and open to any arrangement?
I am not a cocky, arrogant, weirdo, Craigslist creeper or dirt bag...Just a everyday, regular guy, business professional with my act together, wanting more passion and fun and spice things up.
I am easy going and mellow, I am a happy person, I will not do anything to disrupt your live in any way, shape or form. Lets just enjoy the moment and have some fun.We can take it slow as you want. I am non pushy. No worries! :)
So if you like what you have read so far then please contact me so that we can see if their might be any chemistry between us.
I will treat you with respect all the time and know how to be a gentleman. I will always make you feel secure and comfortable around me.
Thank you and I am looking forward to hearing from you.
",47,,,,,,,,,,,,,,,,,,,,,,,,,,,,,
http://denver.craigslist.com/msr/5409446718.html,denver,,2016-01-19 00:31,2016-02-09 08:29,msr,m4w,A Beautiful Muse with A Colorful Spin?,"
Well if you resonate or at least curious about my title, then we are off to a good start. You see, there is a very mystical, inspired, conscious side of my soul, it is the ruling side, thankfully. However, there is another, side, that is a bit twisted, a bit taboo, a side of me that will have to teach you a lesson if you step out of line. So you either get it, or you don't.... Perhaps you are part hippy, part artist, part yogi? But yet you are curious, or are tempted by your other ""side"" as well....

Well then if you are, we have much to talk about.... I am open to all ages, all colors, as long as you have an extremely open mind, and a round tempting, beautiful behind....If you are real... Please put ""Colorful"" in your subject line...and if you are so kind as to share some pictures, I will surely return that favor, and perhaps many more to come....
",48,fit,,,,,,,,,,,," 6'0"" (182cm)",,,,,,,,,,,,,,single,,
http://denver.craigslist.com/msr/5396715785.html,denver,,2016-01-10 12:39,2016-02-09 08:28,msr,m4w,A Sexy Little Fuck Slut!!!!,"
You know who you are... You are that naughty lil girl, who dreams of having a pair of firm strong hands wrapped around your neck as you are impaled by a hot thick hard throbbing COCK!!! Maybe this time I'll stick it in your naughty lil mouth... Maybe the next time, it will go in your hot wet twat... maybe the next time I will stick it in your hot round juicy ass....

IT IS TOTALLY UP TO ME TO DO WITH MY SASSY LIL SLUT AS I PLEASE....

SOMETIMES I GET OFF ON A LITTLE TEASE...

I am a middle aged man with a hard toned body am only interested in tight sexy tantalizing HWP Fuck Sluts, no thick or BBW or BIG women for me.... I can also be a very generous man, but you have to earn it... I am looking for something on going...with the potential to lead into something real... So if your looking for a one time fuck, or a Sugar Daddy, fuck off!!! I am kind, but I am not a door mat, and I have a very creative and equally devious mind....

Reply with a colorful reply and some sexy pics if you want a reply back... and put FUCK TOY in the subject line, so I know your real...
",48,fit,,,,,,,,,,,," 6'0"" (182cm)",,,,,,,,,,,,,,single,,
http://denver.craigslist.com/msr/5439971439.html,denver,,2016-02-09 00:13,2016-02-09 00:34,msr,m4w,Selfishly Unselfish,"
I work damned hard, and my hours kind of stink, so I will be the first to admit that I'm a bit lazy at home. I would love to find my soulmate. A passionate, intimate gal interested in a fulfilling relationship filled with passion, intimacy, shared back rubs, a bit of kink, understanding, and whatever else fills our fancy. I don't mind going out from time to time, but all the time is not my thing. I enjoy the occasional adult beverage, am not big into weed (But not against it at all), and do smoke cigarettes (But vape most of the time these days).

If you enjoy nice quite evenings full of communication, togetherness, passion, sharing, and maybe accepting that I'm a touch lazy at home, then I beg you to respond. :)

I'm 30, single, 5'6"", average build, very giving both physically and emotionally, selfish at times, no kids, no pets at the moment (RIP :( ), and am looking for an amazing woman to spend the rest of my live with in a supportive, generous, amazing relationship.

So, if you are interested, please reply back with a bit about yourself and tell me your favorite Super Bowl moment :)
",30,,,,,,,,,,,,,,,,,,,,,,,,,,,,,
http://denver.craigslist.com/msr/5438819666.html,denver,,2016-02-08 09:35,2016-02-08 09:35,msr,m4m,Biwm needs a home,"
Biwm 47 5'11 looking for a ltr.. I'm in a toxic relationship with a woman and need to get out and find something healthy. In a rough spot financially right now but on the way to getting that fixed so I need a little help for a short time.. willing to help and pull my weight around the house and bedroom. . Bottom mainly but would like to find someone I could be vers with, please send a pic or two let me know what you think..
",47,,,,,,,,,,,,," 5'11"" (180cm)",,,,,,,,,,,,,,divorced,,
http://denver.craigslist.com/msr/5438674637.html,denver,,2016-02-08 08:11,2016-02-08 09:06,msr,t4mw,Colorado soon,"
Hey, how's it going?? You have a trans gurl here I've been posting and for some reason I keep getting flagged idk why. But anyways I'm moving to Denver here really soon and I'm looking to meet and make friends with some locals and go from there. Plz only serious reply and I'm not looking for sex sorry if that's all you want move on, also plz read my posts and I would like if you do want to communicate with me please do I have talked with some and then stop talking so I am only looking for legit people. Yes, I am real not a bot. So include a pic and reply with you favorite month. Well thanks for reading and cya 
",,,,,,,,,,,,,,,,,,,,,,,,,,,,,,
http://denver.craigslist.com/msr/5438412118.html,denver,,2016-02-07 23:50,2016-02-07 23:50,msr,m4t,where are you?,"
Hey there all my lovely people looking for love. Damn this is proving to be impossible. I have wanted a relationship on the trans level for so long. Just turns me on. But there always seems to be a problem. I'm looking for that one in a million because that's me as well. I know you are out there but you are so hard to find. I'm not giving up!
",43,athletic,,,,,,,,,,,," 5'10"" (177cm)",,,,,,,,,,,,,,divorced,,
