url,city,subcity,datetime_created,datetime_updated,category,type,title,text,age,body,body art,diet,dislikes,drinks,drugs,education,ethnicity,eye color,facial hair,fears,hair,height,hiv/hsv/hpv,interests,"kids, have","kids, want",likes,native language,occupation,personality,pets,politics,religion,resembles,smokes,status,weight,zodiac
http://denver.craigslist.com/msr/5395922863.html,denver,,2016-01-09 18:57,2016-01-26 09:57,msr,m4w,"An experience, both true and taboo","
She staggered into a dark living room much later than she had been given permission to. She was wearing knee high socks with sneakers, short shorts and a tank top with no bra. As she shut the door, the light flicks on. I was sitting near the door, clearly upset. ""You're late, young lady! Where have you been?"" I said with a deep, stern voice. ""Out with my friends"" she mumbles, avoiding eye contact. I became louder, ""Bullshit! I called all of your friends and they haven't seen you. I will give you one more chance to answer but if you lie again, I'm taking your keys and phone for two weeks."" She looked to the floor, ""I'm sorry that I lied. I was out with a boy."" I started getting steamed, ""Out with a boy... dressed like that? You look like a little slut. What the fuck were you doing with this boy?!"" She looked up slightly, ""we were just studying and hanging out."" ""What did I tell you. One more lie and I was taking away your freedom. Give me your keys and your phone, now!""
She quickly begged and pleaded with me not to do so. ""Last chance, what were you two doing?"" She timidly replied, ""We were just fooling around..."" I moved closer, ""What do you mean, fooling around? Were you fucking him?!"" She replies, ""No, not at all! We didn't have sex, we just kissed and touched each other."" I moved closer, ""Kissed? How? With tongue?"" She was too embarrassed to answer. ""Show me, right now, how you kissed him."" I pulled her by the hair close to my face, ""Show me now or so help me, I will punish you worse than you can imagine."" She slowly moved in and kissed me long and deep, hoping that will be enough. ""Is this what you have become, a naughty little whore?! Do you like being treated like a whore?"" I said loudly as I fondled her tits, ""Is this what you like, being used like a filthy little slut?"" I looked down and see that her shorts were soaked in the crotch. I force my hand under her shorts and between her legs, getting my fingers wet and pushed her pussy
juice in her mouth. ""This is how whores get treated, with no respect. Now, taste yourself. Do what I just did. I'm not letting you go to bed until you do."" She reluctantly started to finger herself and tasting it off of her fingers. ""Is this what you want? To be treated like a dirty little cunt?! I'm very disappointed in you. Come over here."" I sat and pointed at my knee, ""Stand here, pull your shorts down and bend over my knee."" She slowly moved to me and I turned her away from me, ""Pull them all of the way down to your ankles."" She bent over all of the way as she slid them down, and laid across my lap. I spanked her, harder and harder, squeezing her ass and spreading it apart. ""You know what else whores do? They take it up the ass."" I spit three times on her asshole and buried two fingers all of the way inside of her. ""Do you like this? Is this what you want? Tell me that you love this. You're dressed like a slut so I know that you do. Say it!"" She cried out,
hoping that I would stop humiliating her, ""Yes! Yes! I love it!"" ""I know you do, bitch. Your a little slut, why wouldn't you?! Did you suck that boy's cock?!"" She whimpers, ""No"". In disbelief, I slid two more fingers in her tight, young butt. ""What?! I can't here you!"" ""Yes!"" She screams, ""I did! I sucked his cock and he came in my mouth."" I pushed her off my lap, ""I knew it! You little whore! Get on your knees, NOW!"" I stood and dropped my pants as she kneeled in front of me, positioning right in front of her, ""You little shit. You like sucking cock? I'll give you the chance to suck one."" I pulled her tank up to her neck and thrust my cock in her mouth, spitting in her face as I fucked her throat. ""You love this don't you? I know you do. I'm going to cum down your throat and you're going to swallow it all, just like the whore you want to be."" I thrust harder and deeper until I exploded inside of her mouth. ""Open up, show me that you swallowed it all."" She gulped and opened her mouth to prove
to me that she did. ""Now, go get in the shower. I will be there shortly to clean you off, you filthy little whore."" She pulled up her shorts, pulled down her tank top and wandered down the hall. She entered the bathroom, head low and pouting. She clearly expected me to enter eventually but what she didn't expect is that I followed her all of the way. She turned, surprised to find me already leaning on the door frame. ""Well... what are you waiting for? Strip those slut clothes off."" She turned towards the wall and pulled her tank over her head and then put one foot after the other on the toilet and slid her socks off. Her sweaty shorts crept between her butt cheeks, ass peeking out of the bottom of them. She pushed her shorts off of her hips, bent at the waist and let them slide down to her ankles. She felt my hand on the small of her back, moving up to the middle and pushing her face to the back of the toilet. ""I am very disappointed, you know better than to come into this house late. You were given a curfew for a reason. You seem to think that the rules don't apply to you. Clearly,
you need to learn how to follow the rules set for you. I know just how to make my point."" I spanked her, hard! One cheek, then the other, back and forth until her whole ass was bright red. ""Do not move from this position. Move, and you'll regret it."" I moved away and she tried to look back at me to see what I was doing. I grabbed a handful of her hair and forced her head to face the wall, ""Eyes forward."" She held that position for a moment before she felt liquid splash on her tail bone, dripping between her cheeks and over her ass and swollen mound. She peeked out of the corner of her eye and caught a glimpse of me in the mirror, pouring lube on her. I caught her immediately and slapped her ass harder than before. ""What the fuck did I say?! You have a problem listening, don't you. EYES FORWARD!"" she quickly averted her eyes and stared at the wall, but I didn't trust her so, I put on a blindfold. ""Since you can't be trusted to leave this on, I'll have to ensure that it stays on."" I pulled one
wrist behind her, then the other, cuffing them together. ""Ouch, it hurts,"" she exclaimed. ""I didn't ask for your opinion. Keep quiet."" She huffed and squirmed, ""please, it's too tight."" I spanked her again, ""You just don't get it, do you? You gave up your right to choose when you broke the rules."" I picked up her shorts, stuffed them in her mouth and tied them in place with her socks. ""Now, we have to clean your slutty ass out."" I worked that lube up her tight hole with fingers from both hands and stretch it out, ""Relax, you'll want to be loosened up for this."" She heard the tap run and shortly thereafter, she felt a probe enter her. Just when she thought it was all in, it just kept burrowing deeper. Once in, there was a pause and then a rush of warm water filling her up. She felt tension, another pause, and then another rush of water. ""Hold your ass tight as I pull this out."" I eased the spout out and set it down, pulling her hair with my other hand until she was
standing. I lifted the toilet seat, ""Turn around and sit down, push all of that water out. Do not hold back."" She sat and pushed, clearing herself out. ""You're starting to resemble the good little girl I know, you are far too young to be such a naughty little whore. I'm going to remove the cuffs and restraints... but if you step out of line, they all go back on."" I freed her and lifted the blindfold. ""Thank you,"" she mumbled. I slapped her in the face, ""You just couldn't keep quiet, could you?"" Her eyes welled up, looking up to me in surprise, ""I'm sorry."" ""Not yet, you're not. Spread you legs and show me your young, slutty cunt. I want to watch you pee, so I can be sure that you empty every drop."" She poured piss into the toilet and looked down to see me getting hard at the sight. As she finished, I commanded her to stand as I started the shower. ""Get in the tub, on your knees, and stay there until I say otherwise."" She climbed in and kneelt down, facing me. I pulled out my throbbing cock and
proceeded to piss all over her, ""You dress like a whore and act like a whore, you're going to get treated like a whore. Now, wash that piss off of your slutty body and while you're at it, wash everywhere while I watch."" I dropped the toilet seat, lit a cigarette and stared with intent, ""We will not leave this bathroom until you have washed your ENTIRE body. Show me everything as you soap up and clean that slut stink off of yourself."" She began to lather up lightly but she sensed my frustration. I tried to patiently finish my cigarette but I couldn't. I stood, undressed and climbed in. I took the soap and control, ""This is how you wash yourself."" I started at her feet and massaged soap into every inch of her body. I moved her around under the water, rinsing her completely clean. ""Now that you are clean and smell like a proper little girl, you can go to your room and get ready for bed... but young lady,"" I pulled her hair hard and pulled her face close, whispering, ""You
punishment is far from over."" She wasn't given a chance to dry off, still soaked and dripping with water. She left the bathroom and headed for the room. I followed her into the bedroom, closed the door behind us, stood in front of her and wrapped my hand around her neck. I lift up slightly, throwing her off balance as I pushed her backwards. She staggered backwards and I followed, slamming her into the closet door. I produced a collar and leash from seemingly nowhere and put the collar around her neck. Once buckled, I applied the leash and draped it over her shoulder. It dangled behind her, hanging perfectly between her cheeks. I reached between her legs and grabbed the leash, pulling it forward and up between her now puffy lips. It pulled her neck back and she leaned with it, her shoulders resting on the door. She choked a bit and the leash put direct pressure on her clit. ""Stay right here and put your wrists up in front of you."" She lifted her wrists and watched nervously as I wrapped them tightly in cuffs,
making sure that they were securely in place. I connected them together with a door jam strap, lifted them above her head, cracked the closet door and slipped the strap over before closing it. She stood helplessly as I went to the night stand and revealed items that choked her up. ""Since you can't seem to keep your mouth shut, I'm going to make sure you keep quiet."" Her jaw was clenched shut. I slapped ht in the face and her mouth dropped open, I quickly slide a ball gag in her mouth and strapped it behind her head. My hands caressed her tingling face and slowly moved down her neck and chest, stopping at her tits. I lift and fondle them, squeezed them hard and pushed them together. I looked her in the eyes while I flicked her nipples and grabbed the entire areolas, pinching and twisting as far as they could twist. I spit on her chest and moved the spit around her nipples, getting them wet before I blow on them. They grew and hardened as they got cool to the touch. I grabbed vice clamps
connected by a chain and clamped each nipple down, giving her a permanent sting around them. I yanked on the chain, pulling her tits up and out. She whimpered in discomfort, upsetting me. I slapped her tits with an open hand, ""This can get worse, you know..."" My hand moved down her chest, over her stomach and to her bald pussy, finding moisture that wasn't shower water, ""... and I see that I must not be punishing you enough."" I pulled up a chair and sat directly in front of her, my face level with her soaked pussy. I forced two fingers between her swollen lips and thrust them inside of her, then three, then four, letting them get soaked in her juices. I pulled them out and slapped her in the face again, leaving her cum streaked across her face. I lit another cigarette and stared into her eyes, no words came out. I puffed deep and as the cig began to glow with heat, I moved it close to her skin just below her waist. I held it just a half inch away and slowly moved it around, she felt the
heat as it nearly burned you. I continued smoking and moved it lower, spreading her legs and doing the same on the inside of her thighs. I finished the smoke and stood up pushing the chair back, turned her around by her hips and pulled them back so that she bent at the waist and had to stand on the tips of her toes to remain standing. I kneelt behind her and spread her ass apart, beginning to tongue fuck it deep, darting my tongue in and out and spitting on it. I slipped in a metal plug with a gem and gazed at how pretty her ass looked with a diamond on it. ""Let's see how far you can stretch."" I pulled out the plug and slid in fingers, one after another while adding lube at the top of her ass and watching it drip down. I didn't stop until I could see inside of her, it is only then that I started moving a large toy inside of her. Little by little, it stretched and filled her as she began to squirm. As it rested deep all of the way inside, I stood and gave it one
final push. I leaned in and whispered, ""Tighten up and hold it, don't let it drop."" I reached around and started playing with her pussy as I stood grinding my hips against the toy. I eased two fingers in and rubbed her g-spot vigorously, bringing her to orgasm until she gushed down her legs. She quivered and tightened, I spanked her hard until her ass pushed the toy out. As she trembled, I unhooked her wrists and her legs weren't at full strength so she fell to the floor. I pulled up on her hips until she rested on her knees and pulled her hair until she held herself up with her hands. I picked up the toy and spanked her with it in disappointment, ""I told you not to let it drop. You failed, now your fucked!"" As she recovered on her hands and knees, I grabbed the leash and directed her to crawl to me. I sat back in that chair and collected the chain as she crawled closer to me. I sat on the edge and looped the chain under the chair and over the top, grabbing it over my shoulder. I pulled the leash and
her face is pulled closer and closer to my now throbbing cock. I removed the ball gag, grabbed myself and aimed it at her mouth, I pulled on the leash until she took all of me in her mouth, ""keep your hands on my waist and your eyes open. I want to look into your eyes as you suck"". She stared into my eyes as she gagged on it as I grabbed the back of her head and pulled her down on me. I pushed up and started fucking her throat hard, loving every second of her eyes tearing up. I got so excited that I stopped her by pulling her hair up, then I picked her up and carried her to the bed. I forced her to spread out face down and I bound her ankles and wrists to the four corners. ""Your ten minutes of time out starts now."" I exit the room. Time slows down with her senses deprived. Everything is pitch black, dead silent and she is rendered entirely helpless. She lay there face down, drawn across the bed, powerless and unsure of the time that has passed. For all she knows, ten minutes could have already passed... perhaps even more time has gone by. She heard the door open and then close, followed by a sudden warm breath on the back of her neck. I say nothing to you, fore there is nothing left to say. She was not in a position to disobey anymore (let alone move) and she knows full well why she is being punished so I remain
perfectly silent, save for my heavy and excited breathing. She lay there with the thought that there is nothing she could do stop this and she began to inadvertently entertain the notion that it may not even be me looming over her. As a shiver runs up her spine, she felt finger tips lightly run down it. She felt the pressure of my weight as I straddled her lower back, and she knew I was facing towards her legs once she felt my knees at her hips and my half stiff cock resting on her tailbone. She heard the strike of a lighter proceeded by a long inhale, then hands squeezing her ass and spreading it apart. I continued as I had before, dragging the heat of the cig across her legs and ass and dropping hot ash on her for an added sting. I finish the smoke and start rubbing between her legs, using her moisture and my spit to probe her holes. I used both hands, inserting my middle fingers into her pussy and my index fingers into her ass deep. As they get all of
the way in, I stretched her out and gazed into her, pondering what to use to keep her that way. I chose a large glass plug for her ass and a metal g-spot toy for her pussy, easing both in before standing up to marvel at the sight. She laid still and untouched for only a moment, until she felt leather straps from a flogger style whip gently drag at her feet. They move up her calves and inner thighs, across her toy filled pussy and ass, up her back and all of the way back down again. As it came back up, it is flicked harder, then harder as I whipped her butt and then back. This continues until she began to pull and squirm, inspiring me to straddle her back again to keep her still. I switch to a leather paddle with fur on one side, smacked her ass over both cheeks, her tight young butthole tightens around the plug as it is forced deeper with every moment of contact. Once she was bright red from it, I flip the paddle and rub the fur over the skin. She calmly
moaned from the sensation and moved her hips around, as if to motion to me that she was begging for more. I moved down between her legs, paddled three times more and start to remove the toys slowly as I savored the sight. For a moment I could tell that she was thinking that this may be the end of her punishment, the moment is quickly stolen as she feels the pressure of a larger glass toy working it's way deep inside of her ass. As it rested firmly all of the way inside of her tight end, she feels an even larger metal toy penetrate and bury in her taught pussy. Both relatively reactionary materials are soon accompanied by the high speed vibration of the Hitachi wand that I then strapped to her leg between them, I did it so that it will stay in place while I smoked and watched her convulse as it forced orgasm after orgasm out of her. I finally spoke, ""If you want to be out late at night, dressed like a nasty little bought-and-paid-for whore, then this is what you can expect in terms of the treatment you
will receive. Do you understand me?"" She mumbled through the gag and orgasmic bliss as best as she could, ""yes, sir..."" ""What? I can't hear you. Again,"" I commanded. She screamed, ""Yes, Sir!"" I switch off the vibrator and leaned in to say, ""Good girl. I think that you may finally be getting the picture of who's boss around here."" I remove the toys, gag and blindfold and unhooked her from the bed, and she curled into a ball as I climbed into bed and laid behind her. She started to drift off into a deep rest, whimpering and feeling like a dirty humiliated slut. I kept her awake by fondling her breasts and she felt me get harder as I ground my cock against her throbbing crotch. I whispered to her, ""We're almost done here but I have overlooked a glaring detail. If you really want to be a good little fuck-slut, Princess... You need to always take a man's cum wherever he wants to give it to you."" I thrust all of the way into her sloppy gash, hard and deep until it was sufficiently
soaked. I pulled out and forced it into her gaped asshole until I was ready to cum. I jumped up beside her head, held her down by her throat and stuck the head of my member in her mouth. I jerked my whole load into her mouth and ordered her to show it to me before she swallowed it. I kissed her deep as it ran down her throat, ""You were a good girl and took your punishment like a champ. Now, go to sleep. You have a long weekend ahead of you."" We settled in and lay together as I spooned her. Before her eyes shut, she saw the glow of a red spot and in the dark, she began to make out the outline and quickly realized that it was the record light on a video camera.


Greetings, and thank you for your consideration. Please read the below thoroughly before responding. I have made an effort to get everything on the table. This way, you may be the judge of whether or not you're going to respond. If this post is active, I'm still looking. Please only respond if you are serious and do not waste my time, as I am not here to waste yours. (no men... No Men... NO MEN!!! Seriously, save your time and energy... quit pestering me over something that IS NOT going to happen.) 

Currently, I am actively seeking a dominantly submissive baby girl who identifies as a bisexual switch and would be interested in a long-term monogamish, consensual ownership/relationship with a common goal of coinciding/playing with others (can you say, ""Unicorn""?). Feel free to inquire for more details if you wish. My intentions are to start slow but I might be inclined to jump right in if the chemistry is there... let's start with friends, though. On the naughty side, I find enjoyment from so many different scenarios (as you will see below) that I shouldn't limit it to just one so I'll just say that you can use your imagination to the naughtiest extent with me. Simply put... If I haven't, I want to. If I have, I want to again. If you can, A.) challenge my mind, body and soul, B.) expand my horizons, and/or C.) out-filth me... I'm already Yours! I am most aware that my postings seem as though they are copied and pasted. That's because they are. My information doesn't change too often and it is way easier.

I am a Colorado born and raised, Caucasian mutt. I have long dark brown hair, furry body and I where my beard proudly. I fluctuate between 150 to 160 pounds depending on the season, so being 5'7""ish, I tend to categorize myself as averagely husky. I have eyes of a different color, they shift from blue to green to grey and they have a gold flux. I have a deep, gruff voice that always gets noticed, it's great for radio/phone-sex. I am neither overly, satisfactorily nor insufficiently... but very well endowed. I'm an hygienic carnivore in the best shape of my life (but I could always take better care of myself). I have a few tattoos as well, one of which is a self portrait. I dress down a lot, jeans and a t-shirt that are both too big for me... but it's the next best thing to being naked. ;) I was raised free in Littleton and I live in Lakewood with a truly radical female roommate (she is my FRIEND... No, we do not engage each other in play!). I have means of transportation and two steady jobs. 

I'm an easy-going, heteroflexible/try-sexual, monogamish/hedonist kinkster with simple needs. I'm an independent, shameless free-thinker. I live carefree, confidently and spontaneously. I would say that I am fairly bold, I will do most anything just to know I did it. I am masculine and assertive but also courteous and often a little quiet. My views on everything are all the same, everything is grey. ""Right"" and ""wrong"", ""good"" and ""bad"", black and white... it is what it is (subjective) and in that, it's all the same to me. I treat everyone as I would want to be treated. I'm calm on the surface but a generally exciting person (just lacking excitement at the present moment). I like to talk and listen equally and I'm huge on communication, I confront my problems and never run away. I tend to be a bit ruthless, dry and cynical when it comes to my sense of humor but I have quite the sharp wit and I sure do like to laugh (and I crack myself up). I am a sucker for manners, courtesy, kind words and genuine smiles. I am particular when it comes to the people I spend time with but I am a very accepting person, I always accept and never judge (and I sleep very well with others). I strive to be the perfect person to everyone that I encounter, even though I know that it is absolutely impossible... So, I'll just have to settle for excellence! On that note, I do not require any more service than I intend to deliver. Aside from living in a sexually charged atmosphere, my world is meticulously organized... There is a place for everything and everything in its place.

I am not a sober individual, by any stretch of the imagination. I drink a lot of coffee and I smoke more cigarettes & herbals than I should. I do drink... More than a little and less than enough... but never a single one before the yard hour. (Other drug use has been known to happen, which is likely to continue). I am in love with sexual activity (BDSM is a close second) and find myself thinking about it more often than I will admit to you. I have a high sex drive (25/8, love the rough stuff) and I'm into nearly anything and almost everything. The following is not a definitive list nor is any of it necessarily expected, life is always changing: dirty talk, teasing, making out/cum-swapping, massaging/groping (fingering, fisting), oral (both ways, 69/rimming), anal (both ways/ATM), toys (I have tons!), bondage (both ways), fetishes (feet, sleeping, smoking, spanking, panty stuffing, shaving, gaping, public play (exhibitionism/voyeurism), worship, creampies, verbal abuse, squirting, mild pain... to name a few), role-playing fantasies (older/younger, intruder/victim, doctor/patient, role reversal and more), threesomes/groups (DP/DV/DA) and many other naughty ideas. You would expect me to be dominant but I am open to submission. I am primarily focused on women and femininity, but I've been known to have a penchant for androgynous boys, butch girls and transgendered people.

Hard Limits:

(Means NO)

1.) - Prepubescent children
2.) - Animals
3.) - Corpses
4.) - Non-hygienic conditions
5.) - ANYTHING to do with vomit/snot/scat
6.) - Extreme pain
7.) - Consumption of menstruations
8.) - Even the slightest possibility of contracting a sexually transmitted disease.

Soft Limits:

(Means MAYBE)

I may consider budging on one or all of these for a really, REALLY rad lady.

1.) - One night stands
2.) - Sex on the first date
3.) - Committed cheaters
4.) - Home wreckers
5.) - Morbid anorexia/obesity
6.) - Dreadlocks
7.) - Shaving myself
8.) - My blood being drawn
9.) - Individuals who don't like oral performed on them

... Otherwise, I'm fairly open to suggestions. 

I have more toys, restraints, porn, etc than any single man should (too many options to list). I have a page on Fetlife that delves further into detail.

I aim to please, never disappoint and I would never hurt you any more than you ask me to (unless you ask me to. Ha!). Anyone as sexual as me would be privileged to have me around (and if I can do it to you, you can do it to me). I only ask that you share the same interests and way of thinking & that you are as open as I am. Age, race & body type make no difference to me... but mutual attraction helps. Sugar and spice, naughty or nice, fire and ice, short, tall, big, small, thin, thick, princess, bitch... open to all... but... Younger, petite, smooth, tattooed, latina, bi, squirters, lingerie/sexy outfits, shaved heads, switches, all +++++++. My age or within a few years either way would be great. I have a particular fancy for entertainers/dancers.

I'm here for fun, not to waste time. My offer is for nothing more than to spend time together as two consenting adults with a consensual perspective. Ideally, we would meet as soon as possible, get to know one another and maybe graduate to a heavy-petting/make-out session and take it from there. I have no intention of being rude and cruel to absolute strangers so please show me the same respect. 

Intimidation and fear of the above are a completely natural response so I understand if you are apprehensive to talk to me. That said... if you do not possess the fortitude and constitution to follow through, you will be better off not spending your time contacting me. Additionally, honesty and communication are majorly important to me. If you disagree with this statement, save yourself some time and leave me be. Oh yeah, stand out! Type a good safety word in the subject line so that I know you're real and you read and understand everything above. Also, MATCH me pics and details, and I'll respond promptly. If I don't answer, you did not fit the criteria of the post or didn't make even the slightest effort to respond to me. Nothing personal, I just know what I want and precisely what I'm looking for. Honestly, this post is more of a feeler, to see if the ""girl of my dreams"" is really out there and possibly reading this. Furthermore, be ready to voice verify by phone... PERIOD! Thereafter, we should discuss our direction further... over some sort of beverage.
",33,hwp,,,,,,,,,,,," 5'7"" (170cm)",,,,,,,,,,,,,,single,,
