url,city,subcity,datetime_created,datetime_updated,category,type,title,text,age,body,body art,diet,dislikes,drinks,drugs,education,ethnicity,eye color,facial hair,fears,hair,height,hiv/hsv/hpv,interests,"kids, have","kids, want",likes,native language,occupation,personality,pets,politics,religion,resembles,smokes,status,weight,zodiac
http://denver.craigslist.com/msr/5431613377.html,denver,,2016-02-03 08:10,2016-02-26 07:48,msr,m4w,do you live close to Harvey Park?,"
I'm looking a companion who lives near Harvey Park. Single? perfect. Married? don't bring your drama but I'll be discreet
",,,,,,,,,,,,,,,,,,,,,,,,,,,,,,
http://denver.craigslist.com/msr/5438722679.html,denver,,2016-02-08 08:40,2016-02-26 07:17,msr,m4w,To Cali on the Magic Bus!!!,"
I am leaving for Cali sometime around the middle of March in my Retro RV... AKA ""The Magic Bus"". It has been retro fitted with all the latest greatest bells and whistles, new system, newer engine, new awning, new patchwork curtains, so it is ready to roll... 

Meanwhile, I am in search of an open minded-free spirit who will enjoy the freedom of the road, as much as she would love promoting the tour myself and my business partners have put together. I will simply say it is wrapped around Cannabis and Music Festivals. Along the way, we will be enjoying the great outdoors of course, everything from hiking, paddle boarding, disc golfing, skinny dipping, and maybe even some candy flipping will be in the mix.....

As much as I am in the mood for some stimulating company, it would be nice to share some colorful chemistry together throughout the adventures. I am bold and so I will admit I am a gentle- man with strong firm guiding hands and I really am only interested in a mesmerizing muse, who knows how to put her tight lil body to good use...

I am open to meeting up now.... if we hit it off well, (which we ill need to if we are going on this trip together...) I am open to sharing my space until we leave in March for this tour, not a requirement, I am just throwing it out there, in case it helps.... All I ask in return for her friendship and company is some help with day to day duties of being on the road... and promoting all of our ""sweet stuff"" as the opportunities present themselves....

I have plenty of pics to share...and am in great shape....I am only interested in someone who is in similar health.... 420 friendly of course.... non smoker, and I would prefer her not to be either...but not necessarily a deal breaker...
",44,fit,,,,,,,,,,,," 6'0"" (182cm)",,,,,,,,,,,,,,single,,
http://denver.craigslist.com/msr/5439661725.html,denver,,2016-02-08 17:50,2016-02-26 06:43,msr,m4t,Looking for that special girl,"
I have just moved to the area not very long ago at all, yes, new to Colorado. I thought what better time would there be to see about fulfilling a fantasy that I have had for quite a number of years now. I have wanted to meet and spend some time with a transexual M2F. I find it so very sensual and erotic to imagine being with that special woman and as I am getting to know her find that there is the special package. I am kind and thoughtful. I am polite. I know how to respect boundaries and can carry on a conversation. And I can be a very good friend. I am 5'9"" at 165 pounds with graying hair and mustache. I am told that I am good looking and do not really act my age, probably because I have stayed active and have exercised all my life. Now, for the issue. I am also married and so, as much as I hate to say this, things should be discrete. I hope that doesn't make me too big of an asshole in your eyes. Perhaps you might enjoy the possibility of an affair?If you would enjoy meeting a caring mature man, please send me a message. Pictures would be nice also. Your picture will get mine. Thank you for your time in reading this.
",59,athletic,,,,,,,,,,,," 5'9"" (175cm)",,,,,,,,,,,,,,,,
http://denver.craigslist.com/msr/5465219929.html,denver,,2016-02-26 03:22,2016-02-26 04:07,msr,t4m,Looking for a cool guy to get to know,"
Hi guys I'm a newbie cross dresser looking to chat with a cool guy. I'm not entirely comfortable with being in public dressed but I can assure you that I'm very passable. I'm looking for a guy who 
is tall because I'm 6'2, very nice body, older than 23, and most importantly drug and disease free if it leads to that. If you're sending an email please include a picture, or you will be ignored. All photos are me! I am in a relationship so I would like to keep things as discreet as possible.

Love muscles!!!
Kik vsholic13
",21,,,,,,,,,,,,,,,,,,,,,,,,,,,,,
http://denver.craigslist.com/msr/5465175006.html,denver,,2016-02-26 00:22,2016-02-26 01:10,msr,m4w,Cuddle buddies,"
It would be much nicer to go to bed with someone to stay warm with. 30 year old guy here not wanting to sleep alone, that's it.
",,,,,,,,,,,,,,,,,,,,,,,,,,,,,,
http://denver.craigslist.com/msr/5465182402.html,denver,,2016-02-26 00:47,2016-02-26 00:47,msr,m4w,New poly guy looking to date,"
Hi there, I am a poly guy in a relationship looking to date on my own or possibly add a 3rd to our relationship, depending on how everyone gets along. I have been told by every girl I have ever dated that I need more then one girl to keep up with me. It wasnt until my girl brought it up to me since she has been in many poly relationships that this really seemed right to me. I am not looking to cheat at all. Everything will be communicated with everyone involved. 
So anyways, I should talk about me some :) I am 38 (just turned), 5'6, average weight, straight, musician with a great job downtown. I love to go check out bands, sit back and relax, have a cold beverage, play a board game or card game and just talk. I have a few large tattoos that I keep mostly covered because I enjoy them for myself, I don't do any drugs and I have recently gotten into vapor ecigs. If this interests you and you would like to know more, shoot me a message with your astrological sign and a few pics of yourself and lets start getting to know each other :)
I hope you have a great day.
",38,average,,,,,,,,,,,," 5'6"" (167cm)",,,,,,,,,,,,,,,,
http://denver.craigslist.com/msr/5451501699.html,denver,,2016-02-16 22:00,2016-02-25 22:05,msr,m4w,Sexy mature (45+) white female for ongoing physical relationship,"
Looking for a very sexy, very sensual and sexual, very attractive, slim to hwp mature white female friend for lots of intimate passion.

I'm white, single, attractive, fit, tall, slender/lean, clean cut and clean shaven, smart, funny, affectionate, well endowed, strong sex drive, highly oral and tactile, and powerfully, passionately sensual and sexual. Love sex, love kissing, love the erotic intensity of two sweaty, sexy bodies intertwined in passion.

Genuine friends, strong physical/emotional connection, no strings. Prefer ongoing and regular.

Please be clean, healthy, DDF, funny, affectionate, down to earth, and a non-smoker/non-drug user.
",56,,,,,,,,,,,,,,,,,,,,,,,,,,,,,
http://denver.craigslist.com/msr/5434049816.html,denver,,2016-02-04 17:35,2016-02-25 21:46,msr,m4w,Latino looking for a FWB situation,"
Early 40s Latino looking for a casual woman who's interested in a casual FWB situation.
Im married with permission, lol.
Preferably a woman who wouldn't mind having an experimental thing with the wifey.
She's bi curious and would like to explore that venture.
I'm average to husky build make who's independent and has time to play.
Looking for an average woman who is missing that connection. Who knows what this could lead to,possibly ongoing thing.
I'm DDF and you have to be too. 
Send a friendly pic or what ever you want to send, a short bio of yourself and what you are looking for as well.
",42,,,,,,,,Hispanic,,,,,,,,,,,,,,,,,,,,,
http://denver.craigslist.com/msr/5447171393.html,denver,,2016-02-13 20:26,2016-02-25 20:14,msr,m4w,You should be our CuckQueen,"
My girlfriend has this kinky fantasy where she wants to watch a woman have sex with me. We have had a threesome and she says that she would really enjoy the opportunity to just watch me play with another woman. She knows what she's getting herself into; like I mentioned, we have had a threesome and there was lots of juicy kissing and I pleasured them both orally, which she really enjoyed. I would venture to say that most women would be intrigued by the idea of having a voyeur but would prefer to have a man to themselves, in private, because they desire the intimacy they would get from a man without his partner present, however... that is what she's wanting to see! She says I get a hunger in my eyes and she wants to be like a fly on the wall. She and I are clean and I am vasectomy safe. We personally knew the woman who we played with so we were comfortable not using a condom. We know there is just as much risk having oral sex, so we would like to know a little about you. As much as we don't want to break up a relationship, she and I feel it's probably safer to host a lonely housewife but we have to be assured that we're not going to break up a marriage. We do have a conscience. Hell, if a woman's going to stray, it might as well be with a safe couple, right? If you are a single woman, we'd like some assurance that you're not jumping into everyone's bed. I don't want to end this on a down note so just imagine the intense orgasm you're going to have knowing you're going to be fucking her man, right in front of her!
",,,,,,,,,,,,,,,,,,,,,,,,,,,,,,
http://denver.craigslist.com/msr/5432029078.html,denver,,2016-02-03 12:02,2016-02-25 20:12,msr,m4w,my House is Empty,"
So, everyone else is gone for the day and I want to have some naughty fun. I have always been told that I have very nice arms and shoulders as well as gorgeous blue eyes. I prefer to enjoy the build-up of sex, as opposed to jumping in and fucking, then leaving. That's just not my style. If that's what you're looking for, I'm sorry. I want that chemical attraction, that desire! I enjoy long French kisses (and in the heat of passion, sloppy tongue action!) I want to take the time to explore your body, to run my hands over every curve of you. I thoroughly enjoy breasts. I take my time to sucking on them and fondling them. I love when they get hard and it's a turn on if she asks me to bite them, though I'm nervous about biting too hard. I love a good, clean pussy to taste, I could I cold spend hours licking your pussy and suck on your lips. I love tasting a woman's cum and I love to feel her slippery juices on her lips and I love to explore the folds of her lips and to suck on them! I really love to pull my cock out and stick my tongue into your pussy too! I'm getting horny just typing this.
I will only send photos to those who send one, fair is fair
Please put your zip code in the subject line or I'll assume your spam or replying to everything out there 
",,,,,,,,,,,,,,,,,,,,,,,,,,,,,,
http://denver.craigslist.com/msr/5464876076.html,denver,,2016-02-25 17:50,2016-02-25 19:52,msr,m4w,Unique-Wild-Tour Mate Wanted,"
I am going to be as honest and as blunt as is possible on this medium. I am 44 going on 35. I look it, and I feel it. This being said, I am looking for a free spirit, a wild child, someone who is probably between the ages of 23 and 33 who is young at heart, but who is mature enough not to play games. I do what I say and I say what I do... I walk the walk and I talk the talk, so if you don't know what that means, for get about me. Integrity and substance are key to me, wether we are friends or lovers, without a trusting foundation, we have nothing to build off of... 

Ideally, I would like to find someone who is looking for an ""older guy"". I say this because I enjoy the energy-power and chemistry exchange that manifests when there is this kind of bond. I am a passionate man, an outdoorsy guy, a very creative soul, with an intensity, and imagination that is rivaled by very few, if any...

The tour I mentioned will be focused on promoting and vending, the Ganja Coloring Book and Swag that compliments it, that I just published this month. We will start our ""tour"" here in Denver, later in March, and then will be participating/vending at the 420 Festivities in Colorado, before hitting the road in the RV in my pictures. We will be heading to such fun events like Lighting in a Bottle, High Sierra, some other Cannabis Cups, Electric Forest, Symbiosis, Hulaween, and if the tour goes as planned, we will be going to the Cannabis Cup in Negril Jamaica in November 2016. Of course there will be 10-20 other festivals we will be attending, but those are some of the more recognizable names. 

If you happened to have any ""swag"" or art you vend, of course, there are plenty of opportunities for that, or if you are a musician or a performer, we will be surrounded by artsy open minded, free thinking souls, all Spring and Summer. If you happened to have any social media, or sales, or vending skills, or all of the above,these would all be a great help on this tour. I have all expenses covered... I really just want and need some feminine, fun, happy, energy to share this tour with and to spread the love with. 

On a side bar, I will consider a ""friendly-platonic"" travel-tour mate, but only if this person brings some real skills to the table, like the drive and ambition to tend to the vending tables for 8-10 hours a day, or some superior Social Media Marketing Skills, or if this person is exceptionally beautiful and will play the will play the role of Brand Ambassador and dress as one of our playful-sensual-inspired cartoon characters, while working the crowds, handing out wristbands and stickers and in the process driving people-consumers back to our RV-Booth.... Of course, wether this relationship is focused on a platonic, or on another level, chemistry, and good vibes are key... I am a gentlemen above everything else...

Some of the more ""colorful"" pics I am attaching were during other events or festivals... There is a very playful festive, side to my soul, as well as a very driven, entrepreneurial and revolutionary side...I am posting several pics, and if you want me to take you seriously, please return the favor. Please also respect the time and thought I put into this add and put some real thought into your reply.... 

",44,fit,,,,,,,,,,,," 6'0"" (182cm)",,,,,,,,,,,,,,single,,
http://denver.craigslist.com/msr/5464973930.html,denver,,2016-02-25 19:20,2016-02-25 19:20,msr,m4w,married and looking...,"
I'm an early 50s married white male. I'm well-educated, successful, fit, and attractive. My world is perfect for the most part, but I crave the physical element of a healthy relationship. I've been in a sexless marriage for too long now.

I'm a very genuine, attentive and adventurous man. I'm looking for an attractive woman who is perhaps caught in a similar situation. I'd be interested in getting together occasionally for some phenomenal romance. I want to feel those butterflies again, as well as the anticipation and ultimate satisfaction of that profound sense of touch.

If you're a responsible, attractive woman, email me and lets start a dialog. If you live a healthy lifestyle and take care of yourself I'm the kind of man for you. I'm not out to wreck anybody's marriage, far from it. Discretion is of utmost importance.

Looking forward to getting to know you. . ..


",49,,,,,,,,,,,,,,,,,,,,,,,,,,,,,
http://denver.craigslist.com/msr/5464793241.html,denver,,2016-02-25 16:44,2016-02-25 16:44,msr,m4w,Rock and Hard place,"
You miss the electricity and burning fire and desire.

Love your life but missing excitement, intimacy, passion and romance?

He would never understand what it is you want. You find that you can not talk with anyone about these intimate thoughts that are inside your mind.

You feel the same emptiness and loneliness. 

You love your life and family but yet something is still missing.........

You have these wild desires inside you that you want to let them all out.

You want to meet someone that will help you, someone that is open minded and willing to do what ever it is you want to explore.

Have you ever met someone you felt an instant connection with?

Perhaps deep down you want to see what it would be like to have an intimate relationship without having a relationship? 

But at the same time nervous about the thought of being adventurous?

I know you are out there, somewhere, leading your life. Shopping, cooking, dropping the kids off at school or just living. In the quiet moments of your day, you wonder how you got to where you are and why. Feeling there has to be more in intimacy, knowing someone is out there, looking for you and wanting you. 

Deep, deep in you innermost being is an ember. It is burning and desiring for a flame. A flicker will do. The nucleus of a flame, a flame you dream of burning bright. But, it just smolders in your day to day existence. You desire a man to tend to it....to add the fuel, carefully, gently, expertly and to blow that dying ember into a ferocious flame. the steady fire and a passionate conflagration flame that consumes all the daily drudgery of life. 

I believe it is fate that has brought you here. I have been searching for you. A woman of depth, perception, intelligence, passion and romance. A woman to be friend, confidant, lover and equal. Not wanting to change your life but to add that missing piece to. You know that spark, that connection. To form memories that last a lifetime. 

I absolutely adore diversity! I am a normal guy, not the Craigslist Killer and just know there is someone out there that understands and seeks the same. So in close, Please be serious, as I am and include a description of yourself and no one liners!

Seeking a long-term affair with the following elements:

L => love which may only be found and sustained within a very special and trusting relationship

O => open and honest communication conveying our deepest thoughts, feelings and needs

V => validated and reinforced through eye contact, touch and never ending / reassuring communication (spoken and unspoken) 

E => entwined as one by shared respect, admiration and insatiable love and passion 

R => relationship filled with intense emotion and, when apart, always present in mind and heart

S => secreted lovers lusting for those intimate times but also enjoying just being together.

Please send more than a one line response. You do not need to write a novel, just give me a glimpse of who you are and what you are seeking. Don't ask for a picture in your first email.

Yes, I know I am asking for a lot. . ..so. . . why not hope that you are out there. I look forward to your thoughtful response. Thanks!!!
",,,,,,,,,,,,,,,,,,,,,,,,,,,,,,
http://denver.craigslist.com/msr/5464709438.html,denver,,2016-02-25 15:44,2016-02-25 16:43,msr,m4w,If reading this makes you wet - imagine what the real thing will do,"
Let's start with me giving you a massage. I know very well what I am doing...

I rub oils into your back, massaging your shoulders, back and sides. My fingertips glazing over the sides of your breasts as I caress your nipples. I move to you calfs and feet, massaging them, gently moving up your thighs. Kneading your thighs in my hands, your legs instinctively spread little by little. The side of my hands gently rubs the side of you pussy. It seems accidental, but you know what this is leading to, so your excitement grows in your relaxed state.

Bolder my hands rubs harder as I massage your thighs. I feel the heat off your now moist pussy.
I drip more oil on your ass cheeks, each hand firm on one check as I massage them, pushing them apart, exposing your ass and playing with your pussy lips. As I continue, my thumbs, slick with oil rub over your ass and then over your wet pussy. Slowly one thumb slides in, my index and middle finger slide over your clit with my thumb still in you. I start rubbing you clit and fuck you with my thumb.

Do you like what you have read so far, are you excited enough to see what can happen next?

Change the subject to ""I'm Ready"" so I can weed out the spammers. Include age and part of town you live in. Please be fit. Age and ethnicity don't matter as long as you are an adult. You can be attached or not, just know that I am and be okay with that. 
",54,athletic,,,,,,,,,,,,,,,,,,,,,,,,,,married,,
http://denver.craigslist.com/msr/5464781956.html,denver,,2016-02-25 16:36,2016-02-25 16:36,msr,m4w,Married dom seeking married sub,"
If you clicked into this, then you and I are likely in the same boat - in a marriage (or partnered) but unable to live out a very important part of who you are (or think you are). If you are like me, you are happy in that relationship in most ways, except in this arena of kink and sexual expression and the mental dynamics that accompany it. I am seeking a woman who is submissive to develop a discrete, safe, but amazing d/s relationship with. It is ok if you have experience with this, and it is ok if you are just now giving yourself the freedom to begin to explore this. I will lead us as we craft this together. There are many details to talk about, so send me a thoughtful reply telling me why this idea intrigues you and we can start from there. I am seeking a married or partnered woman between the ages of 20 to 40, someone who is fit and in relative shape, intelligent, committed to protecting each others' situation, and who is available during daytime hours. If that's you, please reply with ""Interested"" in the reply line. I look forward to starting some dialogue.
",,fit,,,,,,,,,,,," 6'0"" (182cm)",,,,,,,,,,,,,,,,
http://denver.craigslist.com/msr/5448055254.html,denver,,2016-02-14 15:45,2016-02-25 15:45,msr,m4w,You can't believe you're looking on Craigslist,"
Neither can I, but I'm glad I got your attention. 

Please go ahead and read my entire post. I promise you everything I write here will be true. You just need to read it and then reply honestly and seriously if you truly feel we can share an adventure full of fun, passion, intimacy and intensity. The only thing I ask is that you read everything and if you reply please know what you are looking for and communicate that. In return, I will do the same.

You might be in a relationship, marriage or otherwise that is now stale and unfulfilling. The needs and desires you truly believe you deserve go unsatisfied. Bluntly put, you are not being happy and you are left with a sexual ""itch"" that is driving you crazy...which brings you here. 

We all wear multiple hats in our lives, be it wife, mother, friend, daughter.....but it is vital to your inner happiness that you also act as a lover and that you have a lover in your life. You want an intelligent, handsome, sensual man that can take you in his arms and take you on the erotic journey that has been out of your reach for too long. You want both a friend and a sexual partner...yes . . . a friend with benefits . . . to experiment with, have fun with and to stroke that fire burning inside you and not blow it out again. 

Age and ethnicity aren't relevant. You are healthy, fit and consider yourself attractive. You are educated, discreet and you know what you want. You like kissing, you like fondling and you are comfortable with your sexuality. You either know how to express your sexual needs or want a man to help bring it out of you.

I am a married white male who feels the same way you do and has finally decided to do something about it . . . just like you. While multiple women may reply to this posting, I am really looking for just one. I am 5'10'' 170 pounds, good looking (or so I assume when I get smiles from women while walking down the concourse at DIA), athletic(work out 5 or 6 times per week), have deep blue eyes, fun/funny, a good kisser with gentle hands. Yes, you will find me fun in and out of bed, adventurous and open minded. There has been a vacuum in my life for too long and I am taking action now, because just like you.. I deserve it. 

So what are you going to do about it? There is so much more we can discuss, but this posting is simply an introduction. Write me and let's start a conversation. As I said, I am only looking for one woman....is it you? A picture is not required. There will be plenty of time to decide what we want to do there.

To avoid the spam attack, please include an adjective in the subject line of your reply that describes you.
",55,fit,,,,,,,,,,,,,,,,,,,,,,,,,,married,,
http://denver.craigslist.com/msr/5464586724.html,denver,,2016-02-25 14:25,2016-02-25 14:25,msr,mw4w,Clean kinky couple looking for fun bbw!!,"
We are a fun, clean, solid mid-30s couple looking for a fun girl to have a sexy, kinky time. He is dirty blonde and slender with a thick 8 inch cock and loves big girls!!. She is a brunette bbw with D cups. We enjoy movies, blunts, music and filthy sex. Sexually we are fairly kinky and enjoy oral, cum play and lots of other moderately naughty things. 

We are looking for a BBW who is real and really naughty and likes boys and girls. He is straight but she is very bisexual. We can host and would love to have you over to smoke some weed and makeout/whatever else. Possibly ongoing!! We are very real and if this add is up we are still looking:)
Please include a photo and some details about yourself:) please be real reply only if you're serious 
",,,,,,,,,,,,,,,,,,,,,,,,,,,,,,
