url,city,subcity,datetime_created,datetime_updated,category,type,title,text,age,body,body art,diet,dislikes,drinks,drugs,education,ethnicity,eye color,facial hair,fears,hair,height,hiv/hsv/hpv,interests,"kids, have","kids, want",likes,native language,occupation,personality,pets,politics,religion,resembles,smokes,status,weight,zodiac
http://denver.craigslist.org/w4w/5404863271.html,denver,,2016-01-15 18:33,2016-01-15 18:44,msr,w4w,"Long Distance, Visiting in November","
I'm a 34-year old, 5 feet tall, 178 pound African-American woman. I have a PhD and I'm well travelled. I'm an open (polyamorous) relationship with an African-American Man. I'm looking for a long distance girlfriend. I'm looking for someone who is smart, funny, generally happy, and STD-free.

I love Colorado. I'll be in Denver for about a week in late October/early November. So we'll ha e a chance to connect physically later this year.

When replying to my post, in the subject line write ""Denver"". 
",34,,,,,,,,,,,,,,,,,,,,,,,,,,,,,
http://denver.craigslist.org/w4w/5381646954.html,denver,,2015-12-30 22:19,2016-01-14 14:03,msr,w4w,"W4W/FWB maybe more, ready to meet downtown library today","
I'm gonna be downtown at library wanna meet a lady Looking for a female ONLY! for FWB/friends to have fun discreet casual sexy sensual yummy sex, I'm experienced had gfs, I'm not into long winded emails cause I need this now please, VV and pics first...again NO COUPLES or NO MEN!!! Must be ddf, Let's meet asap â˜ºðŸ˜‰
",,thin,,,,,,,,Brown,,,Black," 5'3"" (160cm)",,,,,,,,,,,,,,separated,,
http://denver.craigslist.org/w4w/5402646443.html,denver,,2016-01-14 10:57,2016-01-14 12:33,msr,w4w,friends and a workout buddy,"
Hello I am looking for someone that is looking to get into shape I plan on joining 24 hour fittness i am also looking for someone that has some nights and weekends free and some days if this sounds like something you are looking for as well hit me up
",30,,,,,,,,,,,,,,,,,,,,,,,,,,,,,
http://denver.craigslist.org/w4w/5402638894.html,denver,,2016-01-14 10:53,2016-01-14 11:03,msr,w4w,Why is this so hard,"
Why is it so hard to find lesbian or bisexual females this days in high school it was bit easier but now it is harder lol. At this point in my life I am just looking for woman to be friends yes I said friends no i am not taken and no i am not curious or married I just think all relationships start at square one being friends here is a little about me I have a job that I love and I did go to college and graduated. I am a 30 year old Mexican woman if you want to know more messgae me hope to here from you
",30,average,,,,,,,,,,,,,,,,,,,,,,,,,,single,,
http://denver.craigslist.org/w4w/5377174642.html,denver,,2015-12-27 22:50,2016-01-14 10:38,msr,w4w,Butch looking for her femme,"
Single, butch lesbian looking for her femme. Alittle about me, I'm 34, got my own place, vehicle and things going on in my life. I keep a busy life but will make time for the right girl. What I am looking for is someone who is honest, loyal, smart and funny. I love to laugh! I am alittle country and nerdy all rolled into one. Please include a pic, I am not into endless emails, and things like that. Looking forward to hearing from you.
",34,average,,,,,,,,,,,," 5'4"" (162cm)",,,,,,,,,,,,,,single,,
http://denver.craigslist.org/w4w/5401936255.html,denver,,2016-01-13 19:55,2016-01-13 19:55,msr,w4w,The Serious Moonlight,"
Femme poet living in the Highlands, seeking women for friendship, maybe more. 

Listening to David Bowie tonight and being inspired to live more, you know, loudly. 

",43,curvy,,,,,,,,,,,," 5'1"" (154cm)",,,,,,,,,,,,,,single,,
http://denver.craigslist.org/w4w/5400940765.html,denver,,2016-01-13 09:13,2016-01-13 10:17,msr,w4w,friendly fun,"
I'm a single 33 yr old woman seeking sexy studs around my age. Hanging out getting to know each other and c what happens from there
",33,,,,,,,,,,,,," 5'7"" (170cm)",,,,,,,,,,,,,,,,
http://denver.craigslist.org/w4w/5400501761.html,denver,,2016-01-12 21:43,2016-01-12 21:43,msr,w4w,Looking for a true and lasting love!!,"
Search for the one that will love me as much as I love her. I do suffer from depression, but am a very loyal and loving woman. I love kids, although i do not have any. Love a animals. Please only write if you are serious and non judgmental!!
",42,,,,,,,,,,,,,,,,,,,,,,,,,,,,,
http://denver.craigslist.org/w4w/5387732574.html,denver,,2016-01-04 14:14,2016-01-12 13:11,msr,w4w,come play with us,"
Hey ladies were a great looking couple and have a great sex life just us two but looking for a sexy female to add a little spice and excitement to the magic we make ... we want to make sure we all vibe and have an attraction to each other so the experience will be amazing .so let's conversate and meet . Ideally good company and a great personality also so we can have fun and socialize outside of the bedroom would be a plus .. I'm 36dd brown hair and eyes , and he is6'2 brown hair hazel eyes , Well indowed
and definitely a pleaser !send pics and we will in return
",30,athletic,,,,,,,,,,,," 5'4"" (162cm)",,,,,,,,,,,,,,,,
http://denver.craigslist.org/w4w/5398878465.html,denver,,2016-01-11 20:15,2016-01-11 20:20,msr,w4w,Looking for a pretty girl to be fwb. . ...,"
Im 24
Beautiful 
Latin
Looking for a pretty femm
Ages 20-28
Looking for fwb relationship 
Idc if you have a boyfriend as long as your honest with me
Im independent 
Please be also
Please be mobile
Send me a picture 
Send me a naughty one if your feeling spontaneous ðŸ˜

Very real (that's why I'm posting)
",,,,,,,,,,,,,,,,,,,,,,,,,,,,,,
http://denver.craigslist.org/w4w/5398133556.html,denver,,2016-01-11 11:57,2016-01-11 12:50,msr,w4w,Hopelessly Hopeful,"
First things first, if you're not serious, don't message me. If you're gonna ask for pictures right away, PLEASE DON'T MESSAGE ME. If you're married or in a committed relationship, PLEASE DON'T MESSAGE ME. *I've posted a couple of times on here, met a few people and they end up not responding back, if you're one of those people, don't message me. I'm not here to send nudes, or engage in a sexual relationship; if you are, spare both of us the time and don't message me. I don't smoke, due to my career I'm NOT 420 friendly. 

Secondly, I'm creating this post because I want to start off slowly. I'm 21, a graduate student and since school took most of my time; my friends drifted away and I don't have much luck dating honestly. I'm looking for something simple really, starting off as friends and maybe more. I'm bisexual and nerdy. I like to stay home and watch x-files, read, or play video games, rather than go out and party. I'm a bit shy, but once I'm out my shell, I'm very outgoing and I like to joke around A LOT. I like to get to know people for who they are; personality wins me over looks. But I also like someone with goals and knows what they want to achieve. If you're reading this and are planning on messaging me to get to know me, please give me yourself, I'm not looking for a specific person. I'm looking for someone to become friends with easily and maybe something more if it clicks. I am a hopeless romantic and I would love to share that romance with a special gal. Age Range- 20-28
",21,average,,,,,,,Mixed,,,,," 4'11"" (149cm)",,,,,,,,,,,,,,single,,â™“ pisces
http://denver.craigslist.org/w4w/5398146702.html,denver,,2016-01-11 12:03,2016-01-11 12:13,msr,w4w,Looking to treat a lady right,"
Hello seems strange posting on CL but worth a shot. I'm 26, I enjoy working out and staying active. I love my job and am very goal oriented. 
I'm looking for femms only please.
I love to treat a lady right. Pretty old fastioned when it comes to relationships. I might be a woman but I will always act like a gentleman. If your interested to know more please respond with a picture. Without yours you don't get mine sorry. Favorite color in subject please. Have a good Monday ladies : )
I'm not too sure as to
",26,average,,,,,,,,,,,," 5'3"" (160cm)",,,,,,,,,,,,,,single,,
http://denver.craigslist.org/w4w/5461988763.html,denver,,2016-02-23 20:30,2016-02-28 12:28,msr,w4w,ðŸ’‹Wanting A Sexy Curvy BBW LatinaðŸ’‹,"
I'm looking for a real women who has no time for games.. We can start as friends or more.. Looking for that girl who is loving, caring, and K own what she wants... 

I'm so tired of all the grown women acting lime children.. 

Send pic no reply
No couples or men

I am in ft collins be willing to come here or meet half way

",39,curvy,,,,,,,,,,,,,,,,,,,,,,,,,,,,
http://denver.craigslist.org/w4w/5468643850.html,denver,,2016-02-28 11:33,2016-02-28 11:50,msr,w4w,ladies,"
Im looking for a fine ass lady to chill with a mess with. i like small petite girls that are fun ad outgoing to hit me up at seven two zero two ninw six five one eight six. no picture no reply sorry. lets meet today
",,,,,,,,,,,,,,,,,,,,,,,,,,,,,,
http://denver.craigslist.org/w4w/5458217127.html,denver,,2016-02-21 12:55,2016-02-28 11:12,msr,w4w,Open-minded artsy creative type looking for same,"
I want to thank you for opening this and hopefully for the start of something that will rock everyone's world.
I find asking myself what I am doing looking on Craigslist for dating. 
It can be so difficult looking through ads and responses. But where else can I ask honestly ask for what I'm searching for?

I just opened a post and saw a little something something that I wasn't expecting. It was like, BAM! There it is! An explicit shot of something that could be so intimate. Nothing left to the imagination. I'm more of a girl that likes to wait until Christmas to open my presents. 

A little about me, I'm a 33 year old woman, love the arts, children, and a good story. I work in a helping profession with a master's degree and have some thoughts to return to school. I absolutely love writing. I have several short stories and the start of two novels. I LOVE doing pottery, but alas, I've been living in Denver for two years and have not made it to a studio! If you ever have had an inkling, I did find a place. Totally down to have someone come with me to it. I also love painting and sculpture, dabbled a little bit in piano and guitar. I read constantly, and feel you learn a lot about a person by what their favorite book is...and I'm always looking for recommendations.

Anyway, I am a bisexual woman, and am currently in a relationship with a man but miss and crave the softness and delightful attributes that make us women. 
I am looking for a woman to date who doesn't care that I am bi and attached. A woman wanting a sincere connection.
It would be nice to find someone open to dating me and my partner.
We're in a completely open, loving relationship that is free of jealousy or stupid BS, just a lot of love. We have dated separately before in the past and just find it is better when we are together. That having been said, the only thing I ask is openness and honesty about feelings and needs. If you are interested in seeing how it is dating a couple, sweetness, that's the most fun, 
and if not, that's OK too, i am free to explore, so let's chat.

My partner and best friend is involved in theater and music. He teaches theater and rocks anyone's world. He loves his music, and has had bands over the last 20 years. He is horrible about self-promotion but I've seen little anywhere near his raw talent. He's great with children and is a great listener and confidant. He's really good at making connections with people and is extremely social and a riot to be around.

All of this said, I'm really hopeful about reaching out and getting to meet with some awesome people.

Looking forward to hearing from you!

xoxo
",33,,,,,,,,,,,,,,,,,,,,,,,,,,,,,
http://denver.craigslist.org/w4w/5468171827.html,denver,,2016-02-28 02:01,2016-02-28 02:18,msr,w4w,Let's chill.....,"
I like to take walks in the rain,
I like the quiet of the night.
I like the crystal blue ocean,
I like the feeling of ""it's right"".
I like to take long drives,
I like to travel far away.
I like to see people smile,
I like to hear ""their say"".
I like to cook at home,
I like go eat out.
I like to go bowling,
I like to get about!
I like to be silly,
I like to make you laugh!
I like to get lost sometimes,
I like the unbeaten path!
I like to go fishing,
I like to bring some home!
I like to see waterfalls,
I'd like you to like my poem.....

Ok, enough of me being silly as I always tend to be, so here's a little more insight to who I am:
I'm 46, don't look it at ALL 
White, but color doesn't matter to ME 
I'm a beautiful thick woman, free spirited, love to travel, and really love to laugh!
I like 50 shades of female. And what goes along with 50 shades..... You get my hint!
I work. I own a car. I have a cat. I'm very extroverted. I have an amazing aura. I can carry on an intelligent, thoughtful conversation. I'm a people first person. I hate to lie, even about the smallest thing (then you have nothing to remember!). I want to make some great connections, whether it's towards relationship or just friendship I miss this part of my life! I'm bi. I have been since I was 19... I really want to just put feelers out there, and see who responds and go from there! Hopefully, I'll meet someone special........ Wish me luck, after this is craigslist, rofl! <--- SEE humorous LOL 


",46,curvy,,,,,,,,,,,," 5'8"" (172cm)",,,,,,,,,,,,,,single,,
http://denver.craigslist.org/w4w/5468079259.html,denver,,2016-02-27 22:07,2016-02-27 22:32,msr,w4w,hello denver,"
hello denver ladies! looking to have a late night conversation? have a few drinks tomorrow night? have an adventure? im your girl!
",24,curvy,,,,,,,,,,,," 5'2"" (157cm)",,,,,,,,,,,,,,single,,
http://denver.craigslist.org/w4w/5467897661.html,denver,,2016-02-27 18:21,2016-02-27 18:22,msr,w4w,Awesome girl looking for a serious girlfriend,"
My name is Briana and I'm 18. I've been looking for a girlfriend for the longest time and most of the girls I'm into are either straight or live in different states, so I haven't had much luck. I recently came out to close people in my life and I'm just ready for something real. I really don't have a type although I do have a thing for short and chubby females. If your intentions are the same as mine HMU and lets see where things go.
",18,average,,,,,,,,,,,," 5'7"" (170cm)",,,,,,,,,,,,,,single,,
http://denver.craigslist.org/w4w/5467566683.html,denver,,2016-02-27 14:07,2016-02-27 14:07,msr,w4w,AA Stud,"
I am a AA stud looking for a fem. Looking for a mature adult no strings relationship with a beautiful woman who is very clean and disease free. I have my own home. I am mobile. hmu with your pic so we can get down to business. I am the type who like spontaneous adventure. No men or bbw
",,,,,,,,,,,,,,,,,,,,,,,,,,,,,,
http://denver.craigslist.org/w4w/5444372675.html,denver,,2016-02-11 21:27,2016-02-27 12:55,msr,w4w,Oreos and Movies,"
Hey!

I'm looking for a lady friend lol, I would like us to become great friends but with benefits if we both feel okay with it. I am 19, working full time, and needing a partner in crime to eat Oreos and binge watch tv shows with me :). I have never been with a woman but can't knock it till you try it hahah!

Put your favorite store to shop at in the subject line and let's get to know each other :)
",19,curvy,,,,,,,,,,,," 5'9"" (175cm)",,,,,,,,,,,,,,,,
http://denver.craigslist.org/w4w/5453052470.html,denver,,2016-02-17 21:47,2016-02-27 08:11,msr,w4w,True friends with benefits,"
I am seeking a fun loving woman for a true connection. Not looking for something serious, but also not looking for a one night stand or booty call either. I would really like someone to hang with in and out of the bedroom. Someone to have random adventures with and a whole lot more. Me-30, white, average with a big booty. Fem, bi, two tattoos,blonde hair, hazel eyes 420 friendly and down to earth. You- fem between 27 to. 35 skinny to curvy, but not bbw (sorry), serious about this. I've come across so many people who just flake off. It's frustrating. Please be drama free, DDF. And no men or couples. If that's what I wanted I would not be posting here.
",30,,,,,,,,,,,,,,,,,,,,,,,,,,,,,
http://denver.craigslist.org/w4w/5466573048.html,denver,,2016-02-26 20:51,2016-02-26 22:23,msr,w4w,Why is this so hard,"
Why is it so hard to find lesbian or bisexual females tgis days in high school it was bit eacher but now it is harder lol. At this point in my life I am just looking for woman to be friends yes I said friends no i am not taken and no i am not curious or married I just think all relationships start at square one being friends here is a little about me I have a job that i love and i did go to college and graduated i am 30yr old Mexican if you want to know more messgae me hope to here from you
",30,,,,,,,,,,,,,,,,,,,,,,,,,,,,,
http://denver.craigslist.org/w4w/5466574513.html,denver,,2016-02-26 20:53,2016-02-26 22:18,msr,w4w,looking for my FWB ;),"
Hi so here is the deal I work a lot I have more then one job so I don't really have time for dating so I am looking for a girl that would like to be FWB type of thing I am in my thirties and Mexican so if you are interested send me a email pic for pic ans so I know you r real put your name in the subject box
",30,,,,,,,,,,,,,,,,,,,,,,,,,,,,,
http://denver.craigslist.org/w4w/5452015547.html,denver,,2016-02-17 09:57,2016-02-26 11:07,msr,w4w,Tonight ;),"
Anyone up to see a movie tonight if so hit me up I am Mexican nd a femme so I am looking for a femme and if we click we can see what else happens lol pic 4 pic
",30,average,,,,,,,,,,,,,,,,,,,,,,,,,,,,
http://denver.craigslist.org/w4w/5472130375.html,denver,,2016-03-01 15:47,2016-03-01 16:27,msr,w4w,friends with benefits?!,"
Hey ladies, I am 26 Hispanic 150lbs. I consider my self very good looking 
Im sure you won't be disappointed, I am looking for a friends with benefits type situation. Please be ATTRACTIVE! ! NO Bbw NO MEN NO MEN NO COUPLES NO COUPLES. I am attracted to Latinas mostly but willing to see my options. I like girly girls but don't mind studs. Please be clean D&d free..... SEND FACE PIC OR NO REPLY. I WILL SEND ONE BACK. 

THANK YOU !!
",26,curvy,,,,,,,,,,,," 5'2"" (157cm)",,,,,,,,,,,,,,,,
http://denver.craigslist.org/w4w/5468643850.html,denver,,2016-02-28 11:33,2016-03-01 15:58,msr,w4w,ladies,"
Im looking for a fine ass lady to chill with a mess with. i like small petite girls that are fun ad outgoing to hit me up at seven two zero two ninw six five one eight six. no picture no reply sorry. lets meet today
",,,,,,,,,,,,,,,,,,,,,,,,,,,,,,
http://denver.craigslist.org/w4w/5472080686.html,denver,,2016-03-01 15:16,2016-03-01 15:16,msr,w4w,who is up for drinks an convo tonight,"
Hey I'm going to keep this short but who wants to meet up for drinks an small chit chat I can buy 1st round I'm in Lakewood have my own place a job I'm a 25 year old white tomboy I'm looking for any age an race of female no men hit me up with your favorite drink and a pic we can go from there no pic no response
",25,average,,,,,,,,,,,," 5'6"" (167cm)",,,,,,,,,,,,,,single,,
http://denver.craigslist.org/w4w/5471360994.html,denver,,2016-03-01 08:37,2016-03-01 08:56,msr,w4w,Naughty Friends,"
Is there anyone real and sane out there??? Even the most promising prospects end up flaking on me. 

I am 34 years old, black, have light brown eyes, caramel complexion and I am a curvy size 14 (and loosing). I am in an relationship. He is fully aware of my desire to be with a woman and he supports it fully. He will NOT be involved! I want something fun and fulfilling.. I want a true intimate friendship that has a naughty side. I am intelligent, extremely sexual, fun, open minded, creative, motivated, 420 friendly and sincere. We can hang out, eat out, grab a drink or catch a movie. I am looking for more than sex. At the same time I want us to engage in activities that fulfill fantasies and make us feel alive and truly desired. I would prefer someone that has experience with a woman and knows what she wants. Please be ABSOLUTELY sure that this is what you want and please have the time to dedicate to this type of relationship. Please be in the Denver metro area, be mobile and be able to host should we decide to have some fun behind closed doors. 

Please understand that it will take time for us to get to know one another and I am not going to rush into anything. I do not want to exchange endless emails, however, it is a balance and we will meet when the time is right. I would appreciate if you respond it is with the intention of really meeting and ultimately playing in person! I prefer chatting on KIK. Responses with no pic and/or just a few lines will be deleted. Race does not matter but please be under the age of 50. Let's experience some intensity and honesty that you never knew was possible. I look forward to hearing from you and beginning this journey together!
",35,curvy,,,,,,,,,,,," 5'2"" (157cm)",,,,,,,,,,,,,,partnered,,
http://denver.craigslist.org/w4w/5471348141.html,denver,,2016-03-01 08:29,2016-03-01 08:52,msr,w4w,Would love to get to know you,"
Hello ladies in this post you will find a Lady who is interested in getting to know You. I am looking to make a connection with someone who is ready to be someone's Forever.

Has dealt with their past and is looking towards their future. I still believe in happily ever after...Do you?...Call me crazy but i do.

Anyway about me I am a Cute white/hispanic female that loves music, outdoors, family, kids, laughing, outdoors, movies, books, and living life to the fullest.

I am just ready to Partner with someone who still believes in Love and knows her Worth. Walking into this... She knows that love is an Action verb not just a Word but is willing to do what it takes to cultivate it.

I have so much love to give. Are you the One?
If you are wanting the same, lets talk. Conversation is a great way to start. Letting you know not into Endless emails, one liners I am more of a Phone person its more personal for me. So if your wanting to meet a person who is truly a ""needle in a haystack"" that is for Real...let the Conversation begin
As I said I want to know you...All of you your good and bad...Because you matter isn't it time to Meet someone who wants to Know you..

AND

Will take the time to know you ...Relationship are work are you Worth it, I know I am. Life is to live, I just want someone to enjoy it with...are You her if so let's talk!


Ladies you all have a Wonderful day! Look forward to hearing from You...
",56,,,,,,,,,,,,,,,,,,,,,,,,,,,,,
http://denver.craigslist.org/w4w/5471293519.html,denver,,2016-03-01 07:54,2016-03-01 07:54,msr,w4w,Couple looking for a woman,"
Couple looking for a new female friend for lots of sensual and sexual play. We are an older hot couple who love to play with a woman. Woman must be bi-sexual and enjoy both a man and a woman. We are easy going, and fun. We are social drinkers, 420 friendly. Just looking for the right situation. We've had 3 threesomes, and just find them to be liberating, lots of fun, with intellectual conversation and laughter, (it can't be all about sex all the time). My man likes to please us both and is masterful with his lips, hands, and cock. I have large breasts, curvy body, auburn mid back hair. We will play with one another and him.

Reply to this email and we will go from there.
",48,,,,,,,,,,,,,,,,,,,,,,,,,,,,,
http://denver.craigslist.org/w4w/5471104377.html,denver,,2016-03-01 03:17,2016-03-01 03:41,msr,w4w,sexy black stud,"
What up ladies im on here looking 
For something for long term 
Im an out going loving care stud
And im looking for my queen. About me 
Im a hard worker. I got my shit together 
Im 5'6 milk chocolate 164 36d curvy 
Im looking on for woman no couples
Are bi i need me a ðŸ’¯ lesbian. Race does not 
Matter just long as your a good woma .
So ladiea hit me with a email qith a pic amd tell 
Me a little about your self. Layer babe
",,,,,,,,,,,,,,,,,,,,,,,,,,,,,,
http://denver.craigslist.org/w4w/5471053065.html,denver,,2016-03-01 00:03,2016-03-01 00:03,msr,w4w,No games,"
Hey looking for friends maybe more I'm soft butch girl hit me up for pic I'm 36 looking for 420 friendly girls I'm into fem girls I'm 5'1 chubby but not ugly good personality and know how to have fun.
",36,,,,,,,,,,,,,,,,,,,,,,,,,,,single,,
http://denver.craigslist.org/w4w/5471042997.html,denver,,2016-02-29 23:39,2016-02-29 23:39,msr,w4w,First time girl â€¢Â¥******,"
I'm 27 yrs old. I've always had the fantasy of being with a girl. If you're willing to make my wish come true hmu. 
I'm Hispanic, weigh 165. Attractive. 
Looking for someone from 22 and up ðŸ˜‰
",,,,,,,,,,,,,,,,,,,,,,,,,,,,,,
http://denver.craigslist.org/w4w/5470817604.html,denver,,2016-02-29 19:00,2016-02-29 19:00,msr,w4w,trying something new,"
Hey! So im 19 years old and have never been with a woman before. I know im attracted to women and have had encounters but have never seriously been with one. Im just looking for someone to talk and hang out with and see where things go. A bit about me:
Im 5'9, red head (natural blonde) green/blue eyes, few piercings, no tattoos, in college. 
If youre interested feel free to reply!
",19,,,,,,,,,,,,," 5'9"" (175cm)",,,,,,,,,,,,,,single,,
