url,city,subcity,datetime_created,datetime_updated,category,type,title,text,age,body,body art,diet,dislikes,drinks,drugs,education,ethnicity,eye color,facial hair,fears,hair,height,hiv/hsv/hpv,interests,"kids, have","kids, want",likes,native language,occupation,personality,pets,politics,religion,resembles,smokes,status,weight,zodiac
http://denver.craigslist.org/w4w/5461988763.html,denver,,2016-02-23 20:30,2016-02-25 21:28,msr,w4w,ðŸ’‹Wanting A Sexy Curvy BBW LatinaðŸ’‹,"
I'm looking for a real women who has no time for games.. We can start as friends or more.. Looking for that girl who is loving, caring, and K own what she wants... 

I'm so tired of all the grown women acting lime children.. 

Send pic no reply
No couples or men

I am in ft collins be willing to come here or meet half way

",39,curvy,,,,,,,,,,,,,,,,,,,,,,,,,,,,
http://denver.craigslist.org/w4w/5464829529.html,denver,,2016-02-25 17:12,2016-02-25 18:28,msr,w4w,New to this.,"
Hey there...I'm 19, white, petite and have been told I'm pretty. I'm patient, caring, fun, adventurous and a little sassy, hah. I'm going to school for nursing. I'm looking for an experienced woman who can make love to me without inhibition. I love the sensual side of sex like kissing etc. but would also like to meet someone confident enough to let go and and go a little wild. Would love to find a dominant, assertive older woman who can put me in my place in bed and bite me, spank me, talk dirty, make me hers, etc...

This is just a huge fantasy of mine and I'd love to find someone intelligent enough to do this with. Not asking for a commitment and I'm not going to bore you with any of my life or school issues. We meet up, hang out, have some wonderful deviant sex and go out separate ways :) If any of this resonated with you on, reply with a description of yourself and what you're looking for. I'm 5'4, white, in good shape. I won't disappoint.
",19,fit,,,,,,,,,,,,,,,,,,,,,,,,,,,,
http://denver.craigslist.org/w4w/5464852946.html,denver,,2016-02-25 17:31,2016-02-25 17:44,msr,w4w,Coffee?,"
Interested in meeting for coffee? I'm a swf, educated and stable. 
I'm new to the area and would like to meet new people. Let's chat and then meet. I consider myself nice looking, but if you want a picture you will need to send me one and ask for mine, but only after I have a sense of who you are. 
I am looking for someone who is also successful. I prefer Chapstick or Lipstick lesbians. 


Please no couples or men.
",40,average,,,,,,,,,,,," 5'5"" (165cm)",,,,,,,,,,,,,,single,,
http://denver.craigslist.org/w4w/5464100291.html,denver,,2016-02-25 09:49,2016-02-25 11:31,msr,w4w,Anyone real,"
Hey there, I'm looking for a down to earth female. I am not about drama and need that in a female. I want to find that true fwb. No games no bullshit. Just a friend in and out of the bed. Nothing more. I want a friend not just a one night stand and not just phone sex!! I'm into curvy girls, with a nice chest. Since I started working out my libido has been thru the roof and I want to find someone who can keep up with me. I'm not into head games. Please no men!!!! And you must be drama and d&d free other than 420. If your interested message me
",,,,,,,,,,,,,,,,,,,,,,,,,,,,,,
http://denver.craigslist.org/w4w/5434140522.html,denver,,2016-02-04 18:57,2016-02-25 08:39,msr,w4w,Let's Fall in Like,"
Is there anyone real and sane out there??? Even the most promising prospects end up flaking on me. 

I am 34 years old, black, have light brown eyes, caramel complexion and I am a curvy size 14 (and loosing). I am in an relationship. He is fully aware of my desire to be with a woman and he supports it fully. He will NOT be involved! I want something fun and fulfilling.. I want a true intimate friendship that has a naughty side. I am intelligent, extremely sexual, fun, open minded, creative, motivated, 420 friendly and sincere. We can hang out, eat out, grab a drink or catch a movie. I am looking for more than sex. At the same time I want us to engage in activities that fulfill fantasies and make us feel alive and truly desired. I would prefer someone that has experience with a woman and knows what she wants. Please be ABSOLUTELY sure that this is what you want and please have the time to dedicate to this type of relationship. Please be in the Denver metro area, be mobile and be able to host should we decide to have some fun behind closed doors. 

Please understand that it will take time for us to get to know one another and I am not going to rush into anything. I do not want to exchange endless emails, however, it is a balance and we will meet when the time is right. I would appreciate if you respond it is with the intention of really meeting and ultimately playing in person! I prefer chatting on KIK. Responses with no pic and/or just a few lines will be deleted. Race does not matter but please be under the age of 50. Let's experience some intensity and honesty that you never knew was possible. I look forward to hearing from you and beginning this journey together!
",35,curvy,,,,,,,,,,,," 5'2"" (157cm)",,,,,,,,,,,,,,partnered,,
http://denver.craigslist.org/w4w/5453052470.html,denver,,2016-02-17 21:47,2016-02-24 19:34,msr,w4w,True friends with benefits,"
I am seeking a fun loving woman for a true connection. Not looking for something serious, but also not looking for a one night stand or booty call either. I would really like someone to hang with in and out of the bedroom. Someone to have random adventures with and a whole lot more. Me-30, white, average with a big booty. Fem, bi, two tattoos,blonde hair, hazel eyes 420 friendly and down to earth. You- fem between 27 to. 35 skinny to curvy, but not bbw (sorry), serious about this. I've come across so many people who just flake off. It's frustrating. Please be drama free, DDF. And no men or couples. If that's what I wanted I would not be posting here.
",30,,,,,,,,,,,,,,,,,,,,,,,,,,,,,
http://denver.craigslist.org/w4w/5462670121.html,denver,,2016-02-24 10:44,2016-02-24 12:10,msr,w4w,Is it really this hard!!,"
Trying to meet someone on here is hard between my ads being flagged and trying to make sure the people I am talking to are really ladies. So once again here goes looking for a girly girly between the ages of 28 40 curvy preferably latina or white who is down for what may be going on any given day! Let's do something new together! Please send pic yours gets mine. .
",39,curvy,,,,sometimes,,,,brown,,,black," 5'7"" (170cm)",,,,,,,,,,,,,daily,separated,,
http://denver.craigslist.org/w4w/5454404058.html,denver,,2016-02-18 18:45,2016-02-24 02:30,msr,w4w,Daughter looking for her mommy,"
I'm a 21 year old girl looking for an intelligent and well-educated woman to be her mommy. Ideally this would involve sexual role-play and non-sexual role-play. I am looking for a woman who is gentle and nurturing and is looking for an obedient and well-behaved daughter. Please be somewhat fit, in your 30s, and reply with a picture. Above all, I just want to please my mommy and be her very good girl. Can't wait to hear from you!
",21,curvy,,,,,,,,,,,,,,,,,,,,,,,,,,,,
http://denver.craigslist.org/w4w/5462050295.html,denver,,2016-02-23 21:45,2016-02-23 22:25,msr,w4w,Discreet FWB <3,"
Hi my name is Allie, I'm looking for a discreet fwb situation. I would like to actually be interested in making this more of a Longterm thing :). To tell you alittle about myself I have long black hair, green eyes, and I wear glasses. I am 420 friendly and just want to hang out maybe smoke and see where things go :) To make sure you are real please put what color your eyes are in the Subject line. :)
",21,big,,,,,,,,,,,," 5'4"" (162cm)",,,,,,,,,,,,,,partnered,,
http://denver.craigslist.org/w4w/5461749933.html,denver,,2016-02-23 17:02,2016-02-23 17:44,msr,w4w,looking for geeky love~,"
Hi there! (PUT YOUR FAVORITE FOOD IN THE TITLE SO I KNOW YOU'RE REAL)

I'm 21 years old and live in Denver Colorado. (Fair warning those of you who don't find this appealing.... I' M A HUGE NERD!) Nerd as in I enjoy cosplaying, attending conventions, watching anime, playing video games -even though I suck- , I love Dr.who, Steven Universe and things of that nature. For me all of this would be considered by ""baggage"". If you're still reading this awesome! Let me tell you a bit more about myself and see if you might be interests. 

Well I stand at a whopping 4'11 and am not the most slender of people, however I've been working about for about... 2 months to get into shape. I have to get my con body ready ya know? I have dark brown eyes and light brown hair that will soon be turning purple. Outside of cosplaying I volunteer with a nonprofit after school program as a tutor / teacher. I've been doing that since my freshmen year of high school, and plan to get a degree in recreational therapy. However that degree is put on hold for a little while I help my mom out with things at home. I plan to go back to college next semester and hopefully graduate within three - four years but who know. I'm employed at an awesome costume shop where I can proudly express my geeky side with my employees and customers, and have been working there since early September. 

I'm looking for someone who share the same interests as me, and someone I can spoil. I'm a hopeless romantic and want to share my love with that special someone. I don't care about your size, shape or color what I look for is whats in your heart. With that said...

WARNING: I am NOT looking for Friends with benefits, one night stands, or anything sexual (not right off the bat). I want to get to know you starting off as friends then seeing where things go.
AGES 20-24 only (NO ONE WITH KIDS, MARRIED OR LOOKING FOR A FWB)

Your photo gets mine :D
AGES 19-23 only (ill go to 24 but no higher)
",21,curvy,,,,,,,,,,,," 5'0"" (152cm)",,,,,,,,,,,,,,single,,
http://denver.craigslist.org/w4w/5461236812.html,denver,,2016-02-23 11:56,2016-02-23 11:56,msr,w4w,My Birthday,"
My birthday is Friday, I wanna do something any ideas or suggestions.Likes make it a date.Ima Stud, I have pictures.
",30,average,,,,,,,,,,,," 5'5"" (165cm)",,,,,,,,,,,,,,single,,
http://denver.craigslist.org/w4w/5461200852.html,denver,,2016-02-23 11:37,2016-02-23 11:37,msr,w4w,Seeks fem./intell./healthy/ovr40..frens mayb more! :),"
Hello!

Wanting to mix with white females and latina women.. mutual attractiveness, age appropriate and somewhat spiritual. Not bisexually active, not butch/boy. Trendy/sporty- is just wonderful! Would love to meet for coffee (I know, it's a vice!).. maybe go out for dinner, a movie.. or maybe take a walk, good conversation, but most of all, beautiful atmosphere and company! 
Please respond soon!
",48,,,,,,,,,,,,,,,,,,,,,,,,,,,,,
http://denver.craigslist.org/w4w/5461159032.html,denver,,2016-02-23 11:15,2016-02-23 11:15,msr,w4w,Seguimos buscando latina,"
Hola somos una pareja muy atractiva y seguimos en busca de nuestra Amiga secreta. 
Muy limpios y sin enfermedades y buscamos lo mismo
Aqui esta la foto de Ella asi qye por favor manden una uds. 
No hombres ni parejas
",33,fit,,,,,,,,,,,,,,,,,,,,,,,,,,married,,
http://denver.craigslist.org/w4w/5441546770.html,denver,,2016-02-10 03:15,2016-02-23 02:36,msr,w4w,5280 Lesbian,"
I'm 27 looking to find a fun attractive girl to hangout with and see where it goes. Come over lets have fun ;) Send a clear face picture or I won't reply back. Xoxo
",27,,,,,,,,,,,,,,,,,,,,,,,,,,,,,
http://denver.craigslist.org/w4w/5460366180.html,denver,,2016-02-22 19:53,2016-02-22 21:30,msr,w4w,Someone to love,"

I'm 20, living in the wonderful, colorful state of Colorado! I volunteer at a non profit horse stable! I love the country and farm life! Horses are my life! I'm hoping you love them as much as i do! 

I am NOT looking for a sexual relationship! I'm tired of being used for sex! I'm looking for a girl serious about being in a real relationship with me! 

I am a huge tomboy and I love sports and the like! I'm a huge people person and I love animals :) I'm a super laid back person who's easy to get along with!

I'm 5'3, blonde hair and blue eyes! I don't smoke or do drugs #sorrynotsorry. I am going to be getting my first tattoo in July so im pretty excited! and i think a belly button piercing along with it, but im not too sure yet. I have 3 siblings, 2 younger and one older. My older is in the airforce living in alaska

I have 3 pets; a puppy whos a little over 9 months old, 2 cats, and 1 lizard. I am saving up to either lease or buy my own horse one day soon. I want to live on a ranch so bad and raise horses and own a pig and a goat and maybe a cow too so probably a farm. 

I love to cook and bake, i think its so much fun and its a huge stress relief for me. I love the color purple, and i've never been in a relationship before, i just am looking for a girlfriend to call my own and spoil like she deserves. 

Feel free to ask me any questions, ill tell you anything you'd like to know!
",20,curvy,,,,,,,,,,,," 5'3"" (160cm)",,,,,,,,,,,,,,single,,
http://denver.craigslist.org/w4w/5460395924.html,denver,,2016-02-22 20:23,2016-02-22 20:38,msr,w4w,Short and sweet,"
I've never been with a girl but the idea intrigues me. Im not sure what to say... I'm happy and I work a lot but I'm still up for partying and drinking and smoking pot or just watching TV at home with our feet up. I'm interested in a simple woman like myself. I want to be able to feel like I've found my best friend and enjoy the little things. Hopefully not older than 25 and I would prefer that we have the same body type just because you'll be my first and I assume it'll be weird enough lol to avoid spam put chocolate in the subject. I'll send you a pic for pic of course. So let's get this started.
",20,thin,,,,,,,,,,,," 5'3"" (160cm)",,,,,,,,,,,,,,single,,
http://denver.craigslist.org/w4w/5460052455.html,denver,,2016-02-22 15:52,2016-02-22 16:07,msr,w4w,Sexual Motivation,"
Hi ladiesðŸŒº

I'm looking for a friend that we can have some small talk and then jump into what each others fantasies are etc. I'd love to dirty talk and then after we've done MULTIPLE ways of verification that you actually are a female send sexy pics back and forth ðŸ˜ 

I'd love to get eachother thoughts and hearts racing. Always excited when our phone goes offðŸ’Œ

No one knows I'm interested in other beautiful ladies so it'll be our little secret ðŸ¤

I am looking for sexual motivation, I am the heaviest I have ever been and would like to find someone who is also looking to lose weight. We can motivate eachother and help eachother feel sexy againðŸ’‹ðŸ‘—

I'm into meeting, defiantly once were both comfortable! I'd love to have this situation and make a wonderful friend in the processðŸ‘¯ 

If this sounds like something that you'd be into plz reach out. 

Please don't send sexual pics right off the bat. That screams ""warning I'm a man"" lol NO PIC NO RESPONSE. 

Thanks again ladies ðŸŒºðŸšðŸ‘—
",25,big,,,,,,,,,,,," 5'3"" (160cm)",,,,,,,,,,,,,,,250,
http://denver.craigslist.org/w4w/5441150211.html,denver,,2016-02-09 17:10,2016-02-22 15:40,msr,w4w,Stud type - 420 friendly - music enthusiast,"
Looking for an attractive young woman to share some good times with, and see where things lead. I like going out to concerts, movies, bars, restaurants. I also really like being a homebody and chill out with Netflix often. I partake in 420 products daily, and its always nice to have a special lady to share that with too. As appearances go, I'm tall & thin. I wear mens clothing and dress well, but I'm not a ""bull dyke"", as they say. Brown hair, brown eyes. I'm very attracted to femininity. Definitely a plus if you're femme or stem with average-to-slender body type. Definitely a plus if you like the outdoors! Tell me something about yourself. Include a picture and I'll reply with the same. Maybe we could grab drinks together this weekend. Let's get to know one another :)

No men. No couples. No exemptions.
",27,thin,,,,sometimes,,,,,,,,,Clean,"live music, movies, camping, hiking, skate, motocross",,,,,,,,,,,,single,,
http://denver.craigslist.org/w4w/5459727827.html,denver,,2016-02-22 12:48,2016-02-22 14:10,msr,w4w,looking for fun ðŸ˜˜,"
I'm a fem looking for another outgoing fem. I love to have fun and I'm looking for my partner in crime!
",,,,,,,,,,,,,,,,,,,,,,,,,,,,,,
http://denver.craigslist.org/w4w/5459830437.html,denver,,2016-02-22 13:43,2016-02-22 13:43,msr,w4w,Give an FTM a chance??,"
Hey there my name is AJ i am 26 years old almost 27 i am a female to male transman i am 5'5"" hispanic/native mix chubby i had my breasts removed 2 years ago. I am recently separated from a toxic relationship and i am just looking to get back in the dating world nothing serious, at least not yet. Ill be up front i dont have a car, i have a few job interviews coming up but no job. If you are still interested in getting to know me text me and we will exchange pics *svn to oh 2 three svn for 5 six zero*
",26,big,,,,,,,,,,,,,,,,,,,,,,,,,,separated,,
http://denver.craigslist.org/w4w/5453163609.html,denver,,2016-02-18 02:08,2016-02-22 02:33,msr,w4w,Potential friend,"
I'm don't think I'm the only person who feels this way, but I've been with guys and afterward I always felt that there could have been more and there was just something that I couldn't quantify that was missing. This feeling has led me to a conclusion. I am considering being with a female. I have had these feelings building up for a while, but I am a little apprehensive about it. This is all new territory for me. I think that I would like to find a female somewhere in my age range, who is equally inexperienced, who can deal with my inexperience so we can learn and explore together. If you're intelligent, care about education and are literate, that would be very attractive to me in addition to potential physical attraction.
",20,,,,,,,,,,,,,,,,,,,,,,,,,,,,,
http://denver.craigslist.org/w4w/5458935006.html,denver,,2016-02-22 00:55,2016-02-22 00:55,msr,w4w,looking for my soulmate,"
Hello there I'm a sexy and curvy latina looking for another sexy fem im looking for a serious relationship not into in games or staff like that no men no couples please don't make me waste my time only girls
",30,curvy,,,,,,,,,,,," 5'2"" (157cm)",,,,,,,,,,,,,,single,,
http://denver.craigslist.org/w4w/5458882620.html,denver,,2016-02-21 22:46,2016-02-21 23:25,msr,w4w,Deadpool date !,"
20 year old, latina, thin, clean, 420 friendly. 
Seeking adorable girl to watch Deadpool with, I would love to watch that movie and think it would be a nice date. I love to kiss ðŸ˜‰ and enjoy a nice butt lol as well as a sense of humor and some intelligence of course. Fem, i love ladies being ladies. Clean, age and race is no issue. Females only. Seeking around my age but wouldn't mind someone more experienced either. Put The title to the last song you listened to in the subject line so I know that you are real.
Mine is, Needed Me by Rhianna
",,thin,tattoos,,,,,,,,,,," 5'2"" (157cm)",,,,,,,,,,,,,,single,,
http://denver.craigslist.org/w4w/5458878483.html,denver,,2016-02-21 22:38,2016-02-21 22:38,msr,w4w,"Live simple, think complex","
What a line that subject is, eh? Really though, am seeking a brilliant women, age and looks don't matter as if like you will like you, loyally, all over. No gold star but at this point am a longtime dyke and not in market for anything else; most interested in women who were out gay before it was cool (big believer in struggle creating character amongst whatever else). You don't have to be happy all the time and please feel free to enjoy your alone time; I'll hold you lightly, sans expectations except honesty and kindness, but love tight.
What I like: hottubs, long dirt roads, swimming in the ocean, giving 1000s of kisses, reading great writers aloud and being read to, listening to NPR, trying new things, local beer and food, women who dance on an empty dance floor, old friends who'd you'd do anything for, beat up pickup trucks, beautiful views, modern art, ability to fit in anywhere, campfire smoke, board games, acoustic sets at worn down bars, long email exchanges that light unquenchable fires.
What I don't like: drama, outspoken intellectual elitism, Boston Terriers, trail mix, idiots.
",,,,,,,,,,,,,,,,,,,,,,,,,,,,,,
http://denver.craigslist.org/w4w/5425369418.html,denver,,2016-01-29 18:44,2016-02-21 20:34,msr,w4w,"Lesbian seeking friendship, and maybe more","
Hello.
I am seeking that special woman, but friendship 1st.
I am looking for a loving, and compassionate woman
who loves great conversations, animals, and on a spiritual journey.
I am loving, compassionate,
who loves animals, interesting conversations,
crafts, walks, spiritual books, and am on a serious
spiritual journey. 
I am honest, intelligent, and
have integrity.
If interested please email me, and we can talk further.
",51,average,,,,,,,,,,,," 5'5"" (165cm)",,,,,,,,,,,,,,single,,
http://denver.craigslist.org/w4w/5458715370.html,denver,,2016-02-21 19:15,2016-02-21 19:15,msr,w4w,Would love to get to know you,"
Hello ladies in this post you will find a Lady who is interested in getting to know You. I am looking to make a connection with someone who is ready to be someone's Forever.

Has dealt with their past and is looking towards their future. I still believe in happily ever after...Do you?...Call me crazy but i do.

Anyway about me I am a Cute white/hispanic female that loves music, outdoors, family, kids, laughing, outdoors, movies, books, and living life to the fullest.

I am just ready to Partner with someone who still believes in Love and knows her Worth. Walking into this... She knows that love is an Action verb not just a Word but is willing to do what it takes to cultivate it.

I have so much love to give. Are you the One?
If you are wanting the same, lets talk. Conversation is a great way to start. Letting you know not into Endless emails, one liners I am more of a Phone person its more personal for me. So if your wanting to meet a person who is truly a ""needle in a haystack"" that is for Real...let the Conversation begin
As I said I want to know you...All of you your good and bad...Because you matter isn't it time to Meet someone who wants to Know you..

AND

Will take the time to know you ...Relationship are work are you Worth it, I know I am. Life is to live, I just want someone to enjoy it with...are You her if so let's talk!


Ladies you all have a Wonderful day! Look forward to hearing from You...
",56,,,,,,,,,,,,,,,,,,,,,,,,,,,,,
http://denver.craigslist.org/w4w/5458591939.html,denver,,2016-02-21 17:27,2016-02-21 18:40,msr,w4w,Monday friend?,"
Hey ladies hope you all are having a good Sunday. 

My names Ashly and I moved here not long ago with my boyfriend from Houston Texas. So far it's been great but recently I've been having desires for something with a woman. 

I'm not looking for anything serious but maybe just a cool cute girl that smokes, is free on Mondays and wants to smoke and maybe make out some. A little more if that make out gets heated. I have been with a couple women before but don't consider myself very experienced so someone also inexperienced or that wants to teach me. Also, Monday is the only play day I can have but we can be regular friends too when we aren't playing. Regular hang outs, lunch, shopping what girls do ha 

A little about me I'm 5'10, 23, bbw, Hispanic and a basic girly girl if that makes sense lol I'm pretty laid back, have spacey moments, enjoy kick backs, movies, bowling and all that fun stuff. 

If you're interested please email me and let's hang out tomorrow :) please send pics
",23,curvy,,,,,,,,,,,," 5'10"" (177cm)",,,,,,,,,,,,,,partnered,,
