url,city,subcity,datetime_created,datetime_updated,category,type,title,text,age,body,body art,diet,dislikes,drinks,drugs,education,ethnicity,eye color,facial hair,fears,hair,height,hiv/hsv/hpv,interests,"kids, have","kids, want",likes,native language,occupation,personality,pets,politics,religion,resembles,smokes,status,weight,zodiac
http://washingtondc.craigslist.org/mld/msr/5499625990.html,washingtondc,mld,2016-03-20 09:27,2016-03-20 09:50,msr,m4w,"seeking ""50 shades of Kristina Gray""","
Hi,

Submissive Caucasian mature male seeks the female version of Christian Gray of the book or movie ""50 Shades of Gray"".

Please be sane, reasonably attractive, HWP and interested in Female Domination and male submission. I am open to someone married or single.

I myself am an older, sane, reasonably attractive, kinky male living in Frederick, MD and I am seeking a woman who has an interest in role-playing a Female Dominant/ male submissive relationship on an ongoing basis starting with meeting once a week. Whatever develops after that is fine but I would like to base the relationship on Femdom or female domination. I prefer an Asian, Caucasian or Hispanic woman that is also height/weight proportionate. It is just a preference. Please respect that.

The woman I seek, besides the aforementioned qualities is educated, conversant, open-minded and looking to expand her horizons in terms of her relationship with a man based on her control and domination. Having had such a relationship in the past, I can tell you that it is among the most intimate and intense I have known. I have an interest in submissive activities such as male chastity devices, bondage, discipline and forced feminization to name just a few. Perhaps you have areas you want to discuss and explore?

Perhaps you are a professional woman, a Doctor, Attorney or other profession? Or perhaps you're the girl next door, innocent looking but concealing a dark, erotic side of her inner being? Eroticism is not confined to any single type of woman. Perhaps something as simple as a pedicure and nail polish followed by having your feet worshiped? (see photo).

Perhaps you have had longings along these lines but there was no opportunity to explore them? Novice is not a problem. Let's learn together. If you are experienced, that is welcomed as well.
I can host. Let's start with some chat and an exchange of photos and build from there to establish a relationship based on mutual trust.

Please be local to Frederick, MD or close by.

Absolutely no pro Dommes or men.

Thank You.
",59,average,,,,,,,,,,,," 6'0"" (182cm)",,,,,,,,,,,,,never,single,,
http://washingtondc.craigslist.org/mld/msr/5499625010.html,washingtondc,mld,2016-03-20 09:26,2016-03-20 09:46,msr,m4w,"seeking ""50 shades of Kristina Gray""","
Hi,

Submissive Caucasian mature male seeks the female version of Christian Gray of the book or movie ""50 Shades of Gray"".

Please be sane, reasonably attractive, HWP and interested in Female Domination and male submission. I am open to someone married or single.

I myself am an older, sane, reasonably attractive, kinky male living in Frederick, MD and I am seeking a woman who has an interest in role-playing a Female Dominant/ male submissive relationship on an ongoing basis starting with meeting once a week. Whatever develops after that is fine but I would like to base the relationship on Femdom or female domination. I prefer an Asian, Caucasian or Hispanic woman that is also height/weight proportionate. It is just a preference. Please respect that.

The woman I seek, besides the aforementioned qualities is educated, conversant, open-minded and looking to expand her horizons in terms of her relationship with a man based on her control and domination. Having had such a relationship in the past, I can tell you that it is among the most intimate and intense I have known. I have an interest in submissive activities such as male chastity devices, bondage, discipline and forced feminization to name just a few. Perhaps you have areas you want to discuss and explore?

Perhaps you are a professional woman, a Doctor, Attorney or other profession? Or perhaps you're the girl next door, innocent looking but concealing a dark, erotic side of her inner being? Eroticism is not confined to any single type of woman. Perhaps something as simple as a pedicure and nail polish followed by having your feet worshiped? (see photo).

Perhaps you have had longings along these lines but there was no opportunity to explore them? Novice is not a problem. Let's learn together. If you are experienced, that is welcomed as well.
I can host. Let's start with some chat and an exchange of photos and build from there to establish a relationship based on mutual trust.

Please be local to Frederick, MD or close by.

Absolutely no pro Dommes or men.

Thank You.
",59,average,,,,,,,,,,,," 6'0"" (182cm)",,,,,,,,,,,,,never,single,,
http://washingtondc.craigslist.org/mld/msr/5499625332.html,washingtondc,mld,2016-03-20 09:26,2016-03-20 09:41,msr,m4w,"seeking ""50 shades of Kristina Gray""","
Hi,

Submissive Caucasian mature male seeks the female version of Christian Gray of the book or movie ""50 Shades of Gray"".

Please be sane, reasonably attractive, HWP and interested in Female Domination and male submission. I am open to someone married or single.

I myself am an older, sane, reasonably attractive, kinky male living in Frederick, MD and I am seeking a woman who has an interest in role-playing a Female Dominant/ male submissive relationship on an ongoing basis starting with meeting once a week. Whatever develops after that is fine but I would like to base the relationship on Femdom or female domination. I prefer an Asian, Caucasian or Hispanic woman that is also height/weight proportionate. It is just a preference. Please respect that.

The woman I seek, besides the aforementioned qualities is educated, conversant, open-minded and looking to expand her horizons in terms of her relationship with a man based on her control and domination. Having had such a relationship in the past, I can tell you that it is among the most intimate and intense I have known. I have an interest in submissive activities such as male chastity devices, bondage, discipline and forced feminization to name just a few. Perhaps you have areas you want to discuss and explore?

Perhaps you are a professional woman, a Doctor, Attorney or other profession? Or perhaps you're the girl next door, innocent looking but concealing a dark, erotic side of her inner being? Eroticism is not confined to any single type of woman. Perhaps something as simple as a pedicure and nail polish followed by having your feet worshiped? (see photo).

Perhaps you have had longings along these lines but there was no opportunity to explore them? Novice is not a problem. Let's learn together. If you are experienced, that is welcomed as well.
I can host. Let's start with some chat and an exchange of photos and build from there to establish a relationship based on mutual trust.

Please be local to Frederick, MD or close by.

Absolutely no pro Dommes or men.

Thank You.
",59,average,,,,,,,,,,,," 6'0"" (182cm)",,,,,,,,,,,,,never,single,,
http://washingtondc.craigslist.org/nva/msr/5499584775.html,washingtondc,nva,2016-03-20 08:31,2016-03-20 09:14,msr,,Looking for Transgender or Transexual,"
Looking for a fun,confident,humorous and clean Transexual or Transgender. Sexual identity doesn't matter. Ages 18-30
If you want to see pics or know more about me email me. I really hope to hear from you
NO FAKES
",,curvy,,,,,,,,,,,," 5'5"" (165cm)",,,,,,,,,,,,,,single,,
http://washingtondc.craigslist.org/nva/msr/5499570555.html,washingtondc,nva,2016-03-20 08:07,2016-03-20 09:13,msr,m4w,Tantric full body experience,"
Release your stress, reengage with your body, bring latent sensual energy to the surface with a blissful Tantric Full Body experience. Tantra is rooted in Buddhist tradition and combines elements of meditation (deep, rhythmic breathing) with sensual massage. Every inch of your body is attended to with trained, healing hands. Warm oil is used to reduce tension and enhance comfort. Being a full body massage, it is not uncommon for orgasms to occur. The massage may be sexual for the receiver but is not for me. My fulfillment comes from giving pleasure. The more pleasurable it is for you - the more I am fulfilled. No compensation or reciprocation expected.

I'm a nice looking, well educated, professional, with gifted, healing hands. I can visit you. If you're not regularly experiencing blissful sensual touching from another, expecting nothing in return- do treat yourself.

Powerful sensual energy is within all of us - it just needs to be released. Let me know if you have any questions or would like to schedule a time. 







",58,,,,,,,,,,,,,,,,,,,,,,,,,,,,,
http://washingtondc.craigslist.org/nva/msr/5499278172.html,washingtondc,nva,2016-03-19 21:42,2016-03-19 22:44,msr,,Submissive girl looking to be trained,"
I'm 18, bbw(?) female looking for a dominant man or woman(or couple) who can be kind,patient,affectionate but most of all dominant and possessive of me as I learn the way. I want to be trained. Teach me how to please you. I'm very open minded. Clean,safe,etc. 

We will communicate through calls,texts and emails until I feel safe enough to meet you.
",,big,,,,,,,,,,,," 5'5"" (165cm)",,,,,,,,,,,,,,single,,
http://washingtondc.craigslist.org/nva/msr/5499233114.html,washingtondc,nva,2016-03-19 20:56,2016-03-19 22:22,msr,,Bbw looking for 'friend',"
I'm looking for someone new.(race,gender,age doesn't matter)
Someone to hang out with,someone to spoil me,someone to joke around with. I'm not looking for sex but if it happens it happens. 
A bit about me:
18
Female
Woodbridge
Pansexual
Dorky,goofy,playful,affectionate,laid back
Open minded.
Can't drive(yet)

Email me and if you can show me you want more than just a creepy meet up/fuck then I'll give you my number :)
",,big,,,,,,,,,,,," 5'5"" (165cm)",,,,,,,,,,,,,,single,,
http://washingtondc.craigslist.org/nva/msr/5499207777.html,washingtondc,nva,2016-03-19 20:32,2016-03-19 21:46,msr,m4w,"Looking for a sweet, sexy playmate - STEAM SHOWER sessions","
I'm looking for some adult connections with a SEXY, sultry, curvy woman that would appreciate a man holding, caressing and pulling you close. While my situation is attached and complex, I do have an empty house with an amazing steam shower that needs to be properly initiated. I am seeking someone that wants to come over and enjoy giving/receiving a massage or finding a shared physical passion with each other... 

ME: direct, discreet, respectful, professional male, no strange fetishes (or even any regular fetishes), I've been monogomous for the last 15yrs, d/d free

YOU: d/d free, discreet, passionate, clean, sexually confident-enjoys her body, likes to please, from 20's to pre-cougar age

No sugar-daddy here, just mutual pleasure between mature adults. Mostly weeknights, occasional wknds. MUST provide more than a 6 word response, no phishing or advertising please. PLEASE send pics (clothing optional) and a cell # to reach you at.

Dan - Sterling VA
",39,athletic,,,,,,,,,,,," 5'11"" (180cm)",,,,,,,,,,,,,,,,
http://washingtondc.craigslist.org/nva/msr/5499168385.html,washingtondc,nva,2016-03-19 19:57,2016-03-19 20:15,msr,m4w,"Attractive, alluring & prefer real books over E readers?","
I love technology and it has its place .Love my phone for my music. But sorry I cannot read with an E reader. There is no charm, no smell, way too antiseptic. If this resonates with you (about 30s-40s or mature 20s) and you are sexy, somewhat fit, like the arts, cocktails, movies as well as have a wild side, let's talk.
",,,,,,,,,,,,,,,,,,,,,,,,,,,,,,
http://washingtondc.craigslist.org/doc/msr/5499138762.html,washingtondc,doc,2016-03-19 19:31,2016-03-19 19:31,msr,m4w,Dom SWPM seeking sub SWPF,"
I'm attractive, fit, high-income, well-read, well-traveled, a fairly normal DC professional with a hidden kinky side.

You're a female sub, HWP, intelligent, attractive and able to write and articulate email that describes yourself and your desires.

I'm looking for a relationship, not a one-night stand. Let's chat, exchange pics and meet for a drink soon.
",50,athletic,,,,,,,,,,,," 5'11"" (180cm)",,,,,,,,,,,,,,,,
http://washingtondc.craigslist.org/nva/msr/5499058337.html,washingtondc,nva,2016-03-19 18:28,2016-03-19 18:49,msr,m4w,control my orgasms please!,"
control my orgasms please! - m4w (Fairfax)
seeking a woman to tease and deny me. If you are not familiar with orgasm control/teasing and denial then you might want to read up on some of it. Google it and see if it strikes your fancy. 

Or maybe you are already familiar?

This is not just about play. I would like to develop a rapport and friendship as well. Someone I can chat with and confide in and vice versa. I get it if you are not into chatting, but I think that is important in any relationship

If you have never been in control of someone's pleasure, then consider it! We can discuss things via email. In fact most of our interactions could take place online only.
",,,,,,,,,,,,,,,,,,,,,,,,,,,,,,
http://washingtondc.craigslist.org/nva/msr/5498920028.html,washingtondc,nva,2016-03-19 16:52,2016-03-19 16:52,msr,m4m,Closeted Clergyman?,"
I'm a mature and single gay male. Looking for a playmate on the downlow. Have a fetish for ministers...really. I really want to please a clergyman. I love to suck....rim.....swallow......and then I like getting fucked. Discretion expected and assured. I have no desire to complicate your life....or to mess things up for you in any way....especially if you're deep in the closet. BUT...I would like to satisfy your secret longings....

I'm six feet two....two hundred twenty pounds. Silver beard.....silver hair.......well groomed....clean.....excellent hygiene....drug and disease free. NS...and Non drinking too. Nicer chest.....great between the sheets.....love touching....and kissing....and cuddling....and snuggling. 

If you have secret longings...and need a friend to help you unload....say hi! Please be height/weight proportionate....a face pic would be nice.
",57,average,,,,,,,,,,,," 6'2"" (187cm)",,,,,,,,,,,,,,divorced,,
http://washingtondc.craigslist.org/nva/msr/5498677149.html,washingtondc,nva,2016-03-19 14:27,2016-03-19 14:48,msr,m4w,Dom seeks submissive female to own/use,"
Do you crave being used, disciplined and forced to serve?
Do you crave being choked, bound, gagged, spanked, punished?
Do you crave being owned, rough fucked, giving up complete control?
Sessions are 100% discreet and intense.

Experienced, Attractive, Fit and Young 

REPLY WITH PICS FOR CONSIDERATION. ..
Married and New Sluts Welcomed... 
Discretion guaranteed!

Bondage, blindfolded, watersports, gagged, bdsm, Master, humiliation.
",34,,,,,,,,,,,,,,,,,,,,,,,,,,,,,
http://washingtondc.craigslist.org/nva/msr/5498654508.html,washingtondc,nva,2016-03-19 14:15,2016-03-19 14:27,msr,m4m,looking to have the girlfriend role....,"
hi, I am in my early 30s and looking for a relationship. I hope to find someone that is looking for friends first then maybe more, and not just looking for sex. I hope to find a good Christian man who allows me to have a more feminine role in the relationship. I am a single professional and you should be too. Perhaps we can chat more if this interests you. I will not respond to one liners and emails with no pics.
",,,,,,,,,,,,,,,,,,,,,,,,,,,,,,
http://washingtondc.craigslist.org/nva/msr/5498388941.html,washingtondc,nva,2016-03-19 11:52,2016-03-19 12:34,msr,t4m,Transsexual for STR or LTR,"
Too much to say, not enough space here to say it! But I'll give you the short version here. There are two sides to every coin. On one side of the coin I am simply looking for a STR, (short term relationship/sex partner/FWB, etc), for enjoyable sexual encounters, and, on the other side of the coin, I am looking for a healthy LTR, (long term relationship but just short of marriage). The later is obviously much harder to find, hence the STR!

I'm an intelligent, educated, creative, fun, down-to-earth mature bottom only Non-Op Transwoman who does not have a prejudice bone in her body when it comes to skin color or nationality. I decide who I date by a man's character, not by the color of his skin. I seek a sane, literate, clean, intelligent, educated, experienced, and caring modern day alpha male who understands and accepts his own sexuality. A man who knows how to respect a Transwoman as he would with any other genetic female.

I'll expand on my ad in much more detail with photos after you write me a short but sweet correctly spelled and coherent response that resembles punctuated sentences. And, please don't send me a photo of your engorged penis, we'll get to that later.

t4m m4t
",,,,,,,,,,,,,,,,,,,,,,,,,,,,,,
http://washingtondc.craigslist.org/nva/msr/5498250626.html,washingtondc,nva,2016-03-19 10:30,2016-03-19 11:38,msr,m4w,I would love to treat you like you deserve...,"
Hello, 
This may be kind of a strange post, but I'm looking for a fun, cool, laidback, girl to hang out with once in a while or whenever your free who likes to get out once in a while and check out a band or chill at a lounge with friends, but also can enjoy staying at home, enjoying a movie, an excellent massage from a certified masseuse, or even just gentle caressing from someone who loves to give special attention to a nice woman. I'm told I'm a good looking guy (International Male type), Caucasian, 6'2"", 195 with a swimmers build, I'm in excellent shape and nicely hung in case that may be in question, I'm adventurous, open minded, laid back, a gentleman, spontaneous, easy to get comfy with, fun and humorous enough to have you laughing all day. To begin with, we can kik, text, or talk on the phone, and then meet for coffee or a drink and see if we both have a good vibe for each other. If we click, we can go out, check out a band, or whatever choose to do. If you just want to meet point blank, that works as well. Similar to me, I'm looking for a woman who is height and weight proportionate as well as clean, well groomed, keeps excellent personal hygiene, and is D&D free. I don't mind meeting you with friends if that helps to break the ice. I would be happy to share pitctures, and if you ask for one or a few, have the courtesy to include one of you when you do. I never go back on my word. If this at all sparks your interest, write back to me and put your favorite season in the subject line (so I can weed out the spam). I look forward to hearing from you and thanks for reading!
",37,athletic,,,,,,,,,,,," 6'2"" (187cm)",,,,,,,,,,,,,,,,
http://washingtondc.craigslist.org/doc/msr/5498359594.html,washingtondc,doc,2016-03-19 11:35,2016-03-19 11:36,msr,m4m,Stand up guy looking for the same,"
I realize this is Craig's List but what the hell. I am a masculine, sports loving, beer and wine drinking WM. I have a great job, great friends and a family who I love but happy they are a few states away. 56 years old and have done my share of hell raising. More on the bystander side of things now but can still mix it up once in awhile. I get into cars, weekend getaways and hanging out with friends. Just back from a few day in New Orleans if that tells you anything. Not much into sleeping around but sometimes we all cave into our needs. Really would like to get to know one guy and at the very least keep our sex lives exclusive. If that leads to something even more long term I'm cool with that. In fact I sorta like strings. You can read the rest of my stats on the side of my post. Happy to trade photos or meet for a beer.
",56,average,"a couple of tats, each shoulder",,,,,,,green,none,,," 5'11"" (180cm)",,,,,,,,out going,,,,,never,single,200,
http://washingtondc.craigslist.org/mld/msr/5498258326.html,washingtondc,mld,2016-03-19 10:35,2016-03-19 11:16,msr,m4w,Boudoir Photoshoot,"
Have you ever wanted to take some boudoir style photos of yourself to share with your significant other. I am an upcoming photographer looking to experiment in this style of photography. I have a professional camera and I am very non-pushy and respectful person to work with. If you are interested in boudoir, or any other style of photography, shoot me an email with ""Capitals"" in the subject line. 
If you want the pictures taken with your camera or using your memory card for discretion, that is also fine.
",32,,,,,,,,,,,,,,,,,,,,,,,,,,,,,
http://washingtondc.craigslist.org/nva/msr/5498241818.html,washingtondc,nva,2016-03-19 10:24,2016-03-19 10:35,msr,m4t,Single mature Gentleman seeks LTR,"
I'm a single attractive mature Caucasian gentleman seeking a long term relationship with an attractive single Trans woman living in the DC metro area. I'm 6' tall 198 fit, dark hair and eyes, non smoker and DDF. Some of my best qualities are I have a very good heart, kind, romantic, passionate about things and people I care about, I consider myself sexy and intelligent. I enjoy the typical things like dinners, movies, music, theater, drives in the country, travel etc to just relaxing at home cuddled up with my special lady watching a movie, sharing a good bottle of wine and just good conversation and intimacy. My preference is for a woman who is already living full time, I don't have a preference if you're Pre-op, non-op or post-op. I am open to date girls who have not fully transitioned as I am aware of the struggles, complications and challenges many experience. If you are interested and would like to know more or just chat some time I would love to hear from you

Sincere Gent
",48,athletic,,,,,,,,,,,," 6'0"" (182cm)",,,,,,,,,,,,,,single,,
http://washingtondc.craigslist.org/doc/msr/5498083864.html,washingtondc,doc,2016-03-19 07:56,2016-03-19 09:53,msr,m4t,Lovers&Besfriends,"
how you doing today names Jay well I guess no one on this site is serious about going on dates or looking for a long-term relationship leading to marriage or a good guy well I'm a great guy I'm not all about sex I'm handsome I'm looking for someone special that I can definitely build a future with but I guess nobody wants that but hopefully I'll get lucky and be able too take someone to the movies or dinner send a pic of you with your response thank you open to all races especially latina i work two jobs also I drive also attending college look to relocate I want to settle down and just enjoy life with someone special
",22,athletic,2 wanting more,,,never,never,,Black,,,,," 5'9"" (175cm)",,,,2,,"english,spanish","chef,assistant manager",,,,,,,single,,
http://washingtondc.craigslist.org/doc/msr/5498160569.html,washingtondc,doc,2016-03-19 09:22,2016-03-19 09:23,msr,m4w,"Intense, passionate affair tonight","
So you were a little bored, curious, or craving some physical contact and decided to see what CL had to offer. Well I am glad you at least clicked on my post. Hopefully I can convince you to respond. I am a MWM in town for a conference. 5'7"" so if you were looking for tall, dark and handsome........ hey, 2 out of 3 isn't too bad. I am fit, fun and full of life. I am an attentive lover who enjoys pleasing the woman I am with. I am very visual so hwp is important. I have a nice room at a Boutique hotel in the Dupont area. I have meetings until around 6 so free after that. Put your favorite drink in subject line to eliminate spam. Thanks for reading!
",45,,,,,,,,,,,,,,,,,,,,,,,,,,,,,
http://washingtondc.craigslist.org/mld/msr/5498080092.html,washingtondc,mld,2016-03-19 07:50,2016-03-19 09:17,msr,m4t,looking for love,"
Hey how you doing today names treyshawn I'm black I work 2 jobs I can cook I drive also I'm new to the dmv area just looking to explore I'm looking for a friendship first than a relationship if we click I'm a great guy I'm fun,funny,faithful trustworthy also I'm protective you'll be in great hands.also I'm in college I want to own my own business. I want some I can build a future with marriage kids roadtrips traveling introduce to my family I'm very open mind and comfortable with who I am and what I want hopefully I can make connection and find someone special send a picture or kik or a phone number and I'll get back to you I promise
",22,athletic,2,,,,,College,Black,,,,," 5'9"" (175cm)",,,,,,,,,,,,,,single,,
http://washingtondc.craigslist.org/mld/msr/5498142736.html,washingtondc,mld,2016-03-19 09:06,2016-03-19 09:06,msr,m4w,Do you have submissive or Sybian desires/fantasies??,"
I am a financially secure, successful, 5'10"", trim, fit, 59 year old SWM with a full head of hair living alone in Columbia, MD (near Rts. 29 and I-95). I own a townhome on the main lake (same lake as Clyde's - if you are familiar with Columbia). It's a great place to host. I have a flexible schedule.

I am also an experienced Dominant male. I have actual experience introducing women (who had previously only fantasized about it) into the realm of Dominance/submission. I also have experience assisting women who desire/need an Authoritative man as a presence in their lives to help them be more successful as they strive to attain their goals. Some women find it to be very exciting when they relinquish control. I provide guidance with a firm hand and a kind heart. I am told that I am a good teacher/instructor as well as patient and skillful at understanding and eliciting excitement and gratification from my partner. I am safe, sane, and discreet.

To heighten your sensual pleasure and gratification, I recently purchased a new Sybian machine (many call it the ultimate sex toy) and I can provide you with the very exciting and orgasm inducing Sybian adventure.

In addition, I play golf and like to dine, dance, and have fun. I am complimented on my sense of humor.

Let me know any questions you may have or information I can provide that would be helpful to you.
",59,,,,,,,,,,,,,,,,,,,,,,,,,,,,,
