url,city,subcity,datetime_created,datetime_updated,category,type,title,text,age,body,body art,diet,dislikes,drinks,drugs,education,ethnicity,eye color,facial hair,fears,hair,height,hiv/hsv/hpv,interests,"kids, have","kids, want",likes,native language,occupation,personality,pets,politics,religion,resembles,smokes,status,weight,zodiac
http://washingtondc.craigslist.org/nva/msr/5510923670.html,washingtondc,nva,2016-03-27 17:49,2016-03-27 19:11,msr,m4w,a.n.r.,"
Got milk ??? I got $$$. 60 year old 'baby' want to drink from the tap. help for a single mom or just a lactating woman.
",60,,,,,,,,,,,,,,,,,,,,,,,,,,,,,
http://washingtondc.craigslist.org/doc/msr/5510961057.html,washingtondc,doc,2016-03-27 18:23,2016-03-27 18:23,msr,m4m,Looking for a Real Connection - LTR,"
Greetings CL...hope everyone out there is enjoying the lively weather and the peak cherry blossoms this weekend. I'm recently single and on here looking for new friends, prospective dates, and hopefully a LTR with a great guy who wants the same out of life. I'm 35, live in NW, work in SE, and venture all over the metro area on the weekends. From a museum and drinks downtown to a hike along the canal trail and a game of paintball, I love doing anything that keeps me out and about having fun. I can be sort of a geek...I faithfully catch every comicbook-based movie, have a background in engineering, and build my own computer. I also enjoy rock concerts, clubs, bars, and shopping. I guess what I'm trying to say is that I'm a pretty multifaceted guy and I really want to find someone similar who I can learn from, experience new things with, and hopefully build something with. Basic vitals: I'm in my mid-30s but have many friends younger as well. I'm white and really don't care what you are as long as you're awesome :-) I have more extra weight than I'd like but I'm anything but a couch potato...probably fit more into the ""bear"" body type than anything else, sporting a little bit of chin scruff and maybe a little more on the weekends. I'm an INTJ (a mastermind if you will), a Griffyndor ( honorable and principled), and a Scorpio (intense and ambitious). I guess that's enough about me...what about you? Like anyone, I have some preferences, but I don't mean to say we couldn't be friends regardless. I've vers overall. I'm generally looking for guys in their 20s/30s. I also like guys who can carry on conversations both in person and over email/text. Nothing is worse than a one sided conversation, wherever it is. Definitely no smoking or drugs...and while I drink socially/occasionally, I definitely don't get trashed every weekend. I also value ambition, intellectual curiosity, and independence...someone who has goals and is doing everything they can to reach them is very attractive. So hopefully I sound sort of interesting and if that's the case, please send me a message and we can see what happens! Have a great week out there in the internets :-)
",35,,,,,,never,,,,,,," 6'2"" (187cm)",,,,,,,,,,,,,never,single,,
http://washingtondc.craigslist.org/doc/msr/5513499853.html,washingtondc,doc,2016-03-29 11:47,2016-03-29 12:34,msr,w4m,Let's cut the bs...,"
You want some attention and affection from time to time? Cool I got u covered, no need to nag nah that's not what this is about, maybe u want to do relationship stuff but not deal with the titles part, I get it, I'm wit it, or maybe u want a sexy nasty minded friend you can do naughty things with and actually have a normal friendship like to go on trips, happy hour, someone to vent ur troubles to but she's also ur friend that will turn u out lol yup that's me... No worries I'm not lookin to lock u down... Unless u wanna be locked down, I'm in a situation so u may not get all my time due to that so u gotta be understanding to my schedule as well, u must be on top of planning fun things as I will be also, This can be a long term thing we must discuss further details if that's what u want... So a lil bout what I prefer, AA man ... Or woman .. Ijs don't judge if ur a cute lady we can be friends too lol don't be shy lol, must be Disease free and be sane, u must have a romantic side, a freaky side *nothing outlandish, but u can tell me what it is cause imma perv like that lol* oh and u gotta have a sense of humor, and love to laugh,420 is a plus, I prefer u to have a job, a spot for us to chill at from time to time and just be open to being catered to.... As for me I'm a 39 yo about to turn 40, no kids, I'm also AA, very pleasing to the eyes, no drama,work ft...5'7, 240, curvy lady with a sense of humor and a freaky side... So now if ur interested holla back but make sure u have a pic ready to send or send it with ur message for a quicker response, ur pic gets mines, if we hit it off I'm lookin to meet ASAP, please no bs'ers or catfish
",39,curvy,,,,,,,,,,,,,,,,,,,,,,,,,,,,
http://washingtondc.craigslist.org/nva/msr/5513401270.html,washingtondc,nva,2016-03-29 10:55,2016-03-29 12:09,msr,m4w,Wanted: A Girl Who Would Like A ............,"
submissive male as Her nude servant and for She to boss and order him around. I am happy to ""take care of You and make it worth Your while"". Also, there is no sex and I do not seek or expect sex. When responding to You, I will explain all the details. I am a mature/older professional and I am not married and very physically fit. I am fine if this is new to You and, again, no sex and ""real help for You"".
",,,,,,,,,,,,,,,,,,,,,,,,,,,,,,
http://washingtondc.craigslist.org/mld/msr/5513466331.html,washingtondc,mld,2016-03-29 11:30,2016-03-29 11:54,msr,m4w,Cowgirl Gratification,"
Utilizing proper technique, the female top cowgirl position can be very stimulating and gratifying for both partners. Unfortunately, for some women the most rewarding technique is not an inherent skill and, therefore, the mutual satisfaction of both partners goes unfulfilled.

I have actual experience helping women improve their cowgirl technique. My instruction teaches the combination of female cowgirl position and movement that will induce the most stimulation for both partners. This instruction may include videos and utilization of my Sybian machine as training aids. My methods have proven to be both successful and appreciated.

I am a financially secure, successful, 5'10"", trim, fit, 59 year old SWM with a full head of hair living alone in Columbia, MD. I own a townhome on the main lake. It's a great place to host and I have a flexible schedule. I am safe, sane, and discreet.

Let me know any questions you may have or information I can provide that would be helpful.
",59,,,,,,,,,,,,,,,,,,,,,,,,,,,,,
http://washingtondc.craigslist.org/doc/msr/5513452283.html,washingtondc,doc,2016-03-29 11:23,2016-03-29 11:41,msr,m4w,Older Seeks Young & Pretty,"
Do you find handsome, older and gen.erous men more interesting than younger guys? Do you like a man who stays in shape and will treat you with respect? If you are attractive and drama free, please email me. Let's set something up soon.
",,,,,,,,,,,,,,,,,,,,,,,,,,,,,,
http://washingtondc.craigslist.org/nva/msr/5513426377.html,washingtondc,nva,2016-03-29 11:09,2016-03-29 11:32,msr,m4w,"WM seeks witty, fun, bored Email friend","
Craigslist Ad disclaimer: I do not live in my parents basement, wear a tin foil hat or play World of Warcraft. Neither am I one of those annoying ""picture collectors"" ok I confess I did collect baseball cards back in the early 70's but in my defense I was 12 and everyone was doing it. Finally to all the sweet women living in the Philippines, while I'm sure the email marriage offers are truly heart felt, I'm really not interested.

I would describe myself as an intelligent outdoorsman... Pizza and Chinese food are NOT delivered where I live. Specifically I am a blue jeans, canvas shirts, and work boots kind of man. I'm looking for you a professional/ business/ city savy woman married or not, age 45-60. NOT looking to change our situations just looking for a woman from a completely different environment then my own to share fun, witty, and with the right connection sensual email conversation. Why don't I pour you a glass of homemade wine, myself a Marker Mark on the rocks lets curl up, chat and get to know one another. 
",52,athletic,,,,,,,,,,,," 6'0"" (182cm)",,,,,,,,,,,,,,,,
http://washingtondc.craigslist.org/mld/msr/5513319527.html,washingtondc,mld,2016-03-29 10:07,2016-03-29 10:07,msr,m4t,Just some simple foreplay with a fit trans girl or CD..,"
Looking to engage in some simple foreplay with a cute transgirl/woman or Fem CD
Age or race not very important.
I'm mostly into thin/skinny/fit bodies
I'm late 30's, white, athletic
Let's make each other cum.
Hopefully you can host evenings.
I'm pretty much just looking for some quality HJ/JO time but if it goes to oral I'd just be a top. Also open to Frotting
",,athletic,,,,,,,,,,,," 5'8"" (172cm)",,,,,,,,,,,,,,,145,
http://washingtondc.craigslist.org/nva/msr/5513221105.html,washingtondc,nva,2016-03-29 08:55,2016-03-29 09:36,msr,m4w,I would love to treat you like you deserve...,"
Hello, 
This may be kind of a strange post, but I'm looking for a fun, cool, laidback, girl to hang out with once in a while or whenever your free who likes to get out once in a while and check out a band or chill at a lounge with friends, but also can enjoy staying at home, enjoying a movie, an excellent massage from a certified masseuse, or even just gentle caressing from someone who loves to give special attention to a nice woman. I'm told I'm a good looking guy (International Male type), Caucasian, 6'2"", 195 with a swimmers build, I'm in excellent shape and nicely hung in case that may be in question, I'm adventurous, open minded, laid back, a gentleman, spontaneous, easy to get comfy with, fun and humorous enough to have you laughing all day. To begin with, we can kik, text, or talk on the phone, and then meet for coffee or a drink and see if we both have a good vibe for each other. If we click, we can go out, check out a band, or whatever choose to do. If you just want to meet point blank, that works as well. Similar to me, I'm looking for a woman who is height and weight proportionate as well as clean, well groomed, keeps excellent personal hygiene, and is D&D free. I don't mind meeting you with friends if that helps to break the ice. I would be happy to share pictures, and if you ask for one or a few, have the courtesy to include one of you when you do. I never go back on my word. If this at all sparks your interest, write back to me and put your favorite season in the subject line (so I can weed out the spam). I look forward to hearing from you and thanks for reading!
",37,athletic,,,,,,,,,,,," 6'2"" (187cm)",,,,,,,,,,,,,,,,
http://washingtondc.craigslist.org/nva/msr/5513187362.html,washingtondc,nva,2016-03-29 08:19,2016-03-29 08:19,msr,m4m,Camping partner,"
Looking for a camping and hiking partner who also enjoys some erotic play. Here's the scene. Two regular guys get together periodically to go camping for the weekend in the mountains. We head out to a nice, not overly crowded location, set up a comfortable campsite, hike, relax, maybe fish a little. In the evening, we build a fire, fix a good dinner, share some good wine and conversation, a scotch, maybe a cigar and enjoy the evening. All very normal. But at the same time... maybe we go hiking in a secluded area and decided to hike nude for a while, then take a break by a stream and casually stroke each other's cocks, then enjoy sucking each other. We dress, head back to camp and enjoy the evening. We put the fire out, and head into a large, comfortable tent (I have one). We undress and enjoy playing together til we fall asleep, naked and sharing a king sized air mattress. Maybe we wake in the middle of the night, or early morning and play some more. Then we're up and starting a new day. 

Me: 48, bi, mwm, 6', 190lbs, ddf, athletic build, 7"" shaved cock, smooth body. Love to be naked, rub bodies, toy play, extended oral play and being fucked, safe sex always.

You: 30s to 50s, ddf, descent build, not overly hairy (trimmed or shaved pubic area), 6.5"" or larger, top or top leaning vers who enjoys the same kinds of things. Easy going, everyday type of guy, who is bi/curious, married a +.

Will want to get together for a casual drink or dinner beforehand to meet and make sure we're both comfortable. Open to getting together beyond camping if we want.
",48,athletic,,,,,,,,,,,,,,,,,,,,,,,,,,,,
http://washingtondc.craigslist.org/nva/msr/5513126771.html,washingtondc,nva,2016-03-29 06:34,2016-03-29 08:09,msr,m4w,Tantric full body experience,"
Release your stress, reengage with your body, bring latent sensual energy to the surface with a blissful Tantric Full Body experience. Tantra is rooted in Buddhist tradition and combines elements of meditation (deep, rhythmic breathing) with sensual massage. Every inch of your body is attended to with trained, healing hands. Warm oil is used to reduce tension and enhance comfort. Being a full body massage, it is not uncommon for orgasms to occur. The massage may be sexual for the receiver but is not for me. My fulfillment comes from giving pleasure. The more pleasurable it is for you - the more I am fulfilled. No compensation or reciprocation expected.

I'm a nice looking, well educated, professional, with gifted, healing hands. I can visit you. If you're not regularly experiencing blissful sensual touching from another, expecting nothing in return- do treat yourself.

Powerful sensual energy is within all of us - it just needs to be released. Let me know if you have any questions or would like to schedule a time. 







",58,,,,,,,,,,,,,,,,,,,,,,,,,,,,,
http://washingtondc.craigslist.org/nva/msr/5512958532.html,washingtondc,nva,2016-03-28 23:42,2016-03-29 00:24,msr,m4m,Looking for my scruffy/bearded guy,"
I am in search of someone who wants to put time and effort into exploring potential for long term dating. With that said I expect to actually meet up after some mutual interest is shown, not purely connect online. If you are overscheduled then it makes no sense to even try.

Interested in guys around my age (late 20s to early 40s), who have prior long term dating experience, and who are out. What you do for a living or own does not really concern me, as long as you are self-suficient, and have your life in order. Must be non smoker and drug-free.

I am really drawn to a type: my height or taller, avg to a few extra pounds, and most importantly scruffy/bearded.

Sexually wise I have been a ""top"" in all my past relationships, except I was verse a couple of times with my last bf and would like to explore that side of me. Someone who is a ""bottom/verse"" would be a good match in bed.

Some of my interests: music, movies, technology, performing arts, pets, road trips, and more recently being active.

If my ad sounds interesting to you please reply with a brief message, honest stats, location and a clear pic. If you are ""discreet"", or looking for a fwb I am not your guy.
",37,average,,,,,,,,,,,," 5'10"" (177cm)",,,,,,,,,,,,,,single,,
http://washingtondc.craigslist.org/nva/msr/5506830482.html,washingtondc,nva,2016-03-24 18:34,2016-03-28 22:50,msr,m4w,"Sometimes romantic, sometimes rough","
Hope you are a fun female that likes to mix things up periodically. Mix romance sometimes with rough playful play. Maybe spank your butt, mixed in with lots of laughs and kisses. 30s-40s. Send pic if your interest is piqued.Arts/wine/outdoors/music /film/Colo partying/margarita friendly and wild side a plus.
",,,,,,,,,,,,,,,,,,,,,,,,,,,,,,
http://washingtondc.craigslist.org/nva/msr/5512792307.html,washingtondc,nva,2016-03-28 21:07,2016-03-28 22:34,msr,m4w,Like both hugs and handcuffs?,"
At least now I know some things you as an alluring female does enjoy.:) Cocktails, partying, jazz, film and arts friendly. Late 30s to 50 is the best fit or convince me otherwise. Send your pic and info and let the adventure commence.
",,,,,,,,,,,,,,,,,,,,,,,,,,,,,,
http://washingtondc.craigslist.org/doc/msr/5512739670.html,washingtondc,doc,2016-03-28 20:27,2016-03-28 20:27,msr,m4t,Vers/Bottom guy looking for LTR/Dating a Vers/Top Girl,"
Single tall athletic and educated mixed guy. I'm a vers/bottom so I'm looking for a girl that likes to get head and top. Ideally I'd like to meet someone for long term and dating. Someone that is smart, funny, pretty, and likes to go out and have fun. I am in good shape, and good looking so I'm expecting the same. 

Send Pics in the first email, and I'll respond with mine.
",27,athletic,,,,,,,,,,,," 6'4"" (193cm)",,,,,,,,,,,,,,single,,
http://washingtondc.craigslist.org/doc/msr/5512676183.html,washingtondc,doc,2016-03-28 19:41,2016-03-28 19:49,msr,,Music,"
On Ãgaetis Byrjun do you think the sliding noise on the wound strings is emphasized purposely or inadvertently? It sounds like it is an acoustic bass with highly accentuated wound strings.
On , Ekki MÃºkk, (almost like a needle on the record crackling sound throughout the song, or an old AM radio with bad intermittent reception) I could imagine it in a film soundtrack wherein it is a bombed out wasteland. . . does it sound purposely like some unnecessary hissing noise or distortion, almost like overdriven peak meters in the initial recording? Is it your speakers? Or is it recorded that way on purpose?
RembihnÃºtur 3:16- Distorted sounds like a bass kick filled with crumpled up cellophane in it.
Do you watch Gotham or Lucifer? Do you like dark things? Do you like to relax?
",,,,,,,,,,,,,,,,,,,,,,,,,,,,,,
http://washingtondc.craigslist.org/doc/msr/5512637772.html,washingtondc,doc,2016-03-28 19:15,2016-03-28 19:26,msr,,Spice it up,"
Ever wanted to make a sex tape with your lover for you to enjoy on boring nights? Well I can help. I'm a 20 year old, female film student, and I've recently taken interest in the art of sex. I'd love to come to you, and record you and your partner so you both can have a sexy video for future enjoyment. These videos will be private and once I leave I'll never see them again, they're for your enjoyment only. Email me if interested :)
",,,,,,,,,Any,,,,,,,,,,,,,,,,,,,,,
http://washingtondc.craigslist.org/nva/msr/5512487997.html,washingtondc,nva,2016-03-28 17:40,2016-03-28 18:58,msr,m4w,Pegging?,"
Hello. 

I would like to find a woman that is interested in pegging. I have never had the pleasure so I'm seeking one woman that's also interested in either trying it for the first time or has some experience with it. 

I'm looking for a single white woman between the ages of 25-45 that has the patience to take it slow. 
I'm not into the D/s scene as much as some people are so I would prefer if you're not either. If there is chemistry, a ltr is not off the table. I'd like to exchange a few emails and go from there so say hi. I'm in no rush as I'd like us to be comfortable with each other first. 

Any questions?

I'm in my early thirties, single and have the equipment.
",31,average,,,,,,,,,,,," 5'11"" (180cm)",,,,,,,,,,,,,,single,,
http://washingtondc.craigslist.org/nva/msr/5512498137.html,washingtondc,nva,2016-03-28 17:46,2016-03-28 18:04,msr,m4m,Mentor maybe More,"
I will be honest and admit I did not have any luck in the M4M section. Hoping this tab will attract a more sincere response!

I've had an adult mentor for the past 5 or so years and I believe it has really propelled my career, life experiences and personal life way beyond what I would have ever been capable of obtaining, understanding and accomplishing. 

He unfortunately left at the beginning of winter for greener and warm pastures. 

This warm weather and bright sky has me now ready for my next assignment. 

I seek and age appropriate ( you must have more life experiences), devoted, opinionated, creative man to take me under his control. 

I don't want to set perameters or list expectations. I want to grow this organically. 

Happy to discuss more with all compatiable replies.
",33,,,,,,,,,,,,,,,,,,,,,,,,,,,,,
http://washingtondc.craigslist.org/nva/msr/5515780104.html,washingtondc,nva,2016-03-30 17:35,2016-03-30 18:04,msr,m4w,Let's make out,"
I am a married white male who has noticed that the longer you are married, the less you kiss. I miss the days of dating where we made out all the time and let our hands wander and could not wait until the next step. Now it seems like the next step is all there is. Are there any attached woman out there that feel the same way? Or maybe you are a single woman that misses making out too. Seeking a somewhat attractive woman who'd like to meet and we hit off, maybe we could meet for some hot make out sessions. Back of car in a parking garage; a movie theater in the back row; a nice park or some other location. Very serious about this. Not looking for sex (but some petting would not be a bad thing). Really want us to feel like teenagers again. Please put kiss in the subject line of your response and tell me something about you and why you responded.
",45,average,,,,,,,,,,,," 5'9"" (175cm)",,,,,,,,,,,,,,married,,
http://washingtondc.craigslist.org/doc/msr/5515759182.html,washingtondc,doc,2016-03-30 17:21,2016-03-30 17:47,msr,m4w,Have You Ever Been With...,"
A man my size?

My house phone (pictured) is seven inches long and well over two inches wide, and I'm soft.

If so, please tell me about your experience(s).

If not, what are your thoughts on the subject?
",,,,,,,,,,,,,,,,,,,,,,,,,,,,,,
http://washingtondc.craigslist.org/nva/msr/5515710704.html,washingtondc,nva,2016-03-30 16:52,2016-03-30 17:26,msr,m4w,BLISS 4 an hour Tantric Massage,"
Release your stress, reengage with your body, bring latent sensual energy to the surface with a blissful Tantric Full Body experience. Tantra is rooted in Buddhist tradition and combines elements of meditation (deep, rhythmic breathing) with sensual massage. Every inch of your body is attended to with trained, healing hands. Warm oil is used to reduce tension and enhance comfort. Being a full body massage, it is not uncommon for orgasms to occur. The massage may be sexual for the receiver but is not for me. My fulfillment comes from giving pleasure. The more pleasurable it is for you - the more I am fulfilled. No compensation or reciprocation expected.

I'm a nice looking, well educated, professional, with gifted, healing hands. I can visit you. If you're not regularly experiencing blissful sensual touching from another, expecting nothing in return- do treat yourself.

Powerful sensual energy is within all of us - it just needs to be released. Let me know if you have any questions or would like to schedule a time. 







",58,,,,,,,,,,,,,,,,,,,,,,,,,,,,,
http://washingtondc.craigslist.org/mld/msr/5515567481.html,washingtondc,mld,2016-03-30 15:29,2016-03-30 15:29,msr,m4w,Experienced Spanker,"
I am a financially secure, successful, 5'10"", trim, fit, 59 year old SWM with a full head of hair living alone in Columbia, MD (near Rts. 29 and I-95). I own a townhome on the main lake (same lake as Clyde's - if you are familiar with Columbia). It's a great place to host and I have a flexible schedule.

In addition to the above, I am an experienced Dominant male. As such, I am an accomplished spanker of many years (both erotic spanking inducing orgasm(s) and/or for discipline). My experience also includes assisting women who desire/need an Authoritative man as a presence in their lives to help them be more successful as they strive to attain their goals. I am told that I am patient and skillful at understanding and eliciting excitement and gratification from my partner. I am safe, sane, and discreet.

Let me know any questions you may have or additional information I can provide that would be helpful to you.

",59,,,,,,,,,,,,,,,,,,,,,,,,,,,,,
http://washingtondc.craigslist.org/nva/msr/5515344489.html,washingtondc,nva,2016-03-30 13:30,2016-03-30 13:46,msr,m4m,Black searching real AFRican: Ethiopian Nigerian ETC.,"
Looking for true AFRICAN GUY.
Any out there? Ethiopian Nigerian
Ghanaia Sudanese Kenyan guys.
Private individual that love foreign
guys. Open minded here.
",43,average,,,,,,,,,,,," 6'2"" (187cm)",,,,,,,,,,,,,,single,,
http://washingtondc.craigslist.org/nva/msr/5515144728.html,washingtondc,nva,2016-03-30 11:46,2016-03-30 13:31,msr,m4w,I am AA for pleasure!,"
Hi,

African American man here looking for a fun and open woman for having sexual pleasure. Healthy, clean and discreet of course.
",47,,,,,,,,,,,,,,,,,,,,,,,,,,,,,
http://washingtondc.craigslist.org/mld/msr/5515100159.html,washingtondc,mld,2016-03-30 11:22,2016-03-30 11:22,msr,m4t,"Attractive, sexy man looking for girlfriend","
Attractive business owner looking for someone beautiful, sane, employed, not living with parents, intelligent and fun loving. Not asking too much right? lol.
",,,,,,,,,,,,,," 6'3"" (190cm)",,,,,,,,,,,,,,divorced,,
http://washingtondc.craigslist.org/doc/msr/5514979759.html,washingtondc,doc,2016-03-30 10:12,2016-03-30 10:13,msr,t4m,LOOKING FOR A TRUE GENTEL MEN,"
Hi202
My 280name is Nialah 
I'm 5578seeking real love and dating. A little about myself
Personilaty wize I love to laugh or sometimes I could be very quiet. Really soft spoking but lol I have my moments. My family and I are close net. I have 4 siblings and there all gay. Im the oldest. I hope someone that I connect with and deal with all of that . just tired of men lying and promising . I know I desevre something real but dam why it has to take so long lol. I turned 30yrs this March 20th and I looking for a compatible sign ""Scorpio or Cancer"". Someone around my age the youngest 28,the oldest 39. Hieght 5"" 10and u.Please reply with pics stats and a little about urself and hope to speak with u soon.
",,,,,,,,,,,,,,,,,,,,,,,,,,,,,,
