url,city,subcity,datetime_created,datetime_updated,category,type,title,text,age,body,body art,diet,dislikes,drinks,drugs,education,ethnicity,eye color,facial hair,fears,hair,height,hiv/hsv/hpv,interests,"kids, have","kids, want",likes,native language,occupation,personality,pets,politics,religion,resembles,smokes,status,weight,zodiac
http://sfbay.craigslist.org/eby/w4w/5461238325.html,sfbay,eby,2016-02-23 10:57,2016-02-23 10:57,msr,w4w,Feminine women wanted,"
Ive posted a few times on craigslist only to
find fakers, flakes and dudes.
1.be real
2.be a woman.
3.don't bring drama my way

Im a soft stud,slim, great hygiene, 150lbs,in shape, mixed and mobile

I'm 420 friendly, drink socially and enjoy
activities from art, movies, clubbing, family
time and just having fun in general.

I'd like to meet an attractive and fun 
loving WOC (woman of color), whose comfortable being fwb. Not looking for a relationship..sorry ladies.

If youd like to know more let me know



Not looking for couples or men! No studs!

",30,athletic,,,,,,,,,,,," 5'8"" (172cm)",,,,,,,,,,,,,,single,,
http://sfbay.craigslist.org/sfc/w4w/5460508281.html,sfbay,sfc,2016-02-22 21:48,2016-02-22 21:48,msr,w4w,"modern art, indie rock, and outdoors","
I am not experienced in dating women. I am seeking someone around the age of 30 to date for a long term relationship. I am an alternative thinker. I love modern art, indie rock, the symphony, indie film and television, literature, museums, academic topics..also I am avid about the outdoors and sports. I love skiing and snowboarding, kayaking, sailing, hiking, camping..I travel too. This year I am going to Australia and Europe. I am seeking a professional and perhaps someone I can live with.
",31,,,,,,,,,,,,,,,,,,,,,,,,,,,,,
http://sfbay.craigslist.org/eby/w4w/5460469207.html,sfbay,eby,2016-02-22 20:48,2016-02-22 20:58,msr,w4w,Just looking for dates.,"
I'm on the mend from a difficult break up and looking to go on dates, have fun and interesting conversations, make out, etc.

I'm femme and mostly attracted to butches/studs/masculine-presenting people. I'm looking for chemistry and connection with no expectations, but I am not looking for anything shallow. 

Let's meet and see what happens?
",,,,,,,,,,,,,,,,,,,,,,,,,,,,,,
http://sfbay.craigslist.org/eby/w4w/5460434174.html,sfbay,eby,2016-02-22 20:04,2016-02-22 20:04,msr,w4w,poly-curious geek seeking lovely lady,"
Hi!
I'm 25, femme, bisexual, curvy, and cute. I'm a full time student studying history. 

I'm in an open relationship and looking looking to expand my horizons romantically. Seriously hoping to establish a connection with someone special, not looking for one night stands or perpetual fwb. This is my first attempt at a poly-type relationship but I'm very interested in giving it a try with the right person. I don't expect much from CL but you never know, right?

I'm a total closet geek; I read manga, watch anime, get excited over the latest scifi movie or show, have a bit of a thing for zombies, enjoy board games, and am a social gamer (though I'm terrible at video games and don't personally own any consoles). I enjoy the outdoors, whether it's wandering the streets of sf or aimlessly wandering the woods somewhere (Marin county has the best hiking spots!!). I'm a foodie and love going to new restaurants as well as frequenting the ones I already love; brunch on the weekend is a must! I like sipping cocktails at fancy bars, looking at cool things in museums/ art galleries, and am almost always happy to go on a random adventure. I'm a kinky bottom leaning switch (who flip-flops about her sub status on the regular) and just looking to meet a girl who shares some of my interests!

I'm interested in ladies in their 20's and early 30's only. Ideally seeking a lady in an established poly relationship or two but totally willing to give things a go with someone as new as I am. It's a plus if you happen to also be a kinkster (as I am and have been for 6 years) but it's fine if you're not.

I don't want to be your unicorn or have a relationship that only involves sex. I posted in the romance section for a reason; I want to go on cute dates and cultivate a loving relationship. Sex is not my priority so please don't bother to reply if it's yours.

If you're interested, feel free to send me an email telling me a little about yourself.
",25,curvy,,,,,,,black,,,,," 5'5"" (165cm)",,,,,,,student,pretty awesome,,,,,,partnered,,
http://sfbay.craigslist.org/eby/w4w/5424083805.html,sfbay,eby,2016-01-28 21:50,2016-02-22 17:44,msr,w4w,kik chat,"
kik group:
#bayarealadies 
or email us to be added. Don't flag and hate please. No solo men, unless we add.

A friendly place to meet couples and females or any combinations from below.
w4mw
mw4mw 
w4w
Please be respectful and hopefully not a dude hangout. show pics and share success stories from group. This is a new group, so give it time and let's build it responsibly.
",40,curvy,,,,,,,,,,,," 5'9"" (175cm)",,,,,,,,,,,,,,married,,
http://sfbay.craigslist.org/eby/w4w/5456552003.html,sfbay,eby,2016-02-20 08:32,2016-02-22 17:16,msr,w4w,Where is my submissive girl?,"
For far too long I have envisioned you at my side. 

I want someone who likes to make out for hours, and finally when I pull you by the back of your hair, as you look into my eyes - I hear you sigh...

I love younger femme submissive cis women, with a good sense of humor, independant, honest, and open-minded. Tend to be attracted to girls smaller than me, size 16 or under. Will need to voice verify within 48 hrs, I am not looking for games, drama, or wasted time.

I'm bi poly and a BBW, have many years of BDSM experience, am nurturing, sexual, and down to earth. I do not smoke or do ANY drugs, and neither should you.

If this piqued your interest, send me your infomation and let's get to know one another. You never know, maybe our search will be over.

",40,,,,,,,,,,,,,,,,,,,,,,,,,,,,,
http://sfbay.craigslist.org/pen/w4w/5460065898.html,sfbay,pen,2016-02-22 15:01,2016-02-22 16:23,msr,w4w,busco lesviana real,"
Really want to experience my first time with another girl.. Don't mind if it's your first time.. We can experience it together.

I've been thinking about it for years, and I'm so turned on by the idea. Looking for a friends with benefits thing. 


No men/couples/3somes

Don't have a kik - so email or text me after you send a picture of yourself
",25,,,,,,,,,,,,,,,,,,,,,,,,,,,,,
http://sfbay.craigslist.org/eby/w4w/5443746412.html,sfbay,eby,2016-02-11 11:57,2016-02-22 16:19,msr,w4w,what r u looking for?,"
...im female im 45...im single....great humor n lotsa love to share .....if my post pics has made you smerk or evn giggle then u may just want to reply ...im for real ....lets chat see if we connect ....shoot youre on here looking youve read this far maybe evn laughed a lil....what ya got to lose ? maybe gain a friend ...wanna find out ?.....truely.im sorry to hafta add this as i thot there were adults in here.tired of the disrespectful replies... if youre not into bbw....but skinny anorexic barbie who wont eat a dam cheese burger ...shoot i eat big macs...idc wat u think..just move on huh....if u want femm just move on..i dont wear make up i cant im allergic n i dont rock dresses...dont ask for pix then tell me ...if you lose a 100 ud be cute... bitch i been cute ...now wheres ur manners huh if someones not your type then keep moving in respectful kindness...normaly i just delete n respectfully move on but its happening way too often lately..no i dont tolerate rudeness at such magnetude ...thats evil judgemental meanness ..if u need to feel good about u..then go to a shrink ok get u some help......im a person not ur toy cuz ur bored n low self esteem i wont be abused trust that .im kind and loving and gentle but im no ones verbal punching bag i like me in my own skin just as i am...screw u if u dont....now..please have a wonderful day n may christ bless u as he sees fit amen ......commense laughter lol...ppl smh lol
",45,,,,,,,,,,,,,,,,,,,,,,,,,,,,,
http://sfbay.craigslist.org/sfc/w4w/5459965217.html,sfbay,sfc,2016-02-22 13:59,2016-02-22 14:46,msr,w4w,Looking for a bi girl,"
Hello everyone

*Hello there I am a dance teacher I am into all type of sports love to dance love music
*just move here to CA so i am looking for another girl and more about me I like to *walk run love the beach go walks and if there is anything else you like to know *please feel free to ask

just please answer with your photo and your number and I will get and back to you oh and by the way I am originally from Ukraine :-) 

i love girly girls. And just give me a try just please reply with a photo.










*DO NOT WASTE MY TIME NO MEN I am married so!!!!!!!!!!!!!!! II WON'T ANSWER TO MEN OR COUPLES and No I dont need ur Money or be your friend
",25,,,,,,,,,,,,,,,,,,,,,,,,,,,,,
http://sfbay.craigslist.org/eby/w4w/5459931197.html,sfbay,eby,2016-02-22 13:40,2016-02-22 13:40,msr,w4w,Dancing with God between Us,"
Dancing with God between Us

Yes, me and you in the arms of our creator, dancing the night away...

I want a woman who loves The Divine!

Imagine the day we stop hiding our fierce and beautiful spirituality.

Imagine choosing to step out and accept our commitment to living a conscious and intentional life.

Imagine relationships more than a fleeting pass-time as we unconsciously or consciously prep for the next.

Imagine a wife/partner/friend as an opportunity to cultivate more love in the world.

Imagine meeting the one who feels similarly and has an unending passion to find the one who matches, if not, surpasses, her love of The Infinite.

Imagine what we could create together.
No limits, working through the hard moments, palatable closeness, exquisite intimacy, love making that would take us into worlds we've not yet traveled, and that would be the beginning...

A beginning that has no end...
",,,,,,,,,,,,,,,,,,,,,,,,,,,,,,
http://sfbay.craigslist.org/pen/w4w/5459641211.html,sfbay,pen,2016-02-22 11:04,2016-02-22 11:44,msr,w4w,"STONER GIRL'S / LADY'S , want to have FUN","
420 lady's / girl's, want to smoke & have some fun , send me a email here & we can make the plans & detail's together ... thanks , Stacey * xoxo ...* LADY'S & GIRL'S ONLY *
",25,athletic,,,,,,,,,,,," 5'10"" (177cm)",,,,,,,,,,,,,,single,,
http://sfbay.craigslist.org/eby/w4w/5459584638.html,sfbay,eby,2016-02-22 10:35,2016-02-22 10:53,msr,w4w,Adventures In Candy Land... So Sticky~,"
Ladies ... Its our Sweet Lady's birthday and we are turning up THIS WEEKEND (Saturday 2/27) for the Grown & Sexy set. We are looking for new, like-minded SisterFriends who enjoy getting away for Fun Times and Birthday Cake!

We will be meeting in the upscale hotel bar for a cocktail Meet & Greet. Fun, Games and a lot of Laughter is always on the menu with us. 

We will continue to the after party suite for private birthday party fun. Remember... this is a Grown and Sexy event. 

Interested Ladies must be 30+, African American, Enjoy the company of Sexy Lesbian and Bisexual Women and ready to have a very Sweet & Sticky time!

Interested, Much!? 
Respond with your Name, Age, Sex and Location. Also attach a recent pic (Face a must, Body a plus but not necessary) and I will respond with details.

Candy Land is Waiting ... Cum and Enjoy~
",45,,,,,,,,,,,,,,,,,,,,,,,,,,,,,
http://sfbay.craigslist.org/eby/w4w/5442084562.html,sfbay,eby,2016-02-10 10:18,2016-02-22 09:57,msr,w4w,High Femme Looking for Masculine-of-Center Queer,"
I'm a high femme who is fat, extra-voluptuous, radically self-accepting, and attractive, and I'm looking for a compatible masculine-of-center queer.

I'm 41, white and critical about it, and very down-to-earth and real despite my hard-fighting high femme armor. Simultaneously, I'm a pretty heady and creative person who is most at home synthesizing meanings and creating new realities from ideas, art, music, and politics. I am slow to build intimacy and do best with relationships that are predicated on a strong friendship dynamic.

I'm looking for someone who is much more interested in prioritizing a collaborative intellectual and creative partnership than conventional marriage-family-kids. I'm interested in making stuff, separately and together. I'm more of a collectivist than an individualist and recreating the nuclear family is anathema to me, while I do love children and extended families beyond my four walls. 

Beyond this, I'm pretty open. Even if there isn't chemistry, I never consider friendship a failure, because my world is supported by a huge web of family and friends, and there's always room for more.

Please get in touch if you're interested!
",41,,,,,,,,,,,,,,,,,,,,,,,,,,,,,
http://sfbay.craigslist.org/eby/w4w/5459479056.html,sfbay,eby,2016-02-22 09:42,2016-02-22 09:42,msr,w4w,"Is Tennis, Health, Spirituality and Family Your Life???","
Passion, Balance and Love! I want to bring this to a relationship and create a strong bond, friendship and create more family. Looking to share my life with a woman! Grow together! Share the ups and downs. Be together in the easy times and work through the difficult times. I am looking at the commonalities to bring us together but know there will be differences and I embrace those differences. I encourage us to both have our own lives and then come together to form a beautiful balanced life together. If this resonates with you lets chat and get to know each other and then the rest will blossom into place!

",46,curvy,,,,,,,,,,,," 5'5"" (165cm)",,,,,,,,,,,,,,single,,
http://sfbay.craigslist.org/sfc/w4w/5419519834.html,sfbay,sfc,2016-01-25 21:30,2016-02-22 08:44,msr,w4w,Chouette,"
Vibrant, vivacious and reflective are three words to describe me. 
Vibrant because I appreciate all the beauty in life, vivacious because I speak my mind and my native tongue is French, and reflective because I enjoy quiet times of listening to music and reading, or simply listening to the sound of silence, just being. 

I own my own business, massaging women who are pregnant, and teaching women how to massage their babies.



I have a women group called LES FEMMES CHOUETTES ""Cool Women""
For lesbians, bisexual women and transgender women age 23to 70 (and their friends) in my offce.
22nd St and 23rd Valencia St.
Every Friday night between 7:00 and 8:30 PM. 
We talk about all kinds of topics, big and small, while making new friends.

Please give me your email if you are interested.

Merci!

Dominique
",57,,,,,,,,,,,,,,,,,,,,,,,,,,,,,
http://sfbay.craigslist.org/sfc/w4w/5458952381.html,sfbay,sfc,2016-02-22 01:03,2016-02-22 01:03,msr,w4w,any real women who can make me change my panties?,"
I'm really fed up with men. I've been watching lesbian porn and I must say, It's making me really tingly. Any experienced girls out there who can show me the way? I'm feeling like I have a really frisky kitty just back from the rain....Pics plz or your wasting our time
",24,athletic,tatts,,,,,,,,,,," 5'8"" (172cm)",,,,,,,,,,,,,,single,,
http://sfbay.craigslist.org/sfc/w4w/5458764544.html,sfbay,sfc,2016-02-21 19:05,2016-02-21 20:39,msr,w4w,Stud seeking for Queen,"
age: 31

age: 31

Aloha ladies....
I am stud looking for me queen. Id love to start off as friends and see where it goes from there. I dont have any children but I am definitely open to seeing someone with 
I am looking for someone who I can enjoy adventures with or even something as simple as a movie. Someone that would love me the way I would love them and also someone who is smart, funny, caring, cultured, educated, a foodie, spiritual - just someone who is well rounded (if possible). No one's perfect 

A bit about me: HawaiiAN living here in Nor Cali. I am a bit on the heavy side at the moment (it happens around this time lol) but im working on it😉😉😉😉😉. I'm 30 yrs old n a WORKAHOLIC. ..
I'm more of an out door person, but I can also be an indoor kind of girl at times. I like joking around, having fun, being on the edge, reading, spending quality time with other half (hopefully its you) , spending time with family, exploring new places with friends, going on drives, and much more.YES, i am a REAL female aND i am only looking for single FEMALES.

Text me if your interested 6fiveO Five1five 1eight6six.
",31,,,,,,,,,,,,,,,,,,,,,,,,,,,,,
http://sfbay.craigslist.org/eby/w4w/5458837116.html,sfbay,eby,2016-02-21 20:34,2016-02-21 20:34,msr,w4w,who wants to be my pillow princess,"
I'm a Italian stud 19 looking for something that will maybe last a while I like to have fun drink ,Cruz around and slap rap music I do have a car so I am mobile but looking for something locally I like fem girls race doesn't matter age don't matter as long as it don't matter to you, young wild and free just tryna make sum out of life contact me with you picture and a little about your self we can see where that goes from there
",19,average,tattoos,,,sometimes,,,,,,,," 5'3"" (160cm)",,,,,,,,,,,,,daily,single,,♈ aries
http://sfbay.craigslist.org/sfc/w4w/5458765044.html,sfbay,sfc,2016-02-21 19:05,2016-02-21 20:30,msr,w4w,Stud seeking for Queen,"
age: 31

age: 31

Aloha ladies....
I am stud looking for me queen. Id love to start off as friends and see where it goes from there. I dont have any children but I am definitely open to seeing someone with 
I am looking for someone who I can enjoy adventures with or even something as simple as a movie. Someone that would love me the way I would love them and also someone who is smart, funny, caring, cultured, educated, a foodie, spiritual - just someone who is well rounded (if possible). No one's perfect 

A bit about me: HawaiiAN living here in Nor Cali. I am a bit on the heavy side at the moment (it happens around this time lol) but im working on it😉😉😉😉😉. I'm 30 yrs old n a WORKAHOLIC. ..
I'm more of an out door person, but I can also be an indoor kind of girl at times. I like joking around, having fun, being on the edge, reading, spending quality time with other half (hopefully its you) , spending time with family, exploring new places with friends, going on drives, and much more.YES, i am a REAL female aND i am only looking for single FEMALES.

Text me if your interested 6fiveO Five1five 1eight6six.
",31,,,,,,,,,,,,,,,,,,,,,,,,,,,,,
http://sfbay.craigslist.org/sfc/w4w/5458716951.html,sfbay,sfc,2016-02-21 18:16,2016-02-21 18:17,msr,w4w,"Marriage,friendships","
I' m interested in meet a woman who want get to know each others and get married,
live togheter and share a house.
I' m on the masculine spectrum,soft butch and I ' m looking for a femme.
You should have a job, not an heavy drinker or drug user and healthy.
.(no dramas) ex wife or girlfriends-preferible 27-40 years old 
please be attractive ,no games or players and I know I ask too much but also I would like to meet someone who is a nice person inside.
If you think you can be the one please email me :) I ' m attracted by white girls or mixed latinas,just preferences.
",32,,,,,,,,,,,,,,,,,,,,,,,,,,,,,
http://sfbay.craigslist.org/sfc/w4w/5458587939.html,sfbay,sfc,2016-02-21 16:23,2016-02-21 16:23,msr,w4w,Hola busco chikas,"
Hola me llamo Jéssica y busco una chica para cumplir mi fantasías oh ya sea una pareja de mente abierta y real no hombres solo si eres tu contesta con una foto si no hay foto no respondo gracias y espero k alguien sea serio y busque lo mismo que yo ya que es mi fantasía k tengo y de solo pensarlo mi panochita se me moja 😊😊
",22,heavy,,,,,,,,,,,,,,,,,,,,,,,,,,single,,
http://sfbay.craigslist.org/eby/w4w/5458539811.html,sfbay,eby,2016-02-21 15:44,2016-02-21 16:03,msr,w4w,Partner in crime? Playful fun & More!!!,"
Sensual, Sexy! Kind, Playful looking for a friend to let loose with .... Beach, Bistro ... Why limit the fun or pleasure!!!

Talk to me!

Pic for reply.

XO
",,,,,,,,,,,,,,,,,,,,,,,,,,,,,,
http://sfbay.craigslist.org/eby/w4w/5458545909.html,sfbay,eby,2016-02-21 15:49,2016-02-21 15:49,msr,w4w,Couple wanting someone to join,"
I'm ready to live out the fantasy I've always dreamed about . I'm a mixed girl black and white looking for a beautiful girl to join me and my boyfriend . I'm 5'4 with big boobs and full lips . My boyfriend is 6'3 body like a football player with a huge package. If you think your interested email me with your picture . We will give you a beautiful experience .
",18,skinny,,,,,,,,,,,," 5'4"" (162cm)",,,,,,,,,,,,,,partnered,120,
http://sfbay.craigslist.org/eby/w4w/5458524477.html,sfbay,eby,2016-02-21 15:32,2016-02-21 15:32,msr,w4w,Perks of Dating Me Include Laughing A Lot And Getting Your Car Fixed,"
No pressure. No rush. Never dated before. Have been seeking a girlfriend for days. Ideal match:

Single
Monogamous
Age 21-35
Live near me
Non-smoker (420 OK) 
Mature, confident, honest/up front, not mean/shady
Open to meeting up in real life

and 

A WOMAN.

If interested, please verify with your photo and be willing to play a light-hearted, fun game of 21 questions.
Go ahead, ask me anything! 

Thanks! Cheers.
",24,,,,,,,,,,,,,,,,,,,,,,,,,,,,,
http://sfbay.craigslist.org/sfc/w4w/5458451793.html,sfbay,sfc,2016-02-21 14:37,2016-02-21 14:37,msr,w4w,Super-femme black princess looking for a femme friend,"
I'm successful and attractive - looking for someone who wants to engage my sensual side. At work, I'm all business and professional, but when I'm not working, I like to let my hair down with someone special. Want to join me?

I'm in my 30's, African-American, 5'4"", 125 lbs, HWP, soft skin with big boobs and a cultured worldview. I'm intelligent, clean and want to find a woman who is the same. All races are welcome, but you should definitely love pretty black women. 

I like red wine and craft cocktails, fancy coffee, and pretty lingerie. I'm looking for a woman who is smart, mature (roughly 30-46), very pretty, and *ahem*...talented with her tongue.

Only interested in women. No men. No couples.
",,thin,,,,,,,,,,,," 5'4"" (162cm)",,,,,,,,,,,,,,single,,
http://sfbay.craigslist.org/sfc/w4w/5458437495.html,sfbay,sfc,2016-02-21 14:26,2016-02-21 14:26,msr,w4w,"60ish , Happy, fit, kind , & active","
Seeks same for dating. I love animals and kids, riding my bike, walking, movies, interesting conversation, reading, coffee and a lot more. Would love to meet a woman around my age that is interested in friendship first and if the attraction is mutual in a romantic way, more. Not looking for an all consuming, 24/7 , move in together, drama filled relationship. I work 4 days a week at a local hotel. Want to meet a woman that would like to go out together to dinner and a movie sometimes and local day trips and for a walk in the park or presidio in nice weather. I love to laugh and hear the laughter of others. Music is very important to me and Neko Case is my favorite singer/song writer. Hoping to hear from you soon....
",,,,,,,,,,,,,,,,,,,,,,,,,,,,,,
http://sfbay.craigslist.org/eby/w4w/5458293647.html,sfbay,eby,2016-02-21 12:45,2016-02-21 14:20,msr,w4w,Hey Bay Area Lesbians,"
Id love a friend, a best friend. I hv a girl. 

Im 25, Virgo,love to go out dancing,listen to bands or go to concerts.The beach is my second home when I get to go to the city or lakes. I Love to write novels and poetry. I do sing some say well others say I dont. So you can be the judge.

I love looking at Art and Photography. Going to see preforming arts. I am big on trying new things and different foods.


I am a certified nanny so I absolutely adore children. I have children of my own but they are living with my family for the time being. If you have children of your own thats wonderful too.

Just email me with the type of relationship your looking for, a little about yourself, and a selfie, no nudes please. Ill send mine back.













",,curvy,,,,,,,,,,,," 5'6"" (167cm)",,,,,,,,,,,,,,,,
http://sfbay.craigslist.org/sby/w4w/5458352217.html,sfbay,sby,2016-02-21 13:25,2016-02-21 13:44,msr,w4w,Hey There Beautiful!,"
The woman who makes my heart skip a beat. The woman who brightens my day with a simple text, a call, her smile and laughter. The woman who is just a that a woman, and not because her age dictates it so, but a woman who knows that life is not a rigid stone but forever changing with what life throws our way. She is intelligent and caring and serious and silly. She is employed and content. She enjoys movies, and maybe has a favorite tv show and likes the outdoors. But a woman who has a life away from work and the couch and the computer. I consider myself a pretty laid back person, I try not to sweat the small stuff because in the grand scheme of things it's not worth it. I would rather spend my time letting the woman who has my heart know how I feel about her. I am not totally femme but also having some chapstick/softbutch traits if you will, and though I have mostly dated younger woman (within reason), I'm late 40s, I'm not closing myself off to any possibilities (within reason). I am pretty much open as to what I like to do for fun. If it seems like fun I will give it a go. I like to cook, watch movies, read, but most of all, I like to have good chats, even if it's about the silliest thing. I want to find someone I can be myself around and not have to change who I am as a person and I want her to be able to be exactly who she is. Isn't that what we are all looking for, someone who will love us for us? With that said, I do have preferences as I see most on here do. Mine are, she is feminine, average height, she has this aura about her that to me would make her beautiful. The arts, meditation, walks on the beach, City nights all intrigue me. Your pic gets mine. Please include an email address so this doesn't go from CL address to CL address as that gets really confusing. Yes I am 100 percent real woman. 
",48,,,,,,,,,,,,,,,,,,,,,,,,,,,,,
