url,city,subcity,datetime_created,datetime_updated,category,type,title,text,age,body,body art,diet,dislikes,drinks,drugs,education,ethnicity,eye color,facial hair,fears,hair,height,hiv/hsv/hpv,interests,"kids, have","kids, want",likes,native language,occupation,personality,pets,politics,religion,resembles,smokes,status,weight,zodiac
http://sfbay.craigslist.org/sby/w4w/5464986026.html,sfbay,sby,2016-02-25 18:32,2016-02-25 20:01,msr,w4w,Girls Night OUT - Mix and Mingle in San Jose with Women,"
Do you sit at home weeknights wishing there was a place to meet women in the South Bay?

Do you wish you had the time to find a friend or maybe more?

Are you too shy to go out alone?

Well here's your chance! Thursday Night, March 3rd I would like to invite the women of our community to join me and others for an informal happy hour.

Come lounge around with us at ""55 South"" located at 55 South 1st St located about 300 feet from Splash bar. ""55 South"" is a lovely cocktail and wine bar offering enjoyable absolutely delicious appetizers. They know how to REALLY make a ""Moscow Mule "" and Mac & Cheese here!

This is a safe place to meet and mingle with women without the stress of having to carry the conversation! Come one, come all and enjoy a fun night of drinks, dinner and conversation with like-minded gals like you. You never know you might actually like it!

NOTE: I would kindly like to request our communities support in advertising this event, and really getting the word out there. If there is enough interest, this may become a monthly event and more. Feel free to share with your friends , post on Facebook, MeetUp Groups, and other email lists. 

Come on. . . grab your friends and let's have some fun!


PLEASE RSVP
",,,,,,,,,,,,,,,,,,,,,,,,,,,,,,
http://sfbay.craigslist.org/pen/w4w/5465031515.html,sfbay,pen,2016-02-25 19:21,2016-02-25 19:55,msr,w4w,Hello Looking To Rent To Another Lesbian 55+,"

Hello not a dating post but I have a quaint older 2 bedroom apartment

1 bathroom only shared with me. I am renting out the ""extra bedroom"" 

including all utilities, WIFI, etc. It's a smaller bedroom totally furnished

with a twin bed. It has a large walk-in closet. it's an upstairs unit 1 flight 

of stairs and fairly very quiet tenants. There is a washer/dryer in building.

I will not be in your face or your business I ask the same. No overnight 

guests unit too small. The rent is great $850.00 and Bart is 2 blocks away. 

Trader Joe's the works, light cooking please. $400. deposit. On street 

parking could be half to one block away. Sunshine Gardens not foggy like 

near Tanforan or Daly City at all.
",,,,,,,,,,,,,,,,,,,,,,,,,,,,,,
http://sfbay.craigslist.org/sfc/w4w/5456722654.html,sfbay,sfc,2016-02-20 10:08,2016-02-25 19:03,msr,w4w,Androgynous & Nerdy,"
So, this may sound pretty weird but I am so tired of dating and meeting people who 1) have some sort of catch (they're married, not over their ex, or are pregnant..I know I have bad luck with women apparently) 

I'm REALLY looking for someone to settle down with. I am 23 but have an old soul, I know what I want and who I am, I've done all my partying in my teen years (quite a lot, over it). The problem is I keep meeting people who aren't ready to settle down, or don't have the ultimate goal of getting married. I don't mean to sound unattractive by complaining, I just want to make the point that I am seeking a woman who is willing to pursue me in the hopes of settling down with me (WITHOUT crazy baggage). 
I'm going to be up front, if I like you I'm not very good at taking things slow. I like affection, I like reminding my girl how amazing she is all the time and apparently that is too much for some people to handle. I fall hard, which I recognize is a flaw but am seeking someone who is equally excited about me as I am them. Someone passionate, a hopeless romantic like myself. 

Now that we have that out of the way..

About me: 
23 
Full time employed by a MAJOR social networking site (not going to post which one, but feel free to ask) 
Introverted, I prefer snuggling up and watching a movie to clubbing any day. 
Enjoys being called daddy in bed (Just to get that out of the way haha) 
REALLY into physics, philosophy, psychology and deep conversations 
Working on getting sleeve tattoos, I have some big ones on my arms already.
5''6 
I do volunteer work, I love to help others!
Really (and obviously) sick of the dating scene. I am sure I will get some smart ass emails, but whatever. 
I love to write and read! #Nerd power
I play guitar, used to be in a punk band. 
Suuuuper romantic. 


If you're looking for someone who doesn't play games and is ready for something real and long term (and you think we'd be a good match) email me with a photo and some information about yourself. Let's go on a date! 

I'm really into androgynous women, so points if you fit that!
",23,,,,,,,,,,,,,,,,,,,,,,,,,,,,,
http://sfbay.craigslist.org/sby/w4w/5464902193.html,sfbay,sby,2016-02-25 17:13,2016-02-25 18:26,msr,w4w,Don't waste my time nor yours :),"
Im looking for fem more on the stud or boish look. It's plain and simple life is too short to play games. I'm looking for someone to built a friendship first then if things go right more :)

I don't smoke nor should you. I drink occasionly. I hold all of my own. I do not have drama in my life and I plan on keeping it that way. Attraction is very much key for me so if your interested to meet and chat send a pic Hopefully there is chemistry. I will respond to all emails as long as they are tespectdul . I do not discriminate all races and sizes welcome :)
",38,average,,,,,,,,,,,," 5'6"" (167cm)",,,,,,,,,,,,,,single,,
http://sfbay.craigslist.org/sfc/w4w/5461736612.html,sfbay,sfc,2016-02-23 15:52,2016-02-25 17:55,msr,w4w,Different connections,"
I'm looking for some lesbian, bi girl friends (ok, straight girls welcome too). In a relationship or single is OK with me. Just looking for different types of connections: platonic friends, fwb, hiking buddy, book nerd, weekend trip friend, texting only friend, etc. I'm pretty open minded so let's chat and see if there's a connection and see where it goes. Life is too short not to explore options. Plus, there are so many wonderful people in this world that it would be a shame not to try and meet someone new every once in a while. 

I'm 34, Mexican, femme to sporty spectrum, have a 4 year degree and a great career that I love. I enjoy hiking, random road trips and adventures, massages(giving and receiving), running, concerts, museums, trying new restaurants or recipes, I like going out (trust me...I can still party pretty hard), but I prefer intimate nights in with no TV, no cell phone, no distractions....just me and my friend being present, in the moment, and getting to know each other on a deeper level. 

Age is not important to me. It's what's inside that matters and if there's a connection. However, I have a weak spot for Latinas and other women of color with tomboy to feminine qualities who are curvy (at or above a size 8/10 and no more than size 18/20). 
If interested, send me a message and we'll see where this goes. Or reach me at Four 1Five, 6Eight _nine, eighty '99! 

Willing to travel around the Bay area for the right connection. I love exploring new places & enjoy driving. 

Women only 
No M/F couples 
Open to F/F couples 

Thanks for reading.
",34,curvy,,,,sometimes,,BA,Latina,,,,"long, curly, black"," 5'5"" (165cm)",,,,,,,,,,,,,never,partnered,,
http://sfbay.craigslist.org/sby/w4w/5464784377.html,sfbay,sby,2016-02-25 15:37,2016-02-25 16:59,msr,w4w,Let's meet,"
[ABSOLUTELY NO MEN/COUPLES/DRUGS/STDs]

If love was a gamble, then I'd be a gambler.
If love was a poison that rips up my heart...
Sending piercing pain and joy into my veins...
Then, girl, I'll be happy to take that shot for you.
If love let me fall deeply for you;
Let me snuggle you with sweet embrace;
Let us make music and melodies with our moans of ecstasy,
Then, my God, let me fall in love.
Let me fall deeply in an all-consuming love;
My soul, my mind, and my body are yours.
Days, hours, minutes, seconds--I will be thinking of you;
Of your soft lips gliding down my neck and my hands gently teasing your torso;
Or the countless of times you whisper my name, and I yours;
Or the endless silent conversations that we have where no one spoke, but it was more than enough...

Me: Asian, lesbian, hopeless romantic, trustworthy, loyal, ambitious, great cook, great cuddler, tech-savvy, gamer, amateur guitarist, amateur poet, loves the outdoors, loves animals, wants to be a butterfly one day (ask me about it), wants a family (be it with kids or adopted animals), prefers tea over coffee. 

You: FEMALE, SINGLE, 23-28 years old, Caucasian/Asian, confident, independent, health conscious, down to earth, the girl next door, an adventurer, shy but also has a crazy side that yearns to be free, has an idea of what you want to do in life (doesn't have to be set in stone), wants more than a one night stand, can hold a conversation, am interested in me and will put in the effort to get to know me (I will do the same).

Respond to email with: the title of your favorite Movie/TV Series attached with a picture of you. Keep it PG.

[ABSOLUTELY NO MEN/COUPLES/DRUGS/STDs]
",24,athletic,,,,,,,,,,,," 5'2"" (157cm)",,,,,,,,,,,,,,single,,
http://sfbay.craigslist.org/pen/w4w/5464736616.html,sfbay,pen,2016-02-25 15:03,2016-02-25 15:45,msr,w4w,Looking to shareShare a lovely 2 bed condo in Belmont ..April move in,"
I am a lesbian and looking to share a bright and private 2-bedroom, 1-bathroom apartment. The apartment is located in San Mateo, a short distance from the Hillsdale Caltrain Station, Highway 101 & Highway 92. I posted here but am not looking to date my room mate; only get the word out to a broader lesbian audience as this is a fabulous deal I think! :-)
The move-in date is April 1, 2016 [no fooling]; the monthly rent is ~ $1,600, this includes shared utilities.The leasing office does require running a background check which is $42. The leasing period is 15 months.
You would just need to furnish your own bedroom and some things in the living and kitchen area if need be.
I have 2 cats, I enjoy swimming, biking, long walks along the beach, visiting with friends & family, and new adventures. I am easy going and do enjoy privacy at times. If you are interested in talking about this opportunity, please respond to this posting. Thank you!
",60,,,,,,,,,,,,,,,,,,,,,,,,,,,,,
http://sfbay.craigslist.org/sfc/w4w/5464678012.html,sfbay,sfc,2016-02-25 14:23,2016-02-25 14:23,msr,w4w,Looking for Femme for femme,"
Hello girls,

Giving this a try and see where it goes. Looking for a femme who loves to have a good time. Start as friends and see where it goes maybe friends with benefits . Must be 25-30 femme. I love Latina girls (you don't have to be Latina)medium sized with nice sized breasts. 

A little about myself I love sports, staying active , religious coffee drinker . I like doing simple things with good conversation.

Send me a picture and put size of breast on subject. Hope to hear from you ❤️
",27,,,,,,,,,,,,,,,,,,,,,,,,,,,,,
http://sfbay.craigslist.org/sby/w4w/5464455437.html,sfbay,sby,2016-02-25 12:07,2016-02-25 13:40,msr,w4w,Looking for fwb,"
Hi,
I'm hoping to meet a woman to develope a long-term friendship and hopefully a romantic one as well. I'm quiet at first but once I get to know you I open up. I enjoy going to movies, art & wine festivals, concerts, shopping. I also love animals and the outdoors. Oh and I love watching sports; football, baseball, hockey, basketball. Hope to hear from someone with similar interests.
",,athletic,,,,,,,,,,,," 5'6"" (167cm)",,,,,,,,,,,,,,,,
http://sfbay.craigslist.org/sby/w4w/5464454810.html,sfbay,sby,2016-02-25 12:07,2016-02-25 12:37,msr,w4w,Looking for fwb,"
Hi,
I'm hoping to meet a woman to develope a long-term friendship and hopefully a romantic one as well. I'm quiet at first but once I get to know you I open up. I enjoy going to movies, art & wine festivals, concerts, shopping. I also love animals and the outdoors. Oh and I love watching sports; football, baseball, hockey, basketball. Hope to hear from someone with similar interests.
",,athletic,,,,,,,,,,,," 5'6"" (167cm)",,,,,,,,,,,,,,,,
http://sfbay.craigslist.org/eby/w4w/5464267599.html,sfbay,eby,2016-02-25 10:21,2016-02-25 10:21,msr,w4w,Want to brew beer with a bunch of dykes?,"
Tons of single (and not single) dykes are getting together and making beer. If you want to meet hot, smart, hilarious, beer brewers and soon-to-be beer brewers, if you have mad skills or want some new ones, if you are lonely and need to meet queer women... join us. We're a wide variety of queers, lesbians, trans folks, genderqueers, gay men, bi people, the whole spectrum of definitely-not-straight. BUT for whatever reason the vast majority are bad ass women-for-women.

February 27 - brew in Berkeley
March 8 - educational sour bottle share and long-term fermentation talk
March 12 - brew in SF
March 19 - brew in SF

Just hit me up for details. Let's hang out! 

If you are straight, that's really wonderful and I know we sound really fun and duh, beer is awesome however it would not be appropriate for you to respond to this ad. 

engineers, biologists, professionals, beer, homebrew, craftbrew, dykes, queers, brew, technical, innovation, equipment, community, dating, chilling, diy, radical, creative, art
",,,,beer,,daily,,,many,,perfect,boredom,,,,"equipment, fermentation, revolutions",,,homebrewing,,,radical,,queer,,diverse,,,,
http://sfbay.craigslist.org/pen/w4w/5448314874.html,sfbay,pen,2016-02-14 19:13,2016-02-25 09:33,msr,w4w,Seeking Sweetness With Maturity 57+,"
Have been single for quite a long time after a while you say is this all

there is? As we mature growing older many people tend to fade away in 

one way or another sometimes we find ourselves craving more as in 

companionship with a kind person that enjoys the ""simplicity"" of life........

No expectations of the 4TH of July on a daily basis. Not seeking turmoil 

laced with drama been there done that we will give that to someone else that

may wish to partake..........I like doing the walks, movies, junking a bit and 

much more.............can you teach me a few things life is always a process of 

learning and growth. Please be willing to share some of your time if you want 

a little companionship and a person to cuddle up with do reply. I'm told I am 

attractive but that's for someone else to decide. Please be 50's to 65 years 

of age. I look fit and I do take care of myself. Let me reiterate ""seeking simplicity""

I am not a white water rafter nor do I scale mountains but I do exercise, I walk tall

in shape but I am ""petite"" and still very capable of very long walks......... I think

my issue with extreme sports at this point is injury I would like to avoid!

Please no smokers.......I am 100% lesbian....like forever. This is safe not a scam or

anything to fear so take a step forward.
",,fit,,,,,,,,,,,," 5'3"" (160cm)",,,,,,,,,,,,,,single,,
http://sfbay.craigslist.org/eby/w4w/5422579169.html,sfbay,eby,2016-01-27 21:16,2016-02-25 09:33,msr,w4w,kik chat,"
kik group:
#bayarealadies 
or email us to be added. Don't flag and hate please. No solo men, unless we add.

A friendly place to meet couples and females or any combinations from below.
w4mw
mw4mw 
w4w
Please be respectful and hopefully not a dude hangout. show pics and share success stories from group. This is a new group, so give it time and let's build it responsibly.
",40,curvy,,,,,,,,,,,," 5'9"" (175cm)",,,,,,,,,,,,,,married,,
http://sfbay.craigslist.org/sfc/w4w/5452086116.html,sfbay,sfc,2016-02-17 09:34,2016-02-25 09:10,msr,w4w,Erotic Phone Play only,"
Im looking for Erotic phone play with women only
No men couples etc
Im a busy woman and have to be discreet. No endless texting or email or pics. 
Im busty and love erotic phone play
The louder n nastier the better
Evenings r best
Send pic and times u can play
",,,,,,,,,,,,,,,,,,,,,,,,,,,,,,
http://sfbay.craigslist.org/sfc/w4w/5463820209.html,sfbay,sfc,2016-02-25 05:36,2016-02-25 08:06,msr,w4w,Older Woman Only Has Eyes For Younger Woman--with Specific Birth Date,"
Buongiorno, 

Generally, I am interested in the person, not in their astrology, however, for this, I am solely relying on astrology to sharply narrow my options; particularly the possibility of being hurt due to some fundamental astro incompatibilities. Granted there are many things in life, other than astrological compatibility, that count for something, in relationships, however, who I am looking for is special. The relationship I am opening myself to be a part of is also special, and somewhat date specific. After decades of attracting the wrong type of women, I finally got into astrology, clearly saw why, and clearly saw the workaround. This is part of the workaround; only partnering with a woman whose astro profile is like a key to my lock, and vice verse. It promises to be a very loving, sensitive, passionate, and dynamic relationship! 

Me: Basically, I am a highly sensitive, primarily spiritually-minded, creative, dreamer-type, gentle, caring, intense, brainy, fun, funny, deep, multicultural, multi-ethnic transwoman of color. I am a very youthful older woman, in my late 50's. [I am inherently outgoing, but I have been deeply harmed, and I live with clinical depression, frequently fearing social interaction, to the extent of preferring to live in the shadows; the image is a good representation of that.] I am (an Internet-based) professional, and I do a lot of business in Asia, and New Zealand, so I work at night, and need a nocturnal-oriented partner. My most consistent demeanor is kind, gentle, mysterious, and somehow, not of this world.

I avoid opening myself up to intimate relationships with white, and Jewish women; based on too many adverse experiences with them, as groups. Otherwise, ethnicity is irrelevant; although I really DO have a heart thing for Native American, Japanese, (Western) French and Persian women. 

I have weak knees for tall women, i.e. 5'10""+. I tend to regard short women only as friends. Otherwise, my description of you generally applies to me too; older women are more substance-oriented, then sensation-oriented--one of the best reasons for younger women to be with us--so pardon the pun, the list is substantial.

You: 
[Most Important!] Your primary motivation in life is to attain the highest degree of Holiness that you may, and you live for Love's sake, more than any other reason--and that includes having a dedicated yoga, meditation, and spiritual practice; #
you are very sure, and solid in your own ""positions"" , and are not threatened by positions of others that may be inconsistent with yours;
you are serious, but not too serious to be unable to laugh at yourself;
you know how to get in touch with, and talk about your feelings, rather than relying on emotional outbursts to let your partner know something is not copacetic; 
you although assertive, you are not into being dominant; 
you live creatively, and don't need to take the same route anywhere twice in a row; 
you would rather cuddle, and listen to fantasy stories on audiobook, than go to any sports event--I don't EVER wish to hear more than a few seconds of sports broadcasts when we're together; 
you are a professional, if not typically, then creatively, or both; 
you have no STDs, dogs, psychotic ex-girlfriends, or queer-hatin' family; 
you are very, very affectionate, with words, and touch, [publicly is not necessary]; 
you are physically attractive, thin, (and into being thin), and good looking, with zero conceit, or narcissism; 
you are romantically inclined toward well-educated, spiritually-minded, women of color, with beautiful eyes, and smiles, long dark hair, and dark, soft, smooth skin; 
420 is fine, but you don't drink alcohol, or do narcotics. 
you love passionately, and not jealously;
you like to kiss, every part of your lover's body;
you are assertive, not shy, even if you are reserved in your demeanor;
you speak multiple languages;
you prefer to hang out with people from other cultures before criticizing them;
you read poetry aloud, with the sexiest, most seductive voice;
you are 5'8""+ tall;
for you, going to church/temple in your pajamas is fine; and 
you were born on one of the following dates;

-- November Twenty-fifth through
December Twenty-first, Nineteen Seventy-two;
-- October Ninth through
December Thirteenth, Nineteen Seventy-four;
-- October Nine through
November Fourteenth, Nineteen Seventy-six;
-- September Twenty through Thirty,
October, November, December One through Twelve, Nineteen Seventy-eight;
-- November, Twenty through Twenty-eight, Nineteen Seventy-nine;
-- October Five through Thirty, Nineteen Eighty;
-- October Twenty-two through Thirty-one,
November One through Five, Nineteen Eighty-one;
-- September Eighth through Thirtieth,
October First, Second, Twenty-seven through Thirty-one, Nineteen Eighty-two;
-- October Six through
November Ninth, Nineteen Eighty-three; or
-- January Twelve through Twenty-fifth, Nineteen Eighty-four.

So, that being said, if you fit this profile, and are looking for someone like me, we have a very good start to an incredible relationship, that may become the stuff of movies. Maybe not the movie stuff, but, the odds are stacked in our favor; so,

how adventurous are you?

I prefer to meet in person, rather than to go through email changes leading to nothing. Respond to this post, with a conversation, rather than a one line, ""Hit me up!"" type of message. Use an original subject line that represents your individuality, and you'll get my attention. Start a deep, interesting conversation that we may continue in person, and you may get my phone number. Meet up with me, and you may get more.




Zero intimate attraction toward males here, so men, don't waste your time trying to connect with me.
Not into HWP, thick, or BBW women as intimacy partners.
Zero tolerance for any kind of abusive behavior; if I perceive it as a pattern, I will leave you. 

Keywords: adventure, spiritual, yoga, meditation, black, Native American, Japanese, Persian, mtf, m2f, trans, transgender, t4w


",,thin,,"No red meat, or shellfish",,never,never,Higher; never stops.,,,,,," 5'8"" (172cm)",,,,,,English,,"quiet, reserved, shy",,,Dropped in favor of Relationship,,,,,
http://sfbay.craigslist.org/eby/w4w/5464003281.html,sfbay,eby,2016-02-25 07:54,2016-02-25 07:54,msr,w4w,Friend plus More,"
Hi am Erica and am bi. I am looking for a bi or lesbian friend to have fun with me. Not just to fuck with but also to hang and have fun with. Someone active, caring and not afraid to be themself and not afraid to play with toys. A few months ago I found out I have a leg muscle problem, so if you like to work out that's a plus. I could use the help getting stronger. I prefer a Asian or Latina but all down to give people a shot. I don't judge.
If you want to know more hit me up, but if you already have a guy please don't respond.
Females Only!!!!
A pic for a pic
If you respond please be serious about meeting sometimes, not here for a internet relationship
Put Friends Plus More in the subject line, and send a little info about yourself
",23,average,2 big pieces,,,never,never,,Black,,,,," 5'4"" (162cm)",,,,,,,,,,,,,,,,
http://sfbay.craigslist.org/eby/w4w/5455558775.html,sfbay,eby,2016-02-19 13:16,2016-02-25 07:33,msr,w4w,Asian barbie wants to play,"
I'm here looking for female friends to start. I'm single, mixed Asian gal, bisexual, very femme, very fit with long dark hair. Most of my friends are all married with kids so I'm gonna try CL to see if there's any 20 or 30 something girly femme girls who are openminded, down to earth and believe in work hard party harder mentality. Things I like to do for fun: dance, go to the beach, attend music/art events, wine festivals, farmers markets, 420 friendly. If you can relate, please write me back. Burner pals are a plus. You can never have too many friends right? I'm pretty outgoing looking for the same. I model part time. I'm health and environmentally conscious looking for a partner in crime. No divas, attached men/women or BBW. Please send a pic with your reply so I know you're a real female. Thank you.
",,,,,,,,,,,,,,,,,,,,,,,,,,,,,,
http://sfbay.craigslist.org/sby/w4w/5463847883.html,sfbay,sby,2016-02-25 06:04,2016-02-25 06:41,msr,w4w,My first time wanting to be with a girl!,"
Hey ladies. I am married and my husband knows that I would love to experience being with a girl. I am bi-curious and I would love to see where this goes. You must send a picture in the first email and I will send one to you. Must be willing to voice verify.no couples. I am a curvy girl and looking for a curvy girl as well. Please put your bra size in the subject line so I know you are a real person.
",,,,,,,,,,,,,,,,,,,,,,,,,,,,,,
http://sfbay.craigslist.org/sby/w4w/5463718435.html,sfbay,sby,2016-02-25 01:48,2016-02-25 01:48,msr,w4w,TO ALL MY THICK WOMEN...,"
To all the thick ladies out there... 
Im looking for someone to get to know.
Lets meet and chat over coffee or drinks.

No couples, men, butch , fwb, crazies or married women!!!

You be, sweet, sub, fem, gainfully employed
Send a pic, no pic no response.. Looking forward to hear frm you.
XO
",27,average,,,,,,,,,,,," 5'9"" (175cm)",,,,,,,,,,,,,,single,,
http://sfbay.craigslist.org/eby/w4w/5450778905.html,sfbay,eby,2016-02-16 11:43,2016-02-25 00:12,msr,w4w,any girls awake? play with me,"
kik me please. Text me. I like glitter/sparkling things I'm super girly :)
let's go to the mall and watch a moviefriends outside the room. and discreet in the room. please be to host or willing to go to the hot tub spa over the weekend. 
mwah
can I be your Princess?
",27,,,,,,,,,,,,," 5'2"" (157cm)",,,,,,,,,,,,,,partnered,,
